attendance,clarityColor,easyColor,helpColor,helpCount,id,notHelpCount,onlineClass,quality,rClarity,rClass,rComments,rDate,rEasy,rEasyString,rErrorMsg,rHelpful,rInterest,rOverall,rOverallString,rStatus,rTextBookUse,rTimestamp,rWouldTakeAgain,sId,takenForCredit,teacher,teacherGrade,teacherRatingTags,unUsefulGrouping,usefulGrouping
N/A,good,average,good,0,21247078,0,,awesome,5,T1702,"Great Prof, extremely personable and super nice. Always approachable about questions and just to chat with. Tough marker but understands personal circumstances.",01/11/2013,3.0,3.0,,5,It's my life,5.0,5.0,1,Yes,1357919777000,N/A,1484,N/A,,N/A,[],people,people
N/A,good,good,good,0,17720972,0,,awesome,5,HIST1300,"I dont understand why everyones hating on Timbers, I had her for my 1st year history at Trent and she was huge at getting me acquainted to university quality research. Helpful when I was in a jam also. Dont be intimidated, while she can seem a little scary sometimes shes actually pretty cool",11/02/2010,4.0,4.0,,5,It's my life,5.0,5.0,1,Yes,1288721091000,N/A,1484,N/A,,N/A,[],people,people
N/A,average,good,average,0,17455490,0,,poor,2,HIST3000,"&quot;Guest&quot; prof at Trent University.  Knows her subject, but does not know how to convey it to students.  Unrealistic marker and offers no constructive criticism to explain the low marks.  Requires students to purchase out-of-print books beyond the required text in syllabus.  Time-consuming and expensive.  Condescending in seminar.  AVOID!",07/27/2010,4.0,4.0,,2,Really into it,2.0,2.0,1,Yes,1280263429000,N/A,1484,N/A,,N/A,[],people,people
N/A,average,average,average,0,17396799,0,,average,3,HIS243,"Boring, went about the subject matter in an inefficient way. Too much attention to paintings and anecdotes (not very helpful ones either) and not enough to facts.",07/07/2010,3.0,3.0,,2,Really into it,2.5,2.5,1,Yes,1278497834000,N/A,1484,N/A,,N/A,[],people,people
N/A,poor,good,poor,0,17010904,0,,awful,1,HIS245,"She needs to lay of the WIKIPEDIA for a change, why you ask&#63;.. because she can't lecture..",04/17/2010,5.0,5.0,,1,Meh,1.0,1.0,1,No,1271484830000,N/A,1484,N/A,,N/A,[],people,people
N/A,good,average,good,0,16977219,0,,awesome,5,HIS243,"WHAT an amazing professor. Timbers is one of the clearest speakers I know. She inspired me to pursue more history courses in Early Modern Europe. She has a great sense of humour and she can teach very well, even to a novice like me. I would recommend any class by her.",04/11/2010,2.0,2.0,,5,Low,5.0,5.0,1,No,1270946871000,N/A,1484,N/A,,N/A,[],people,people
N/A,good,average,good,0,16024467,0,,awesome,5,HIS243H,"She is an exceptional prof! Her lectures are very comprehensive as well as interesting. She is also very helpful and always wanting to involve the class, so as to not make students feel bored. I'm just disappointed that I had to take this course in the summer and wasn't able to during normal school term! ps saved money not having required textbook.",07/08/2009,3.0,3.0,,4,Really into it,4.5,4.5,1,No,1247076203000,N/A,1484,N/A,,N/A,[],people,people
