attendance,clarityColor,easyColor,helpColor,helpCount,id,notHelpCount,onlineClass,quality,rClarity,rClass,rComments,rDate,rEasy,rEasyString,rErrorMsg,rHelpful,rInterest,rOverall,rOverallString,rStatus,rTextBookUse,rTimestamp,rWouldTakeAgain,sId,takenForCredit,teacher,teacherGrade,teacherRatingTags,unUsefulGrouping,usefulGrouping
Mandatory,good,average,good,0,30757578,1,,awesome,5,SCS2023,Best teacher I have had in my life! The technical analysis course is amazing.,11/19/2018,3.0,3.0,,5,N/A,5.0,5.0,1,Yes,1542651703000,Yes,1484,Yes,,N/A,"['Inspirational', 'Amazing lectures', 'Hilarious']",person,people
Mandatory,good,average,good,0,29424414,4,,awesome,5,SCS3331,His bitcoin course is the best and he is the best instructor in my life. Will take his technical and fundamental analysis course.,01/09/2018,3.0,3.0,,5,N/A,5.0,5.0,1,No,1515531111000,Yes,1484,N/A,,A+,"['Amazing lectures', 'Inspirational']",people,people
Mandatory,good,average,good,0,28850871,1,,awesome,5,SCS2023,excellent course and will take his algo trading workshop,11/07/2017,3.0,3.0,,5,N/A,5.0,5.0,1,Yes,1510066104000,Yes,1484,Yes,,N/A,['Inspirational'],person,people
Mandatory,good,average,good,1,26532283,0,,awesome,4,SCS2336,His classes are very informal and his lectures and notes are helpful so that I don't have to read everything from scratch.  I will definitely take his level 2 course.,05/10/2016,2.0,2.0,,5,N/A,4.5,4.5,1,Yes,1462912611000,Yes,1484,N/A,,N/A,"['Tough grader', 'Amazing lectures']",people,person
Not Mandatory,good,average,good,2,26525046,0,,good,4,SCS2336,"Took this guy's technical analysis course and option course before and the FRM is the third one. Overall the FRM course is less exciting which is expected as an exam prep course. Overall I like his course bcoz he brings in his front-line working experiences into the lecture as well, rather than just pure academic. But you'll needa put the work in!",05/10/2016,3.0,3.0,,4,N/A,4.0,4.0,1,Yes,1462881520000,N/A,1484,N/A,,N/A,"['Participation matters', 'Caring', 'Lots of homework']",people,people
Not Mandatory,average,good,average,2,26510730,0,,good,3,SCS2336,"Just completed the FRM level I course with this instructor. To be fair, I like the handout format better than presentation because I would not have time to read the textbook again for sure. So his handout provides a good background for you to learn the concept quickly and then DO LOTS OF EXERCISE QUESTIONs! As the ultimate goal is to PASS THE TEST!",05/09/2016,4.0,4.0,,4,N/A,3.5,3.5,1,Yes,1462790453000,N/A,1484,N/A,,N/A,"['Inspirational', 'Tough grader', 'Lots of homework']",people,people
Mandatory,good,good,good,0,26432906,0,,awesome,5,SCS2336,He is very knowledgeable about the subject and he brings a lot of real-life experience to the course.,05/02/2016,4.0,4.0,,5,N/A,5.0,5.0,1,No,1462149555000,N/A,1484,N/A,,Audit/No Grade,"['Tough grader', 'Inspirational', 'Amazing lectures']",people,people
Not Mandatory,poor,average,poor,4,24413747,4,,poor,1,SCS2336,This guy speaks very rapidly with quite thick Chinese accent which makes him tough to understand. The information he is giving is copied from the text book and he is basically reading from the board the stuff you could find in the book by yourself. Wouldn't recommend to anyone.,02/25/2015,3.0,3.0,,2,It's my life,1.5,1.5,1,Yes,1424903546000,N/A,1484,N/A,,N/A,['Lecture heavy'],people,people
N/A,poor,average,poor,3,24413744,0,,poor,1,SCS2336,"I took his course Passing the Financial Risk Management exams. His speech is very unstructured. He has heavy accent.  He doesn't use any presentations, but he is using printouts, which are sometimes copy-past from Schweser book in a very brief format. ",02/25/2015,3.0,3.0,,2,Low,1.5,1.5,1,No,1424903504000,N/A,1484,N/A,,N/A,[],people,people
