attendance,clarityColor,easyColor,helpColor,helpCount,id,notHelpCount,onlineClass,quality,rClarity,rClass,rComments,rDate,rEasy,rEasyString,rErrorMsg,rHelpful,rInterest,rOverall,rOverallString,rStatus,rTextBookUse,rTimestamp,rWouldTakeAgain,sId,takenForCredit,teacher,teacherGrade,teacherRatingTags,unUsefulGrouping,usefulGrouping
Mandatory,good,good,good,1,25628367,0,,good,4,ENG323,"Prof. Robinson is so nice and approachable. That's the best thing about her. She just has a lot of work ... like pop quizzes, and is a tough marker overall. But she's clear and concise on what she expects and what she teaches. She also does a lot of cool stuff (like movies and other things). ",12/10/2015,4.0,4.0,,4,Really into it,4.0,4.0,1,Yes,1449757066000,N/A,1484,Yes,,N/A,"['Beware of pop quizzes', 'Group projects', 'Tough grader']",people,person
N/A,good,good,good,0,24841512,0,,awesome,5,ENG314,"All profs at U of T should be like professor Robinson. She works for her students and makes you want to work, too.   She is super helpful with discussing ideas and with writing, and her classes are fun and rewarding.",05/15/2015,4.0,4.0,,5,Really into it,5.0,5.0,1,Yes,1431709335000,N/A,1484,Yes,,N/A,"['Caring', 'EXTRA CREDIT', 'Gives good feedback']",people,people
N/A,good,good,good,0,24497562,0,,awesome,5,ENG445,"Amazing professor, she approached the classes with so much passion and enthusiasm- Its difficult to not enjoy it as much as she does. That being said, she's a super hard marker so make sure you don't have any typos. See her during office hours for feedback, she's always helpful",03/24/2015,4.0,4.0,,5,It's my life,5.0,5.0,1,Yes,1427232455000,N/A,1484,Yes,,N/A,"['Amazing lectures', 'Clear grading criteria', 'Participation matters']",people,people
N/A,good,good,good,0,24464178,0,,awesome,5,ENG314,"Fantastic class! the material she chose for us to read was phenomenal and really really enjoyable. Beware though, she is a TOUGH grader and takes marks off even for the smallest of spelling errors.",03/16/2015,4.0,4.0,,5,It's my life,5.0,5.0,1,Yes,1426464038000,N/A,1484,Yes,,N/A,"[""Skip class? You won't pass."", 'Tough grader']",people,people
N/A,good,good,good,1,23145176,0,,awesome,5,ENG308,This was a phenomenal class!,05/01/2014,4.0,4.0,,5,Really into it,5.0,5.0,1,Yes,1398978317000,N/A,1484,N/A,,A,[],people,person
N/A,good,average,good,0,21891383,0,,awesome,5,ENG308,AMAZING professor. I looked forward to her classes. She's really knowledgeable and enjoys what she does.,06/13/2013,2.0,2.0,,5,Really into it,5.0,5.0,1,Yes,1371157890000,N/A,1484,N/A,,N/A,[],people,people
N/A,good,average,good,0,21783650,0,,awesome,5,ENG445,"Professor Robinson is really great. She is incredibly organized, and her lectures are informative and very interesting.",05/17/2013,2.0,2.0,,5,It's my life,5.0,5.0,1,Yes,1368805280000,N/A,1484,N/A,,N/A,[],people,people
N/A,average,good,average,1,21596735,3,,average,3,ENG308,"Good prof, interesting course, but most of your grade comes from rote memorization as opposed to analytical writing. Four quizzes and half of the midterm consisted of pure memorization work. I dont think this is an appropriate way to assess students at a third year level",04/24/2013,4.0,4.0,,2,Sorta interested,2.5,2.5,3,Yes,1366821344000,N/A,1484,N/A,,N/A,[],people,person
N/A,good,good,good,0,21477238,0,,awesome,5,ENG323,"Expect a lot of readings (more than usual) and keep up with them, or you'll find it easy to fall behind. Study for the quizzes (they are really easy if you remember the names and places of the text). Would highly recommend.",04/02/2013,4.0,4.0,,5,Sorta interested,5.0,5.0,1,Yes,1364931919000,N/A,1484,N/A,,N/A,[],people,people
