attendance,clarityColor,easyColor,helpColor,helpCount,id,notHelpCount,onlineClass,quality,rClarity,rClass,rComments,rDate,rEasy,rEasyString,rErrorMsg,rHelpful,rInterest,rOverall,rOverallString,rStatus,rTextBookUse,rTimestamp,rWouldTakeAgain,sId,takenForCredit,teacher,teacherGrade,teacherRatingTags,unUsefulGrouping,usefulGrouping
Mandatory,good,average,good,0,30823343,0,,good,4,HI224,"Dr. Han is an amazing Prof that really cares about her students and what she teaches! Beware : Take alot of what she says about China with a Grain of Salt she is heavily Biased towards them and to her can do wrong, which is not always the case. Other then that she is super great and I love taking her classes",11/30/2018,3.0,3.0,,4,N/A,4.0,4.0,1,Yes,1543570609000,Yes,1484,Yes,,N/A,"['Get ready to read', 'Caring', 'Accessible outside class']",people,people
Mandatory,good,average,good,1,29167610,0,,awesome,5,HI121,"Dr. Han's HI121 course at the Brantford campus was amazing! She is such a caring teacher, really easy to talk to, and the material itself is interesting and informative. Highly recommend.",12/13/2017,3.0,3.0,,5,N/A,5.0,5.0,1,Yes,1513124446000,Yes,1484,Yes,,N/A,"['Inspirational', 'Caring', 'Lecture heavy']",people,person
Not Mandatory,good,poor,good,0,28489847,0,,awesome,5,HI199,Say no more. Best.,06/27/2017,1.0,1.0,,5,N/A,5.0,5.0,1,No,1498580479000,Yes,1484,Yes,,A+,"['Respected', 'Gives good feedback', 'Caring']",people,people
Mandatory,good,average,good,1,26753545,0,,awesome,5,HI199,"Christina Han is one of my favourite professors at Wilfrid Laurier Brantford Campus. She cares about students and is willing to meet outside of office hours if necessary to help you. Interesting lectures, and assigns lots of readings, but gives ample opportunities to succeed in and out of classroom. She is also an extremely kind person. Loved her!",06/23/2016,2.0,2.0,,5,N/A,5.0,5.0,1,Yes,1466720678000,Yes,1484,N/A,,N/A,"['Get ready to read', 'Caring', 'Gives good feedback']",people,person
N/A,good,poor,good,0,24359212,0,,awesome,5,HI199,Great prof who is very optimistic and friendly to all.,02/04/2015,1.0,1.0,,5,Really into it,5.0,5.0,1,Yes,1423066897000,N/A,1484,Yes,,N/A,"[""Skip class? You won't pass."", 'Participation matters', 'Respected']",people,people
N/A,good,poor,good,0,21939838,0,,awesome,5,EAS105H,Great optimistic prof. I like her student-teacher connection. Very clear too.,07/02/2013,1.0,1.0,,5,Sorta interested,5.0,5.0,1,No,1372767064000,N/A,1484,N/A,,N/A,[],people,people
N/A,good,average,good,0,21528327,0,online,awesome,5,EAS105,"Shes a friendly, happy approachable professor.",04/12/2013,3.0,3.0,,4,It's my life,4.5,4.5,1,Yes,1365802635000,N/A,1484,Yes,,N/A,[],people,people
