attendance,clarityColor,easyColor,helpColor,helpCount,id,notHelpCount,onlineClass,quality,rClarity,rClass,rComments,rDate,rEasy,rEasyString,rErrorMsg,rHelpful,rInterest,rOverall,rOverallString,rStatus,rTextBookUse,rTimestamp,rWouldTakeAgain,sId,takenForCredit,teacher,teacherGrade,teacherRatingTags,unUsefulGrouping,usefulGrouping
Mandatory,good,good,good,0,31578855,0,,awesome,5,RLG202,"Professor Green is purely a breath of fresh air. He is kind, sincere, humble, and very friendly and personable. His intellect is to be reckoned with. He is also very professional and responsible. He's a straight shooter. His lectures are so organized and have a coherent flow. I loved the assignments. He also has a very warm presence. ALWAYS smiling",04/12/2019,4.0,4.0,,5,N/A,5.0,5.0,1,Yes,1555029556000,Yes,1484,Yes,,Not sure yet,"['Inspirational', 'Caring', 'Lecture heavy']",people,people
N/A,good,good,good,2,21577920,0,,awesome,4,RLG202,"He is the NICEST professor ever. He makes you want to come to class because he's just always so happy. He REALLY knows his stuff. He talks very fast so I recommend you type your notes, even record lectures if you missed something. But he provides lists which are easy to follow. Totally taking another class with him!",04/22/2013,4.0,4.0,,5,Really into it,4.5,4.5,1,Yes,1366633586000,N/A,1484,N/A,,N/A,[],people,people
N/A,good,average,average,0,11309736,0,,average,4,RLG202,"Green is the type of teacher that you need to listen to in class. Try your best to take down everything he says. His tests are repeated yearly and you should always remember to take notes on the lists that he dictates - very important. Before your tests in this class make sure you get his previous tests, because he usually keeps the same tests.",01/05/2006,2.0,2.0,,2,Really into it,3.0,3.0,1,N/A,1136484631000,N/A,1484,N/A,,N/A,[],people,people
N/A,average,good,average,0,10416290,0,,average,2,RLG202,"Professor Green could SLOW DOWN a bit; paces and verbalizes a lot! High expectations and amount of reading for a second year course.  Books too expensive - help! However, an extremely intelligent, passionate, knowledgable and friendly Prof.  Did his best to answer questions during lectures even though they interrupted his (rapid) train of thought.",09/15/2005,4.0,4.0,,3,It's my life,2.5,2.5,1,N/A,1126746589000,N/A,1484,N/A,,N/A,[],people,people
N/A,average,good,average,0,2106236,2,,average,3,RLG202,"RLG 202 was quite difficult for a second year course. Green assigns work that requires rote memorization of seemingly endless lists. A more conceptual approach focussed on encouraging an understanding of broad his., rlg. & phil. concepts would be better.",05/07/2004,5.0,5.0,,3,N/A,3.0,3.0,1,N/A,1083935006000,N/A,1484,N/A,,N/A,[],people,people
N/A,good,average,good,0,2029726,0,,good,4,RLG202,"Prof. Green is very familiar with the material he teaches. He really gets into his lectures, i.e. no monotony. Lots of material covered on the term tests and the essays really get you thinking but the quality of the learning experience is worth it.",04/25/2004,2.0,2.0,,4,N/A,4.0,4.0,1,N/A,1082923025000,N/A,1484,N/A,,N/A,[],people,people
N/A,good,average,good,0,1003261,0,,awesome,4,RLG201,No Comments,06/06/2003,3.0,3.0,,5,N/A,4.5,4.5,1,N/A,1054926584000,N/A,1484,N/A,,N/A,[],people,people
