attendance,clarityColor,easyColor,helpColor,helpCount,id,notHelpCount,onlineClass,quality,rClarity,rClass,rComments,rDate,rEasy,rEasyString,rErrorMsg,rHelpful,rInterest,rOverall,rOverallString,rStatus,rTextBookUse,rTimestamp,rWouldTakeAgain,sId,takenForCredit,teacher,teacherGrade,teacherRatingTags,unUsefulGrouping,usefulGrouping
N/A,good,poor,good,0,32931824,0,,awesome,5,QNM222,Professor Shamim is very knowledgeable about the course and she knows how to engage every one in class. She is a fair marker too. Take her and you will never regret it.,02/25/2020,1.0,1.0,,5,N/A,5.0,5.0,1,Yes,1582656406000,Yes,1484,Yes,,N/A,"['Amazing lectures', 'Gives good feedback', 'Clear grading criteria']",people,people
N/A,good,average,good,1,32040653,0,,awesome,5,QMS202,A knowledgeable and caring professor,06/19/2019,2.0,2.0,,5,N/A,5.0,5.0,1,Yes,1560957055000,Yes,1484,Yes,,N/A,"['Caring', 'Respected', 'Get ready to read']",people,person
Not Mandatory,good,average,good,5,31752028,3,,awesome,5,QMS202,Good teacher!,05/02/2019,2.0,2.0,,5,N/A,5.0,5.0,1,Yes,1556835487000,Yes,1484,Yes,,N/A,[],people,people
Not Mandatory,good,average,good,6,31751894,3,,awesome,5,QMS202,Professor Shamim knows what she teaches. Explains every topic in detail and gives good grades. I learned a lot from her. Great professor!,05/02/2019,2.0,2.0,,5,N/A,5.0,5.0,1,Yes,1556834919000,Yes,1484,Yes,,A,"['Respected', 'Lots of homework', 'Clear grading criteria']",people,people
Not Mandatory,good,average,good,7,31644701,7,,awesome,5,QMS202,Great Professor! Always available to help. Just ask her if you have any questions. Meet her during office hours. Study from the textbook and you should be fine.,04/22/2019,2.0,2.0,,5,N/A,5.0,5.0,1,Yes,1555961425000,Yes,1484,Yes,,N/A,"['Accessible outside class', 'Respected', 'Caring']",people,people
Not Mandatory,good,average,good,8,31629295,9,,awesome,5,QMS202,"Great professor. One of the best at Ryerson who cares about her students. The course is boring but she explains everything in class, provides practice questions , helps with online assignments.",04/19/2019,2.0,2.0,,5,N/A,5.0,5.0,1,Yes,1555679681000,Yes,1484,Yes,,A-,"['Gives good feedback', 'Accessible outside class', 'Get ready to read']",people,people
Not Mandatory,good,average,good,8,31598138,8,,awesome,5,QMS202,Prof. Shamim is great. She teaches well and her tests are fair. She explains material clearly.,04/15/2019,2.0,2.0,,5,N/A,5.0,5.0,1,Yes,1555363917000,Yes,1484,Yes,,A,"['Respected', 'Caring', 'Clear grading criteria']",people,people
Not Mandatory,average,average,average,7,31482366,10,,poor,2,QMS202,not good at teaching. avoid,03/26/2019,3.0,3.0,,2,N/A,2.0,2.0,1,Yes,1553627686000,No,1484,Yes,,B,[],people,people
Not Mandatory,good,poor,good,10,30929537,10,online,awesome,5,QMS202,Great prof make sure to take her for QMS and it will be a breeze I finished with a 93 and she thought all the content thoroughly. BLESSES PROF,12/09/2018,1.0,1.0,,5,N/A,5.0,5.0,1,Yes,1544351406000,Yes,1484,Yes,,A+,"['Respected', 'Gives good feedback', 'Hilarious']",people,people
