attendance,clarityColor,easyColor,helpColor,helpCount,id,notHelpCount,onlineClass,quality,rClarity,rClass,rComments,rDate,rEasy,rEasyString,rErrorMsg,rHelpful,rInterest,rOverall,rOverallString,rStatus,rTextBookUse,rTimestamp,rWouldTakeAgain,sId,takenForCredit,teacher,teacherGrade,teacherRatingTags,unUsefulGrouping,usefulGrouping
Not Mandatory,good,good,good,0,30292007,0,,good,4,PHY456,"Good Prof, I had him for a grad course which was not listed in the options above. He has excellent diction and explains concepts very well. He is a bit intimidating and his assignments are exceptionally difficult though.",06/24/2018,5.0,5.0,,4,N/A,4.0,4.0,1,No,1529846851000,Yes,1484,Yes,,A-,[],people,people
Not Mandatory,average,good,average,0,22679644,0,,average,3,PHY456,"He uses the exact same lecture notes and problem sets for his graduate quantum mechanics course. His notes are very organized, and he is happy to answer questions. However, he might appear quite emotionless and cold, and smile strangely, so one may feel intimidated. His exam was based closely on homework.",12/31/2013,4.0,4.0,,3,It's my life,3.0,3.0,1,Yes,1388519211000,N/A,1484,N/A,,N/A,[],people,people
N/A,average,good,poor,0,10979766,0,,poor,2,PHY355,His exams are brutal. We had to do a remake because the class average was ~20%. He doesn't seem to really care about anything. It appears he would rather spend his time on research rather than teaching.,11/23/2005,5.0,5.0,,1,Really into it,1.5,1.5,1,N/A,1132772926000,N/A,1484,N/A,,N/A,[],people,people
N/A,average,good,average,0,10415162,1,,poor,2,PHYS355,only 2 people passed the midterm he gave....bloody tough exams,09/14/2005,5.0,5.0,,2,Really into it,2.0,2.0,1,N/A,1126727735000,N/A,1484,N/A,,N/A,[],person,people
N/A,average,good,average,0,780610,0,,poor,2,PHY355,"Sajeev is an emotionless robot.  Instead of coffee in his mug, he takes pure oil, black as the night.",04/03/2003,5.0,5.0,,2,N/A,2.0,2.0,1,N/A,1049329496000,N/A,1484,N/A,,N/A,[],people,people
