attendance,clarityColor,easyColor,helpColor,helpCount,id,notHelpCount,onlineClass,quality,rClarity,rClass,rComments,rDate,rEasy,rEasyString,rErrorMsg,rHelpful,rInterest,rOverall,rOverallString,rStatus,rTextBookUse,rTimestamp,rWouldTakeAgain,sId,takenForCredit,teacher,teacherGrade,teacherRatingTags,unUsefulGrouping,usefulGrouping
N/A,poor,good,poor,0,16270009,0,,awful,1,MGY311,"When he says you have to read the assigned article cuz there will be a question on the paper, just ignore and do something more meaningful as many of us who actually did so absolutely wasted our valuable time.",10/25/2009,5.0,5.0,,1,Meh,1.0,1.0,1,No,1256436505000,N/A,1484,N/A,,N/A,[],people,people
N/A,poor,good,poor,0,15554266,0,,awful,1,MGY311,"simply bad, plus too busy to actually give a damn to you",03/22/2009,5.0,5.0,,1,Meh,1.0,1.0,1,No,1237687089000,N/A,1484,N/A,,N/A,[],people,people
N/A,poor,good,poor,0,15554265,0,,awful,1,MGY311,"Worst professor for the course, right next to Pearson. Teaches you things he likes, tests you on something else. Don't even bother listening to lecture recordings or so. Classes are useless, just memorize all the letters on the slides then you may end up doing well, if you're 'creative' enough.",03/22/2009,5.0,5.0,,1,Meh,1.0,1.0,1,No,1237687002000,N/A,1484,N/A,,N/A,[],people,people
N/A,good,good,average,0,13766454,0,,average,4,MGY311,He's very smart!,12/06/2007,4.0,4.0,,2,Really into it,3.0,3.0,1,No,1196982794000,N/A,1484,N/A,,N/A,[],people,people
N/A,poor,average,poor,0,10551534,0,,awful,1,MGY311,"Aled Edwards, what can you say... other than I could not care less about the crystal structures of transcription factors... one good thing about class was a good nap and a bit of entertainment (chalk throwing, and jumping off chairs), but please put on some shoes and buy a shirt without holes! he is a millionaire!",10/04/2005,3.0,3.0,,1,Meh,1.0,1.0,1,N/A,1128445692000,N/A,1484,N/A,,N/A,[],people,people
N/A,average,average,average,0,3875695,0,,average,3,MGY311,"Edwards wasn't bad, he did a lot of &quot;free&quot; lecturing that left you going &quot;huh&quot; sometimes.  Assigned a huge stack of papers to read but conveniently forgot to test us on it.  His multiple choice were funny (both &quot;haha&quot; and &quot;huh&quot;).",05/17/2005,2.0,2.0,,3,Sorta interested,3.0,3.0,1,N/A,1116334522000,N/A,1484,N/A,,N/A,[],people,people
N/A,good,good,good,0,3750060,0,,awesome,5,MGY311,"Come on, he is not that bad. Very funny and easy-going.",04/30/2005,4.0,4.0,,5,It's my life,5.0,5.0,1,N/A,1114868755000,N/A,1484,N/A,,N/A,[],people,people
N/A,average,average,average,0,1799970,0,,average,3,MGB311,Full of himself fairly smart but his test rated your ability to remember assinine details.,03/11/2004,3.0,3.0,,2,N/A,2.5,2.5,1,N/A,1079046152000,N/A,1484,N/A,,N/A,[],people,people
N/A,average,good,poor,0,1315159,0,,poor,2,MGB311,No Comments,11/13/2003,5.0,5.0,,1,N/A,1.5,1.5,1,N/A,1068690731000,N/A,1484,N/A,,N/A,[],people,people
