attendance,clarityColor,easyColor,helpColor,helpCount,id,notHelpCount,onlineClass,quality,rClarity,rClass,rComments,rDate,rEasy,rEasyString,rErrorMsg,rHelpful,rInterest,rOverall,rOverallString,rStatus,rTextBookUse,rTimestamp,rWouldTakeAgain,sId,takenForCredit,teacher,teacherGrade,teacherRatingTags,unUsefulGrouping,usefulGrouping
Mandatory,good,average,good,0,32807785,0,,good,4,ECO331,Con: Speaks way too fast. Pros: Extremely approachable and explains very well. Mcneill is a solid choice,01/07/2020,3.0,3.0,,4,N/A,4.0,4.0,1,No,1578439170000,Yes,1484,No,,B+,"['Clear grading criteria', 'Accessible outside class', 'Caring']",people,people
Mandatory,poor,good,poor,0,32080833,0,,awful,1,ECO380,Worst Prof I ever had at UofT. His teaching style is fundamentally flawed and incentivizes cheating. Pray for your life that you get a curve. Avoid him AT ALL COST.,07/06/2019,5.0,5.0,,1,N/A,1.0,1.0,1,No,1562454304000,No,1484,Yes,,N/A,[],people,people
Mandatory,average,good,average,2,31937731,4,,average,3,ECO200,"I believe Professor McNeil was made in an economics laboratory. He is the most average professor possible. His lectures are fine. His grading is fine. His extra assistance is fine. He doesn't go above and beyond to provide extra assistance, but he provides some. He is lecture slides aren't incredibly clear, but you can make sense of them. He's fine",05/23/2019,4.0,4.0,,3,N/A,3.0,3.0,1,No,1558574084000,No,1484,Yes,,A,"['Accessible outside class', 'Test heavy', ""Skip class? You won't pass.""]",people,people
N/A,poor,good,poor,3,31850946,1,,awful,1,ECO200,"the worst professor in the economics department, i used all the resources possible, repeated past exams, practice questions, did everything possible and still got a subpar grade. the entire lecture was neglected resources. 0/10 recommend and avoid at all costs",05/12/2019,5.0,5.0,,1,N/A,1.0,1.0,1,No,1557681700000,No,1484,Yes,,N/A,"['Graded by few things', 'Tough grader', 'Test heavy']",person,people
Mandatory,average,good,average,3,31770560,0,,poor,2,ECO200Y1Y,"An incompetent, uncaring prof. His lectures are bad (speaks too fast). He is uncaring in many ways, such as posting the slides literally 3 hours before we need them, making it hard for us to print them. His tests are pretty difficult, so gotta work for success. His one-to-one explanations are great, however, so going to his office hours helps.",05/04/2019,4.0,4.0,,2,N/A,2.0,2.0,1,No,1557004698000,No,1484,Yes,,A-,"['Participation matters', 'Tough grader', 'Test heavy']",people,people
Mandatory,average,good,average,1,31742080,0,,average,3,ECO200,"To his credit, Prof. McNeill is a great lecturer. He explains the basic concepts really well, however his exams are a whole other story. He likes to throw curveball questions that aren't on tutorial problem sets or previous exams, meaning you have to be quite solid on the conceptual foundations of the content in order to do well on the exams.",05/02/2019,4.0,4.0,,3,N/A,3.0,3.0,1,No,1556768709000,Yes,1484,Yes,,N/A,"['Test heavy', 'Tough grader']",people,person
Mandatory,average,good,average,1,31579490,1,,average,3,ECO200,"charming prof, despite a harsh marking scheme and difficult midterm structure, really think he receives more slack than he deserves. Stays beyond office hour time to advise on materials outside of class material. Took his class for both 200 and 210 and can say that I genuinely enjoyed both courses",04/12/2019,4.0,4.0,,3,N/A,3.0,3.0,1,No,1555034846000,Yes,1484,Yes,,N/A,"['Lecture heavy', 'Tough grader', 'Accessible outside class']",person,person
Not Mandatory,average,good,average,0,31546881,1,,poor,2,ECO200,"handsome guy but like one UofT redditor puts it, he's a proper stalinist. having said that, he will probably leave you at a better place in microeconomics",04/08/2019,5.0,5.0,,2,N/A,2.0,2.0,1,No,1554688634000,No,1484,Yes,,N/A,[],person,people
Not Mandatory,poor,good,poor,2,31546823,0,,awful,1,ECO200,"His inexperience shines through, be it vague/unnecessary slides/lectures, shallow reviews/tutorials and his inability to handle the student-prof dynamic. You're totally on your own and don't you dare think you have it under control because the resources you have to work with pales in comparison to actual evaluations.",04/08/2019,5.0,5.0,,1,N/A,1.0,1.0,1,No,1554687969000,No,1484,Yes,,B+,"['Tough grader', 'Test heavy']",people,people
N/A,average,good,average,1,31543899,0,,average,3,ECO200,"He is a very nice and funny prof. However, be prepared for types of test questions and situations within those questions that haven't shown up in class or practice problems. The marking is also quite stringent.",04/07/2019,4.0,4.0,,3,N/A,3.0,3.0,1,Yes,1554604306000,No,1484,Yes,,B+,"['Tough grader', ""Skip class? You won't pass."", 'Test heavy']",people,person
Mandatory,poor,good,poor,2,31471435,0,,awful,1,ECO200Y1Y,"Bad. His lectures are mediocre at best, and he is super irresponsible regarding email response and provides minimal assistance regarding practice questions. He is still pretty helpful in one-to-one conversation, so asking questions in person would be a good strategy. Having said that, it requires lots of techniques to get good grades in his class.",03/24/2019,5.0,5.0,,1,N/A,1.0,1.0,1,Yes,1553400328000,No,1484,Yes,,INC,"['Accessible outside class', 'Test heavy', 'Tough grader']",people,people
Mandatory,poor,good,poor,4,31398656,0,,awful,1,ECO380,"his midterm consists of stuff you have not seen in class or any of the practice problems. For the sake of an example, for last midterm he posted a practice midterm of his,which had 4 questions with 100 min time limit, but the actual midterm turned out to have 6 questions(with much longer parts) and 90 mins. Cruel",03/03/2019,4.0,4.0,,1,N/A,1.0,1.0,1,No,1551585453000,No,1484,Yes,,N/A,"[""Skip class? You won't pass."", 'Participation matters', 'Tough grader']",people,people
Mandatory,poor,good,poor,4,31398540,0,,awful,1,ECO380,"The problem sets, past midterms that he posts are in no way similar to his midterms. The midterm was extremely long, and I ended up getting a low grade eve though I attended every lecture, did perfectly fine in in-class quizzes and finished all the practice questions he has posted. Not a fair professor at all, doesnt care about his students.",03/03/2019,5.0,5.0,,1,N/A,1.0,1.0,1,No,1551580400000,No,1484,No,,N/A,"['Test heavy', 'Tough grader', 'Participation matters']",people,people
Mandatory,poor,good,poor,6,31245184,0,,awful,1,ECO380,"Even if you attended class, made good notes and do all the practice questions/tutorial questions he throws at you, it is almost impossible to finish the midterm exam as he complicates derivatives/numbers on the test which already requires much more time. He adds an insane amount of questions that the exam time just doesn't allow you to finish",01/11/2019,5.0,5.0,,1,N/A,1.0,1.0,1,No,1547236208000,No,1484,Yes,,N/A,"['Test heavy', 'Tough grader', 'Lecture heavy']",people,people
Not Mandatory,good,average,good,1,31099772,15,,awesome,5,ECO380,"I found this course is very useful and interesting. You can really learn things from this course. And for courses with useful knowledge, this one is not hard. Worth to take it!",12/19/2018,3.0,3.0,,5,N/A,5.0,5.0,1,No,1545238334000,Yes,1484,Yes,,N/A,[],people,person
Mandatory,good,good,good,1,31091211,8,,awesome,5,ECO380,"I LOVE HIS CLASS. didn't do too well in the midterm BUT his class is so much fun really. looking for bird courses? dont take this. Looking to ACTUALLY LEARN in the uni? Take it, with him",12/19/2018,4.0,4.0,,5,N/A,5.0,5.0,1,No,1545185544000,Yes,1484,Yes,,B,[],people,person
Mandatory,average,good,average,2,30740120,2,,average,3,ECO200,"Took his ECO200 last year. He would leave some blank slides for you to focus the lectures, and icliker questions during class time also for marks. Tutorial questions would be covered by TAs. Course is hard, need to practice every question on tutorials to get marks.",11/16/2018,5.0,5.0,,3,N/A,3.0,3.0,1,Yes,1542327056000,Yes,1484,Yes,,A,[],people,people
Mandatory,poor,good,poor,9,30615727,2,,awful,1,ECO200,"leave him as far as possible! His class materials are hard to understand, and exams 80% you wont see in his class, weekly practice, and exam practice. If u wanna waste ur money and time, hes the best choice u can have in uoft",10/26/2018,5.0,5.0,,1,N/A,1.0,1.0,1,Yes,1540562726000,No,1484,Yes,,N/A,"['Test heavy', 'Participation matters']",people,people
Mandatory,poor,good,poor,10,30567237,4,,awful,1,ECO380,"Avoid like the plague. Small vicious man who loves to throw his weight around. You will have ZERO material to prepare for. He has not posted a single problem that has a solution all year, midterms are impossible, etc. He will test you on a concept you didn't know existed (nor was taught)",10/14/2018,5.0,5.0,,1,N/A,1.0,1.0,1,No,1539476144000,No,1484,Yes,,N/A,[],people,people
Mandatory,good,poor,good,1,30387190,7,,awesome,5,ECO200,good,07/30/2018,1.0,1.0,,5,N/A,5.0,5.0,1,No,1532978265000,Yes,1484,Yes,,N/A,[],people,person
Mandatory,average,good,average,5,30348621,1,,poor,2,ECO200,"He deliberately makes the slides empty for you to fill in, so if you skip class you won't know anything at all. He doesnt post the complete slides after and expect you to come to class. He loves math so if you are not a math person you are so screwed for the tests. He makes the math part of the test harder, not the actual content parts harder.",07/16/2018,5.0,5.0,,2,N/A,2.0,2.0,1,No,1531755229000,No,1484,Yes,,C,"[""Skip class? You won't pass."", 'Tough grader', 'Lecture heavy']",person,people
Not Mandatory,average,good,average,0,30189453,2,,average,3,ECO200Y,"Like other reviews say, he's unexperienced. His syllabus lacks structure and he provides vague information on what tests and exams are going to be like. Often I'd review everything I though I knew in the course, and it turned out that there was an entire concept that he added on the test that I had not seen in any of the class notes or textbook.",05/25/2018,4.0,4.0,,3,N/A,3.0,3.0,1,Yes,1527253621000,No,1484,Yes,,B-,"['Accessible outside class', 'Test heavy']",people,people
Mandatory,poor,average,poor,5,30106346,2,,awful,1,ECO380,"Inexperienced in teaching! give quiz right after his lecture without any chance for students to digest for knowledge. Moreover, do not release marks for the quizzes and do not release solutions for it. AWFUL!",05/14/2018,3.0,3.0,,1,N/A,1.0,1.0,1,No,1526335193000,No,1484,Yes,,N/A,[],people,people
Mandatory,poor,good,poor,6,29593137,2,,awful,1,ECO200,I honestly can't believe that this guy is UofT prof. I truly think I should be reimbursed for taking this horrible class. I'm really lost for words. Never have I been in such an unorganized class that little-no way of support to the students. Honestly avoid.,02/24/2018,5.0,5.0,,1,N/A,1.0,1.0,1,No,1519480137000,No,1484,Yes,,N/A,"['Test heavy', 'Lots of homework', 'Tough grader']",people,people
Not Mandatory,poor,good,poor,7,29573906,2,,awful,1,ECO380,"Gives very weird quizzes that you must prepare beforehand in class and does it whenever he wants like 30 minutes after class starts or at the end of class or after the end of tutorial. Literally no consistency in timing which is pretty frustrating. And his midterm is unreasonably hard and way too long. Avoid this prof, worst class I've had.",02/17/2018,5.0,5.0,,1,N/A,1.0,1.0,1,No,1518879552000,No,1484,Yes,,N/A,"['Beware of pop quizzes', ""Skip class? You won't pass."", 'Tough grader']",people,people
Mandatory,poor,good,poor,4,29436741,1,,awful,1,ECO200,"Too inexperienced, just skip him.",01/11/2018,5.0,5.0,,1,N/A,1.0,1.0,1,Yes,1515679610000,No,1484,Yes,,N/A,[],person,people
Mandatory,poor,good,poor,4,29436719,1,,awful,1,ECO200,"Never knew how to properly and specifically inform us about his office hours. Sends out practise questions before the tests with many errors, and when he sends out the solutions they're usually filled with mistakes. Doesn't post hw answers, so if u miss tutorial then ur screwed. Slides he posts dont aren't detailed. Oh my goodness, such a bad prof.",01/11/2018,5.0,5.0,,1,N/A,1.0,1.0,1,Yes,1515679450000,No,1484,Yes,,N/A,"[""Skip class? You won't pass.""]",person,people
Mandatory,good,average,good,2,29430550,2,,awesome,5,ECO380,"The lecture slides are clear and well organized although he speaks very fast. Still can get a comparatively good grade even if you are no majoring in economics, so long as you complete every tutorial problems.",01/10/2018,3.0,3.0,,5,N/A,5.0,5.0,1,No,1515603867000,Yes,1484,Yes,,A-,"['Tough grader', 'Caring']",people,people
N/A,good,average,good,3,29317995,2,,awesome,5,ECO200,"Took 200 with him in 2016-17. Great lecturer, knows a lot about the material, very helpful during office hours. But can confirm he talks REALLY fast, be ready to ask him to repeat.",12/22/2017,2.0,2.0,,5,N/A,5.0,5.0,1,Yes,1513959583000,Yes,1484,Yes,,A+,"['Amazing lectures', 'Accessible outside class', 'Inspirational']",people,people
Mandatory,good,average,good,3,29059469,4,,awesome,5,ECO380,"detailed lectures with lots of examples, he speaks clear, but really fast dou, per haps a little too fast, need a good english background",12/06/2017,3.0,3.0,,5,N/A,5.0,5.0,1,No,1512548131000,Yes,1484,Yes,,B+,"['Amazing lectures', 'Hilarious']",people,people
