attendance,clarityColor,easyColor,helpColor,helpCount,id,notHelpCount,onlineClass,quality,rClarity,rClass,rComments,rDate,rEasy,rEasyString,rErrorMsg,rHelpful,rInterest,rOverall,rOverallString,rStatus,rTextBookUse,rTimestamp,rWouldTakeAgain,sId,takenForCredit,teacher,teacherGrade,teacherRatingTags,unUsefulGrouping,usefulGrouping
N/A,good,average,good,0,31450592,0,,awesome,5,DEN211Y,really like dr schure's lectures. tries to make them entertaining. i like that he tries to make sure we understand everything and doesn't just assume we know it. he talks to us not at us.,03/19/2019,3.0,3.0,,5,N/A,5.0,5.0,1,No,1552964835000,Yes,1484,Yes,,N/A,"['Accessible outside class', 'Caring', 'Hilarious']",people,people
Mandatory,good,average,good,0,30385753,0,,awesome,5,PERIO211,"great prof, loved his classes, and a nice guy!",07/30/2018,3.0,3.0,,5,N/A,5.0,5.0,1,No,1532954538000,Yes,1484,Yes,,N/A,"['Amazing lectures', 'Respected', 'Accessible outside class']",people,people
Mandatory,good,average,good,0,29560439,1,,awesome,5,DEN211,very good prof and enjoy his lectures. tries to make things understandable,02/12/2018,3.0,3.0,,5,N/A,5.0,5.0,1,Yes,1518476451000,Yes,1484,Yes,,N/A,['Amazing lectures'],person,people
N/A,good,average,good,0,28970989,0,,awesome,5,PERIO211Y,Best lecturer at the school- wish he taught all our classes,11/27/2017,3.0,3.0,,5,N/A,5.0,5.0,1,Yes,1511808368000,Yes,1484,Yes,,N/A,"['Caring', 'Amazing lectures', 'Inspirational']",people,people
Mandatory,good,average,good,0,28921030,0,,awesome,5,DEN211,i really enjoyed dr schure's perio lectures. very entertaining and clear! really tried to make boring topics more exciting.,11/16/2017,3.0,3.0,,5,N/A,5.0,5.0,1,Yes,1510864860000,Yes,1484,Yes,,N/A,"['Amazing lectures', 'Inspirational', 'Accessible outside class']",people,people
N/A,good,poor,good,0,26352411,1,,awesome,5,DEN211Y,"A+++, excellent lecturer to explain concepts clearly. Helpful in answering questions.",04/21/2016,1.0,1.0,,5,N/A,5.0,5.0,1,No,1461280092000,N/A,1484,Yes,,N/A,"['Amazing lectures', 'Inspirational']",person,people
