attendance,clarityColor,easyColor,helpColor,helpCount,id,notHelpCount,onlineClass,quality,rClarity,rClass,rComments,rDate,rEasy,rEasyString,rErrorMsg,rHelpful,rInterest,rOverall,rOverallString,rStatus,rTextBookUse,rTimestamp,rWouldTakeAgain,sId,takenForCredit,teacher,teacherGrade,teacherRatingTags,unUsefulGrouping,usefulGrouping
Not Mandatory,average,poor,average,0,22394006,0,,good,3,WGST2P91,"enjoyed the class, was very passionate",11/26/2013,1.0,1.0,,4,Sorta interested,3.5,3.5,1,Yes,1385492475000,N/A,1484,N/A,,A-,[],people,people
N/A,good,average,good,0,20654956,0,,good,4,SOC367,"I thought she did a better job than many profs who speak better english than her. Great Class. Interesting perspective from the Prof. She's incredibly helpful as long as you make yourself understood. There is a little bit of a language barrier, but nothing insurmountable. Very passionate about the course material, great syllabus/ course readings.",09/21/2012,3.0,3.0,,4,It's my life,4.0,4.0,1,Yes,1348188181000,N/A,1484,N/A,,N/A,[],people,people
N/A,good,average,good,0,20113866,0,,awesome,4,SOC2RR3,"taught a soc class at mac. pretty good prof, sometimes unclear because english is obviously not her first english but other than that no complaints .",04/24/2012,2.0,2.0,,5,Sorta interested,4.5,4.5,1,Yes,1335305866000,N/A,1484,N/A,,N/A,[],people,people
N/A,good,average,good,0,19887721,0,,awesome,4,SOC367,Passionate and thoughtful. The best professor I have ever had!,03/07/2012,3.0,3.0,,5,Really into it,4.5,4.5,1,Yes,1331121625000,N/A,1484,N/A,,N/A,[],people,people
N/A,poor,average,poor,0,19055712,0,,awful,1,SOC367,"Very difficult to understand, spelling and grammatical errors on slides.",10/09/2011,3.0,3.0,,1,Meh,1.0,1.0,1,No,1318182014000,N/A,1484,N/A,,N/A,[],people,people
