attendance,clarityColor,easyColor,helpColor,helpCount,id,notHelpCount,onlineClass,quality,rClarity,rClass,rComments,rDate,rEasy,rEasyString,rErrorMsg,rHelpful,rInterest,rOverall,rOverallString,rStatus,rTextBookUse,rTimestamp,rWouldTakeAgain,sId,takenForCredit,teacher,teacherGrade,teacherRatingTags,unUsefulGrouping,usefulGrouping
Mandatory,average,average,average,0,32966564,0,,average,3,RSM230,"A lot of reading the lecture slides and very dry but the course material is dry since it's an introductory course. Very vague guidelines and specific expectations. Cheatsheet will save your life, but you're going to need to know a lot of random facts and highly specific details. Very nice lady though.",03/11/2020,3.0,3.0,,3,N/A,3.0,3.0,1,Yes,1583940663000,No,1484,Yes,,B,"['Respected', 'Lots of homework', 'Test heavy']",people,people
N/A,poor,average,poor,0,32247100,0,,awful,1,RSM230,"I can tell she is super nice BUT honestly the most boring lectures ever! Made learning difficult, especially as she just reads off the slides. Rarely give meaningful real life examples/applications, which would have many financial concepts MUCH easier to understand",09/26/2019,3.0,3.0,,1,N/A,1.0,1.0,1,No,1569457348000,No,1484,Yes,,A-,"['Caring', 'Lecture heavy']",people,people
Not Mandatory,average,average,average,1,32114902,0,,poor,2,RSM230,The B in Boyko stands for boring... Shes literally just so monotone you cant even manage to pay attention for the 2 hours a week that you have to suffer through the class. There are way better profs for 230 but if you do get stuck with her its not a big deal. The prof doesnt really matter for the course. Just know the lecture slides.,07/23/2019,2.0,2.0,,2,N/A,2.0,2.0,1,No,1563866018000,No,1484,Yes,,A,"['Group projects', 'Lecture heavy']",people,person
N/A,average,average,average,0,32080924,0,,average,3,RSM330,Not the best prof but way better than Bing Han (who teaches the course during the other term). Lectures can be pretty boring.,07/07/2019,3.0,3.0,,3,N/A,3.0,3.0,1,Yes,1562457810000,No,1484,Yes,,N/A,[],people,people
N/A,good,average,good,0,31588482,1,,good,4,RSM230,Lectures are straightforward but can be really boring at times. She is caring and knowledgeable.,04/14/2019,3.0,3.0,,4,N/A,4.0,4.0,1,Yes,1555207900000,No,1484,Yes,,N/A,['Lecture heavy'],person,people
Not Mandatory,average,good,average,2,31326585,0,,poor,2,RSM230,"She's really rude and inconsiderate. Lectures are so boring as she just reads off the slides. Not very helpful when you have any questions after class. Just wants to get paid, do the bare minimum, and leave type of prof.",02/01/2019,4.0,4.0,,2,N/A,2.0,2.0,1,Yes,1548995818000,No,1484,Yes,,Not sure yet,"['Lecture heavy', 'Group projects']",people,people
Not Mandatory,poor,good,poor,4,31249246,0,,awful,1,RSM330,-Provided little to no constructive feedback on assignments -Her favourite line when she messes up on grading is &quot;Life is unfair&quot;. -She uses exact questions from past mid-terms and selects a different answer for MC to screw with students -Emailing her for a question or clarifications will result in either &quot;Can't tell your&quot; or &quot;Ask someone else&quot;,01/12/2019,5.0,5.0,,1,N/A,1.0,1.0,1,No,1547327842000,No,1484,Yes,,A-,"['Tough grader', 'Test heavy', 'Lots of homework']",people,people
Mandatory,average,average,average,3,30001705,1,,average,3,RSM230,Quite boring lecturer that reads off of powerpoint slides. Covers a lot in each class. But the slides are great and packed with information and becomes a great study tool for the test/exam.,05/06/2018,3.0,3.0,,3,N/A,3.0,3.0,1,Yes,1525617563000,No,1484,Yes,,B,['Lecture heavy'],person,people
