attendance,clarityColor,easyColor,helpColor,helpCount,id,notHelpCount,onlineClass,quality,rClarity,rClass,rComments,rDate,rEasy,rEasyString,rErrorMsg,rHelpful,rInterest,rOverall,rOverallString,rStatus,rTextBookUse,rTimestamp,rWouldTakeAgain,sId,takenForCredit,teacher,teacherGrade,teacherRatingTags,unUsefulGrouping,usefulGrouping
Mandatory,poor,good,poor,14,30638834,1,,awful,1,PI200,"A complete joke of a prof with absolutely no ability to teach anyone how to play or listen. She's the type of prof who makes you want to hate music and the type of person who makes the business of music the mess that it is today. A totally deaf, hypercritical witch. I hated every class she &quot;taught&quot; - which translates to insulting everyone in sight.",10/31/2018,5.0,5.0,,1,N/A,1.0,1.0,1,No,1541007007000,No,1484,Yes,,N/A,[],person,people
Not Mandatory,poor,good,poor,9,30557740,1,,awful,1,PI101,"If you have ability, know how to listen, and don't study with her teacher, expect to be the target of her projections, psychological warfare, and absurd jealously. Good riddance!",10/10/2018,5.0,5.0,,1,N/A,1.0,1.0,1,No,1539178530000,No,1484,Yes,,N/A,[],person,people
Mandatory,poor,good,poor,19,30268565,1,,awful,1,PI200,"She's the best of the profs on the faculty for insulting. useless comments and bad teaching. Good luck reasoning with this creature. She doesn't respect you and needs serious amounts of therapy - or perhaps a boyfriend, if one could stand to be around her.",06/15/2018,5.0,5.0,,1,N/A,1.0,1.0,1,No,1529083231000,No,1484,Yes,,N/A,[],person,people
N/A,average,good,average,16,30223719,0,,poor,2,P1,Comments are condescending and discouraging and not at all with good intentions to teach. Has few favourite students of her own and plays unfairly to other students in the program.,06/02/2018,5.0,5.0,,2,N/A,2.0,2.0,1,No,1527959626000,No,1484,Yes,,N/A,[],people,people
N/A,poor,good,poor,41,25905089,2,,awful,1,PI234,"Lightweight professor with such a poor approach. It's amazing she is even teaching at UofT.  After leaving school, haven't run into anyone who can say they know her that well, and those who do, don't respect her as a pianist, musician, or teacher. Her teaching is a joke, and a sardonic one, she truly causes you to hate everything you play.",01/08/2016,5.0,5.0,,1,It's my life,1.0,1.0,1,No,1452280188000,N/A,1484,Yes,,N/A,[],people,people
Mandatory,good,average,good,2,23583542,66,,awesome,5,PMU,Lydia is not only a wonderful prof but an incredible human being. Obviously has tremendous life+career experience that shows in her teaching and her interactions with me. She was able to not only address my technical issues at the piano but push for my musical growth. Extremely caring in my personal struggles and devoted time to help me through it.,09/08/2014,3.0,3.0,,5,It's my life,5.0,5.0,1,Yes,1410214251000,N/A,1484,N/A,,N/A,[],people,people
N/A,good,average,good,1,20519700,62,,good,4,PIPI,"Of course you have to earn her respect. But once you have it, you're in the clear! Hilarious, approachable and helpful.",07/26/2012,3.0,3.0,,4,It's my life,4.0,4.0,1,No,1343313639000,N/A,1484,N/A,,N/A,[],people,person
N/A,good,average,average,1,19624843,61,,good,4,PIPNO,"Oh, give me a break. She's great and funny! You must be interested in what she has to say, and take what she says to heart if you want to a)improve, and b)earn her respect. Being technically proficient is a given...hard to find at this school..",12/26/2011,2.0,2.0,,3,Really into it,3.5,3.5,1,No,1324936876000,N/A,1484,N/A,,N/A,[],people,person
N/A,average,good,poor,48,18408923,4,,poor,2,PRA101,"Extremely biased in her judgment of students, she gives you feedback not on how well you play, but based on how much she likes/dislikes you.  I've seen and heard about her tearing apart students in front of all their peers.  She apparently has no problem with making students cry in front of the whole class while she continues on her verbal rampage",04/14/2011,5.0,5.0,,1,Sorta interested,1.5,1.5,1,No,1302777078000,N/A,1484,N/A,,N/A,[],people,people
