attendance,clarityColor,easyColor,helpColor,helpCount,id,notHelpCount,onlineClass,quality,rClarity,rClass,rComments,rDate,rEasy,rEasyString,rErrorMsg,rHelpful,rInterest,rOverall,rOverallString,rStatus,rTextBookUse,rTimestamp,rWouldTakeAgain,sId,takenForCredit,teacher,teacherGrade,teacherRatingTags,unUsefulGrouping,usefulGrouping
Mandatory,average,poor,average,2,26794642,0,,poor,2,HIS423,"The syllabus  did not specify what material should be read for each lecture, and the readings themselves consisted of a single book written by the Shorter himself. Lectures consisted of powerpoint slides and the expectation that history students should already have a background in medicine and anatomy. Overall, interesting subject, poor execution.",07/10/2016,1.0,1.0,,2,N/A,2.0,2.0,1,Yes,1468183709000,No,1484,Yes,,A-,[],people,people
Mandatory,average,average,average,0,25601982,0,,average,2,HIS423H1F,"Shorter is a highly approachable, engaging, and understanding professor. While the course had a textbook, it was seldom used.  However, if you did read it, it may help you in weekly class discussions. Spend time understanding assignment expectations, as confusion is to be expected.  I would recommend  talking to him during his office hours.",12/09/2015,3.0,3.0,,4,Really into it,3.0,3.0,1,No,1449627398000,N/A,1484,Yes,,N/A,"['Hilarious', 'Inspirational', 'Participation matters']",people,people
N/A,good,average,good,2,19832692,2,,awesome,5,HIS423,"Brilliant, charming, helpful, and interesting.  Professor Shorter is one of U of T’s many intellectual trinkets.",02/16/2012,3.0,3.0,,5,It's my life,5.0,5.0,1,Yes,1329406643000,N/A,1484,N/A,,N/A,[],people,people
N/A,average,poor,average,3,16028449,0,,average,3,HIS423,"Likes to hear himself talk. Syllabus was a joke as the only reading was a single book written by none other than himself, and no weekly topics. Class was more like a meandering question and answer period with himself as the fount of knowledge. Fortunately, he was saved by an extremely engaging subject--social history of medicine.",07/09/2009,1.0,1.0,,3,Really into it,3.0,3.0,1,No,1247181644000,N/A,1484,N/A,,N/A,[],people,people
N/A,good,average,good,0,12542201,0,,awesome,5,HIS423,"One of the best lecturers I had had.  He's funny, engaging and makes a potentially boring topic like history a lot of fun.  Definitely take this class if you have the chance!!",12/07/2006,2.0,2.0,,4,It's my life,4.5,4.5,1,No,1165500644000,N/A,1484,N/A,,N/A,[],people,people
N/A,good,average,good,0,10045243,0,,good,4,HIS423,"Prof Shorter was one of the best profs I've had at UofT. He was a very engaging speaker, and his slides were most helpful. You could tell he really loved the subject, and was extremely knowledgable. I would reccomend anyone take a class taught by this man.",07/20/2005,3.0,3.0,,4,Really into it,4.0,4.0,1,N/A,1121883897000,N/A,1484,N/A,,N/A,[],people,people
