attendance,clarityColor,easyColor,helpColor,helpCount,id,notHelpCount,onlineClass,quality,rClarity,rClass,rComments,rDate,rEasy,rEasyString,rErrorMsg,rHelpful,rInterest,rOverall,rOverallString,rStatus,rTextBookUse,rTimestamp,rWouldTakeAgain,sId,takenForCredit,teacher,teacherGrade,teacherRatingTags,unUsefulGrouping,usefulGrouping
N/A,good,average,good,5,20203385,2,,awesome,5,HPS250,"Great Prof! Very clear, helpful, and funny. However, hated the way the course was organised: there are 5 quizzes and a short assignment before a final essay that is worth 50% in total (10% proposal). Had hardly any training in philosophical writing and we were then told to write a whole essay of our own arguments. Avg was low too: ~57%",05/05/2012,3.0,3.0,,5,Sorta interested,5.0,5.0,1,Yes,1336219416000,N/A,1484,N/A,,N/A,[],people,people
N/A,good,average,good,2,19893660,0,,awesome,5,HPS250,"hakob is committed to his students and knows his stuff   I wish all professors could be like him",03/08/2012,2.0,2.0,,5,Sorta interested,5.0,5.0,1,Yes,1331238721000,N/A,1484,N/A,,N/A,[],people,people
N/A,good,average,good,1,19882525,0,,awesome,5,HPS250,he's a great prof. also very helpful if you go to his office hours,03/05/2012,3.0,3.0,,5,Low,5.0,5.0,1,Yes,1330991156000,N/A,1484,N/A,,N/A,[],people,person
N/A,good,poor,good,1,19826581,0,,awesome,5,HPS250,"Great professor, really interested in his subject. made me love philosophy of science.  very helpful in his office hours and also very fast in email reply.",02/14/2012,1.0,1.0,,5,It's my life,5.0,5.0,1,Yes,1329244185000,N/A,1484,N/A,,N/A,[],people,person
N/A,good,poor,good,1,19809149,0,,awesome,5,VIC171,"Hakob is awesome! He takes time to explain everything thoroughly until everyone gets it. He's also really funny. And the slides, OMG, the best slides ever! Take him!",02/08/2012,1.0,1.0,,5,Meh,5.0,5.0,1,No,1328669408000,N/A,1484,N/A,,N/A,[],people,person
N/A,good,poor,good,1,19781640,0,,awesome,5,HPS250,Cool professor! I highly recommend him.,01/29/2012,1.0,1.0,,5,It's my life,5.0,5.0,1,Yes,1327847891000,N/A,1484,N/A,,N/A,[],people,person
N/A,good,poor,good,1,19779059,0,,awesome,5,HPS250,"I am in his HPS 250 and the guy is brilliant. He is a fantastic teacher. He was born to teach!  As long as you pay attention in class, you can probably skip some of the readings. But do the readings anyways. It's fun!",01/27/2012,1.0,1.0,,5,Really into it,5.0,5.0,1,Yes,1327706237000,N/A,1484,N/A,,N/A,[],people,person
N/A,good,poor,good,1,19770207,0,,awesome,5,HPS250,"Awesome teacher, captivates everyone in the class.",01/25/2012,1.0,1.0,,5,Sorta interested,5.0,5.0,1,Yes,1327504616000,N/A,1484,N/A,,N/A,[],people,person
N/A,good,poor,good,1,19767850,1,,awesome,5,HPS250,Hakob is a fantastic teacher and a charismatic person. He's funny and makes class fun.,01/24/2012,1.0,1.0,,5,Low,5.0,5.0,1,Yes,1327443710000,N/A,1484,N/A,,N/A,[],person,person
N/A,good,poor,good,1,19767829,0,,awesome,5,HPS250,Amazing prof! Great slides!,01/24/2012,1.0,1.0,,5,Really into it,5.0,5.0,1,Yes,1327443460000,N/A,1484,N/A,,N/A,[],people,person
N/A,good,poor,good,1,18789986,0,,awesome,5,HPS250,Super helpful! Amazing instructor!,07/05/2011,1.0,1.0,,5,Sorta interested,5.0,5.0,1,No,1309857347000,N/A,1484,N/A,,N/A,[],people,person
N/A,good,poor,good,1,18467071,0,,awesome,5,HPS250,Great prof ! Hope to see more lectures in the future!,04/26/2011,1.0,1.0,,5,Really into it,5.0,5.0,1,Yes,1303776173000,N/A,1484,N/A,,N/A,[],people,person
N/A,good,average,good,1,18450635,0,,awesome,5,HPS250,"I really like the way Hakob taught the course, especially his humor. I engaged in the topic in a relax manner and learned a lot.",04/21/2011,2.0,2.0,,5,Sorta interested,5.0,5.0,1,No,1303424716000,N/A,1484,N/A,,N/A,[],people,person
N/A,good,poor,good,1,18397842,0,,awesome,5,HPS250,I really enjoyed this class! Hakob is enthusiastic and very approachable. He encourages student participation and genuinely cares about what they have to say.,04/12/2011,1.0,1.0,,5,Really into it,5.0,5.0,1,No,1302636029000,N/A,1484,N/A,,N/A,[],people,person
N/A,good,poor,good,1,18382796,0,,awesome,5,HPS250,"The best prof I've ever had, hands down.",04/09/2011,1.0,1.0,,5,Low,5.0,5.0,1,No,1302374727000,N/A,1484,N/A,,N/A,[],people,person
N/A,good,poor,good,3,18382771,7,,awesome,5,HPS250,Great prof! And soooo hotttt!!!!,04/09/2011,1.0,1.0,,5,Really into it,5.0,5.0,1,No,1302374350000,N/A,1484,N/A,,N/A,[],people,people
N/A,good,average,good,1,18379236,0,,awesome,5,HPS250,"Hakob is definitely a great professor! Material is dense but he does a great job of explaining it. I used to hate philosophy, but now I'm considering taking other philosophy classes.",04/08/2011,3.0,3.0,,5,Really into it,5.0,5.0,1,Yes,1302277834000,N/A,1484,N/A,,N/A,[],people,person
N/A,good,poor,good,1,18378309,0,,awesome,5,HPS250,"Clear, entertaining, confident, funny. Fantastic slides.",04/08/2011,1.0,1.0,,5,It's my life,5.0,5.0,1,Yes,1302266996000,N/A,1484,N/A,,N/A,[],people,person
N/A,good,average,good,1,18288396,2,,awesome,5,HPS250,The best explainer ever! Before this class I didn't know philosophy could be that interesting. Now I just love it :) Love the slides too! Good job!,03/18/2011,3.0,3.0,,5,Sorta interested,5.0,5.0,1,No,1300486171000,N/A,1484,N/A,,N/A,[],people,person
