attendance,clarityColor,easyColor,helpColor,helpCount,id,notHelpCount,onlineClass,quality,rClarity,rClass,rComments,rDate,rEasy,rEasyString,rErrorMsg,rHelpful,rInterest,rOverall,rOverallString,rStatus,rTextBookUse,rTimestamp,rWouldTakeAgain,sId,takenForCredit,teacher,teacherGrade,teacherRatingTags,unUsefulGrouping,usefulGrouping
Mandatory,good,good,good,0,32497363,0,,awesome,5,HIS407,"I took his Imperial Germany course and the reading was heavy and some of it was really intense hard graduate-level staff. It was like reading one book per week on average. But it's worth it because you will learn a lot. And the selection of reading was just perfect. A very nice person as well, office hour was really easy to access.",12/02/2019,5.0,5.0,,5,N/A,5.0,5.0,1,Yes,1575251570000,Yes,1484,Yes,,A-,"['Get ready to read', 'Gives good feedback', 'Lecture heavy']",people,people
N/A,average,good,poor,0,22475978,0,,poor,2,HIS330,"Heard so many great things about him, but they were not true. He is very knowledgeable in the subject matter and is pretty funny but … he used full weeks lecture time for ""quizzes"" that we could have used to learn instead",12/09/2013,4.0,4.0,,1,Really into it,1.5,1.5,1,Yes,1386589391000,N/A,1484,N/A,,N/A,[],people,people
N/A,good,average,good,0,18018984,0,,awesome,5,HIS437,"Excellent professor. Helpful, clear, enthusiastic, and very interesting. The assignments were useful and graded fairly. I was initially unsure about his discussion style, but quickly realized that his seminar by far had the best discussion of all the three HIS seminars I was taking. A very worthwhile learning experience. HIGHLY recommended!",12/21/2010,2.0,2.0,,5,Really into it,5.0,5.0,1,Yes,1292970372000,N/A,1484,N/A,,N/A,[],people,people
N/A,good,good,good,0,12840849,0,,good,4,HIS501,Very relaxed & suave lecturer,02/02/2007,4.0,4.0,,4,Low,4.0,4.0,1,Yes,1170449586000,N/A,1484,N/A,,N/A,[],people,people
N/A,good,average,good,0,11042788,0,,awesome,5,317,"he's a great professor.  one of the best in his field IN THE WORLD!  I actually have looked into it, and he is; based on the number of citations in books and articles.  very clear and concise.",12/03/2005,3.0,3.0,,5,It's my life,5.0,5.0,1,N/A,1133614484000,N/A,1484,N/A,,N/A,[],people,people
N/A,good,poor,good,0,10580078,0,,awesome,5,HISTREE,"Dr. Retallack makes up for an unexplained fixation with rodents by making all things complex simple, and all things simple complex, history-wise.  Also, he cracks off more one liners in a single class than Jay Leno manages in a year.  TAKE HIS COURSE!",10/12/2005,1.0,1.0,,5,Meh,5.0,5.0,1,N/A,1129131118000,N/A,1484,N/A,,N/A,[],people,people
