attendance,clarityColor,easyColor,helpColor,helpCount,id,notHelpCount,onlineClass,quality,rClarity,rClass,rComments,rDate,rEasy,rEasyString,rErrorMsg,rHelpful,rInterest,rOverall,rOverallString,rStatus,rTextBookUse,rTimestamp,rWouldTakeAgain,sId,takenForCredit,teacher,teacherGrade,teacherRatingTags,unUsefulGrouping,usefulGrouping
N/A,good,average,good,0,32228142,0,,good,4,CRI391,"He is a great Professor, really wants you to do well and you should really ask him about things that might be of interest to you (especially for the term paper). Extremely accommodating and highly respected personality but doesnt act like it!! Loved the class",09/14/2019,2.0,2.0,,4,N/A,4.0,4.0,1,No,1568423046000,Yes,1484,Yes,,A,"['Accessible outside class', 'Clear grading criteria', 'Respected']",people,people
N/A,average,good,average,2,31425454,0,,poor,2,SOC322,Beware!!! 20 multiple choice and 15 short answer question midterm GIVEN TO WRITE IN ONE HOUR!,03/11/2019,4.0,4.0,,2,N/A,2.0,2.0,1,Yes,1552342056000,No,1484,Yes,,N/A,[],people,people
Mandatory,good,average,good,0,31197542,0,,awesome,5,SOC209,"He's an amazing professor. He grabs your attention in his lectures and his teaching style is amazing! I definitely recommend taking him. His tests are a little difficult but if you do the readings - both textbook and online readings, you'll be fine. Go to office hours and get to know him personally. He's a gem!",01/04/2019,3.0,3.0,,5,N/A,5.0,5.0,1,Yes,1546566037000,Yes,1484,Yes,,B+,"[""Skip class? You won't pass."", 'Amazing lectures', 'Gives good feedback']",people,people
Mandatory,good,average,good,2,27711409,0,,awesome,5,SOC209,"First of all, he is very attractive. Secondly, great professor he is really passionate about what he teaches. He tries hard to grab the attention of the class. His multiple choice only midterm was very straight forward and simple. The exam was even easier. Articles are necessary to pass. However, marked papers a tad hard. Overall, he's amazing.",01/10/2017,3.0,3.0,,5,N/A,5.0,5.0,1,Yes,1484082031000,Yes,1484,Yes,,A+,"['Respected', 'Lots of homework', 'Amazing lectures']",people,people
Mandatory,good,average,good,0,25822412,0,,awesome,5,CJUSP100,"Recommend coming to lectures, even if the slides are sometimes available online anyways, it was always an enjoyable lecture. Most of the material is common sense, but reading the chapters helps to prepare for the exams. The AI Kevin Meskill was also extremely helpful.",12/25/2015,2.0,2.0,,4,Really into it,4.5,4.5,1,Yes,1451006813000,N/A,1484,Yes,,A,"['Participation matters', 'Hilarious', 'Clear grading criteria']",people,people
Mandatory,good,average,good,0,25086085,1,,good,4,CJUSP100,I took intro to criminal justice form him at IU and loved it. He's really into the material and makes it interesting to learn about. I would definitely take another class from him. Not one of the hardest classes I've taken but you do have to study for the tests. ,08/02/2015,3.0,3.0,,4,It's my life,4.0,4.0,1,Yes,1438535730000,Yes,1484,Yes,,A-,[],person,people
N/A,good,average,good,2,22976975,1,,good,4,WDW210H1S,"Although the material was dull and a 3 hour lecture, he was engaging, went through the very clear slides quickly (thank god), and brought in a number of interesting guest speakers. He also replied to his emails quickly, which was helpful.",04/01/2014,3.0,3.0,,4,Really into it,4.0,4.0,1,Yes,1396387494000,N/A,1484,N/A,,N/A,[],person,people
