attendance,clarityColor,easyColor,helpColor,helpCount,id,notHelpCount,onlineClass,quality,rClarity,rClass,rComments,rDate,rEasy,rEasyString,rErrorMsg,rHelpful,rInterest,rOverall,rOverallString,rStatus,rTextBookUse,rTimestamp,rWouldTakeAgain,sId,takenForCredit,teacher,teacherGrade,teacherRatingTags,unUsefulGrouping,usefulGrouping
Not Mandatory,good,average,good,0,27111346,0,,awesome,5,POL300,"best prof ever, love him!",11/01/2016,3.0,3.0,,5,N/A,5.0,5.0,1,No,1478038428000,Yes,1484,Yes,,A,"['Gives good feedback', 'Amazing lectures', 'Inspirational']",people,people
Mandatory,good,average,good,0,26503685,1,,awesome,5,POL101,"Extremely clear and well organized lectures with good slides. Funny guy who really drives the main point home. He taught POL101 with Prof Kopstein and they had a great dynamic together, balanced each other out. Definitely a great class where I was able to learn a lot.",05/08/2016,2.0,2.0,,5,N/A,5.0,5.0,1,Yes,1462711089000,Yes,1484,Yes,,B+,"['Hilarious', 'Amazing lectures']",person,people
Mandatory,good,good,average,0,25332913,1,,good,4,POL300,love him,11/03/2015,4.0,4.0,,3,Really into it,3.5,3.5,1,Yes,1446560761000,N/A,1484,Yes,,N/A,"['Tough grader', ""Skip class? You won't pass."", 'Respected']",person,people
Mandatory,good,good,good,1,25201603,0,,awesome,5,MUN102,"Prof Wong was not only knowledgeable, but helpful and clear. He inspires conversation and respects every student's opinion. I highly recommend taking a course with him. ",09/21/2015,4.0,4.0,,5,It's my life,5.0,5.0,1,Yes,1442870976000,N/A,1484,Yes,,A-,"['Participation matters', 'Respected', 'Gives good feedback']",people,person
Mandatory,good,good,good,1,25178945,0,,good,5,POL101Y1,"Professor Wong is very intellectual. He knows the material he is teaching inside out, evident from the way he discusses it and when he answers any student questions. First years, his lectures are long and apparently monotone (who cares) but in the upper years you'll realize what a clear cut and insightful instructor Professor Wong was. ",09/08/2015,4.0,4.0,,3,Sorta interested,4.0,4.0,1,No,1441754758000,N/A,1484,Yes,,A-,"['Amazing lectures', 'Lecture heavy', 'Respected']",people,person
Not Mandatory,good,average,good,1,23449700,0,,awesome,5,POL101,Professor Wong in his lectures sometimes gets a bit monotone but they still remain interesting. He's very approachable and a down to earth guy. Definitely my favourite class first year.,07/16/2014,3.0,3.0,,5,Really into it,5.0,5.0,1,Yes,1405516290000,N/A,1484,N/A,,P,[],people,person
N/A,good,average,good,1,23041203,0,,good,4,POL101Y,great prof! knows what he's talking about and really makes you think about what you're learning.,04/15/2014,3.0,3.0,,4,Sorta interested,4.0,4.0,1,No,1397570696000,N/A,1484,N/A,,N/A,[],people,person
Not Mandatory,good,average,good,1,22792467,0,,awesome,5,POL101Y1,"Wong is a great prof.  His lectures are really detailed, and he breaks down the material so everything is clear and understood.  He's witty and incorporates interesting experiences into his lectures, which makes them more interesting.  Overall great guy with an effective lecturing style.",01/25/2014,3.0,3.0,,4,Really into it,4.5,4.5,1,Yes,1390668377000,N/A,1484,N/A,,N/A,[],people,person
N/A,good,average,good,1,22468812,0,,awesome,5,POL101,Professor Wong is my favorite Professor! I really enjoy this class and his topics !,12/08/2013,2.0,2.0,,5,It's my life,5.0,5.0,1,Yes,1386517432000,N/A,1484,N/A,,N/A,[],people,person
N/A,good,poor,good,1,22210552,0,,awesome,5,POL215,"Magnificent lecture on Taiwan. Passion. Charismatic, intelligent. Awesomeeee!",10/24/2013,1.0,1.0,,5,It's my life,5.0,5.0,1,No,1382614367000,N/A,1484,N/A,,N/A,[],people,person
N/A,good,average,good,1,22170144,0,,awesome,5,POL215Y,Thanks for the great lecture Dr. Wong! Crystal as usual. Loved it.,10/10/2013,2.0,2.0,,4,Sorta interested,4.5,4.5,1,No,1381415250000,N/A,1484,N/A,,N/A,[],people,person
N/A,good,poor,good,0,21889719,0,,awesome,5,POL101Y,"If it's hard to understand, maybe then POL is not your cup of tea. Wait till you get to 2nd, 3rd year bud. I consider Wong/Kopstein as top profs in here. As to articles, except for Evans, I got it all. So what there is no book? You saved a $100).",06/13/2013,1.0,1.0,,5,It's my life,5.0,5.0,1,No,1371128283000,N/A,1484,N/A,,N/A,[],people,people
N/A,good,average,average,0,21876928,0,,good,4,POL101Y1,"This course is taught by Mr. Wong and Mr. Kopstein. They do not upload powerpoints online. There is no textbook. The readings are on blackboard, and the readings are lengthy and difficult to understand.",06/09/2013,3.0,3.0,,3,Sorta interested,3.5,3.5,1,No,1370785797000,N/A,1484,N/A,,N/A,[],people,people
N/A,good,average,good,1,21588595,0,,awesome,5,POL101Y,Dr. Wong is a very interesting lecturer. You'll never sleep there. He finishes early and talk is direct and useful.,04/23/2013,3.0,3.0,,5,Really into it,5.0,5.0,1,No,1366740077000,N/A,1484,N/A,,N/A,[],people,person
N/A,good,average,good,0,20656243,0,,good,5,POL100,"This is a split class prof wise, which in this case actually works as both have specific areas of interest in what is a fairly broad intro course. Lectures are important to the pace of the material and Wong asks questions rather than giving all the answers - very important. His lectures usefully informative on East Asian development and politics.",09/21/2012,2.0,2.0,,3,Really into it,4.0,4.0,1,Yes,1348264462000,N/A,1484,N/A,,N/A,[],people,people
N/A,good,good,good,0,20566446,0,,good,4,POL100,"I had Wong along with Kopstein for POL101. Wong doesn't stand out much to me as a professor, other than his lectures were very organized. VERY important to do your readings in this course. The readings were incredibly heavy for a 100-level class, which may be the only con.",08/11/2012,5.0,5.0,,4,Really into it,4.0,4.0,1,Yes,1344716890000,N/A,1484,N/A,,N/A,[],people,people
N/A,good,average,good,0,20516918,0,,awesome,5,POL101,"Wong was interesting, to the point and witty. Easy to follow. Listen carefully and he details what is expected in the essays and the exams.  My TA said that the profs were not very imaginative when it came to the exams and she was right. Look at the old exams for your revision, you wont go wrong - especially for the multiple choice!",07/25/2012,3.0,3.0,,4,It's my life,4.5,4.5,1,No,1343239067000,N/A,1484,N/A,,N/A,[],people,people
N/A,good,average,good,0,20485477,0,,awesome,5,POL101,Superb orator. Concepts are clearly explained in a fluid fashion that allows for great note-taking. Lectures are very interesting. Great guy.,07/12/2012,3.0,3.0,,5,Really into it,5.0,5.0,1,No,1342054220000,N/A,1484,N/A,,N/A,[],people,people
N/A,good,poor,good,0,20343692,0,,awesome,5,POL101,"Not as interesting as the other prof who teaches this course, but more clear and organized lecture-wise. Can be witty sometimes. Explains concepts well. Manages to tie East Asia into every example ever. All in all, good prof, great course.",05/24/2012,1.0,1.0,,4,Low,4.5,4.5,1,Yes,1337898513000,N/A,1484,N/A,,N/A,[],people,people
N/A,good,average,good,0,20049316,0,,good,5,POL1,"I love this course because it forces you to learn something useful. In other words, The prof. make political science101 memorable.",04/14/2012,3.0,3.0,,3,It's my life,4.0,4.0,1,Yes,1334413657000,N/A,1484,N/A,,N/A,[],people,people
N/A,good,average,good,0,20014269,0,,awesome,5,POL101,"Great prof! I preferred him over Kopstein. Lectures were crystal clear and easy to follow. Wong is articulate and funny, not to mention approachable, summarizes effectively, and uses real-world examples. Tests are no surprise. My interest in the course at the beginning was pretty low but I'm actually planning on majoring in it thanks to POL101!",04/08/2012,3.0,3.0,,5,Low,5.0,5.0,1,No,1333917699000,N/A,1484,N/A,,N/A,[],people,people
N/A,good,average,good,0,19963632,0,,awesome,5,POL100Y,"Professor Wong is a sick dude. He's not as funny as Kopstein (the other prof for my course), but his content is a bit more interesting. He does always talk about Asia, but its always interesting",03/28/2012,2.0,2.0,,5,It's my life,5.0,5.0,1,No,1332952720000,N/A,1484,N/A,,N/A,[],people,people
N/A,good,average,good,0,19799576,0,,awesome,5,POL101,He's clear and interesting. I find him a better lecturer than the other professor who teaches this course. He's easy to listen to and quite good at explaining things. Rather funny too.,02/04/2012,2.0,2.0,,4,It's my life,4.5,4.5,1,Yes,1328321497000,N/A,1484,N/A,,N/A,[],people,people
N/A,good,good,average,0,19002002,1,,good,4,POL101,"a little boring, but helpful. talks about China every class. on the first day we had a person pass out on the floor and he did nothing. tried to talk as normal. other prof stoped him. overall he is OK.",09/15/2011,4.0,4.0,,3,Really into it,3.5,3.5,1,No,1316101865000,N/A,1484,N/A,,N/A,[],person,people
N/A,good,average,good,0,18799072,0,,awesome,5,POL101,One of the most articulate  professors I have had. His arguments are far more sophisticated than the other professor who teaches this course. Fairly easy but interesting introductory survey course.,07/07/2011,2.0,2.0,,4,It's my life,4.5,4.5,1,No,1310068974000,N/A,1484,N/A,,N/A,[],people,people
N/A,good,poor,good,0,18565270,0,,good,4,POL101,"Good lecturer, unfortunately a totally useless class that was far too broad. Dumbed down his lectures way too much.",05/10/2011,1.0,1.0,,4,Sorta interested,4.0,4.0,1,No,1304989001000,N/A,1484,N/A,,N/A,[],people,people
N/A,good,average,good,0,18503089,0,,awesome,5,POL101,I really great lecturer and made really complex topics easy to understand.  His lectures were very organized and made note-taking a breeze.  He provided tons of examples which were very useful for the essays and final exam.,05/01/2011,2.0,2.0,,5,Really into it,5.0,5.0,1,Yes,1304279158000,N/A,1484,N/A,,N/A,[],people,people
N/A,poor,good,poor,0,18438947,2,,awful,1,POL101,Manages to tie Hong Kong into every lecture. Every example is about China.,04/20/2011,4.0,4.0,,1,Sorta interested,1.0,1.0,1,No,1303271786000,N/A,1484,N/A,,N/A,[],people,people
N/A,average,good,average,0,18380910,0,,average,3,POLI101,His lectures were very engaging and interesting.  At the end of each lecture he summarizes his points.  I preferred him over Kopstein,04/08/2011,4.0,4.0,,2,Really into it,2.5,2.5,1,Yes,1302305229000,N/A,1484,N/A,,N/A,[],people,people
N/A,good,good,good,0,18272546,0,,awesome,5,POL317,"Single handedly the most effective teacher from my experience. The best professor that I've ever had, and probably will ever have.",03/13/2011,4.0,4.0,,4,Really into it,4.5,4.5,1,Yes,1300034637000,N/A,12184,N/A,,N/A,[],people,people
N/A,good,average,good,0,17016302,0,,good,4,POL317,Incredibly useful course.  Great Professor.,04/18/2010,3.0,3.0,,4,It's my life,4.0,4.0,1,Yes,1271627653000,N/A,1484,N/A,,N/A,[],people,people
N/A,good,average,average,0,15344041,0,,average,4,POL2700,"Good professor, knows the material well. I did not learn that much in the course though - it all made sense when he summarized the discussion, but this was not always done",01/08/2009,3.0,3.0,,2,Really into it,3.0,3.0,1,Yes,1231454892000,N/A,1484,N/A,,N/A,[],people,people
N/A,average,average,average,0,13462315,1,,poor,2,POL2700,His course is disorganized and dated.  He is also very self important.,09/06/2007,3.0,3.0,,2,Really into it,2.0,2.0,1,Yes,1189108092000,N/A,1484,N/A,,N/A,[],person,people
N/A,good,good,average,0,13351246,0,,average,4,POL350,"Young, unapologetic and arrogant! Nothing less, nothing more!",07/24/2007,5.0,5.0,,1,Really into it,2.5,2.5,1,Yes,1185295561000,N/A,1484,N/A,,N/A,[],people,people
N/A,average,good,poor,1,13347237,0,,poor,2,POL350,"He does not fell the need to bother with undergraduates students who have not completed prior research for or under him.  Extends deadlines for certain individuals, while deducting 5% a day off of the assignments of other students.  He is rude, arrogant and although “bright”, should not be teaching anyone, in any course, at any level.  Good luck to",07/23/2007,5.0,5.0,,1,It's my life,1.5,1.5,1,No,1185149573000,N/A,1484,N/A,,N/A,[],people,person
N/A,good,good,average,0,13345210,1,,average,4,POLL101,Not a very good prof!!! Incapable of giving any student a decent mark (those that deserve it of course)!,07/21/2007,5.0,5.0,,1,It's my life,2.5,2.5,1,No,1185015285000,N/A,1484,N/A,,N/A,[],person,people
N/A,good,good,good,0,12808534,0,,awesome,5,POL350,"Great lecturer, insightful, brilliant and funny. He has high standards and expectations but is well worth the effort.",01/22/2007,4.0,4.0,,4,It's my life,4.5,4.5,1,Yes,1169503421000,N/A,1484,N/A,,N/A,[],people,people
N/A,good,average,average,0,12210661,0,,good,4,POL317,No Comments,09/03/2006,3.0,3.0,,3,Really into it,3.5,3.5,1,Yes,1157321804000,N/A,1484,N/A,,N/A,[],people,people
N/A,good,average,good,0,11859694,0,,awesome,5,ENG250,SO much fun,05/10/2006,3.0,3.0,,5,It's my life,5.0,5.0,1,N/A,1147257066000,N/A,1484,N/A,,N/A,[],people,people
N/A,good,average,good,0,3067982,0,,awesome,5,POL350,"Great prof.  Brings to light many ethical and moral issues, provacative.  Friendly, personable.",12/18/2004,3.0,3.0,,4,Really into it,4.5,4.5,1,N/A,1103393026000,N/A,1484,N/A,,N/A,[],people,people
N/A,good,good,good,0,1292937,0,,awesome,5,POLISCI,Great discussion leader and very insightful,11/10/2003,4.0,4.0,,5,N/A,5.0,5.0,1,N/A,1068469449000,N/A,1484,N/A,,N/A,[],people,people
N/A,good,good,good,0,1271528,0,,awesome,5,POL350,"Expects a lot, but is very approachable, has extremely insightful lectures, welcomes feedback, grades fairly, and is funny.  The best prof I've had.",11/05/2003,4.0,4.0,,5,N/A,5.0,5.0,1,N/A,1068074027000,N/A,1484,N/A,,N/A,[],people,people
N/A,poor,good,poor,0,1267426,0,,awful,1,POL,brutal,11/05/2003,5.0,5.0,,1,N/A,1.0,1.0,1,N/A,1068044968000,N/A,1484,N/A,,N/A,[],people,people
N/A,average,average,average,0,984293,0,,poor,3,POL317,"Terrible marking of assignments, too much reading, unjustified means of calculating class participation.",05/26/2003,3.0,3.0,,1,N/A,2.0,2.0,1,N/A,1053967427000,N/A,1484,N/A,,N/A,[],people,people
N/A,good,average,good,0,790757,0,,awesome,5,POL317Y1,No Comments,04/04/2003,3.0,3.0,,5,N/A,5.0,5.0,1,N/A,1049499125000,N/A,1484,N/A,,N/A,[],people,people
N/A,good,average,good,0,761433,0,,awesome,5,POL438,"ARTICULATE, FUNNY, INSIGHTFUL AND PROVOCATIVE... AND HE CAN REMEMBER NAMES",03/29/2003,3.0,3.0,,4,N/A,4.5,4.5,1,N/A,1048962541000,N/A,1484,N/A,,N/A,[],people,people
N/A,good,good,good,0,442021,0,,awesome,5,POL317,"The course is tough but well worth it. He is smart, articulate and approachable.",12/17/2002,4.0,4.0,,4,N/A,4.5,4.5,1,N/A,1040127010000,N/A,1484,N/A,,N/A,[],people,people
N/A,average,good,average,0,405763,0,,poor,3,POL350,"Can't answer questions, or recognize a student after many office visits-horrible",12/08/2002,4.0,4.0,,1,N/A,2.0,2.0,1,N/A,1039355539000,N/A,1484,N/A,,N/A,[],people,people
