attendance,clarityColor,easyColor,helpColor,helpCount,id,notHelpCount,onlineClass,quality,rClarity,rClass,rComments,rDate,rEasy,rEasyString,rErrorMsg,rHelpful,rInterest,rOverall,rOverallString,rStatus,rTextBookUse,rTimestamp,rWouldTakeAgain,sId,takenForCredit,teacher,teacherGrade,teacherRatingTags,unUsefulGrouping,usefulGrouping
N/A,average,average,average,0,16053804,0,,poor,2,FREFRE,Very nice and interesting man. Terribly disorganized and disappointing class.,07/21/2009,3.0,3.0,,2,Really into it,2.0,2.0,1,No,1248170355000,N/A,1484,N/A,,N/A,[],people,people
N/A,good,average,good,0,11515382,0,,awesome,4,FCS331,"Fantastic prof, very knowledgeable and always available for help. Doesn't spoon-feed you: show up, learn, take in the information and think for yourself. Took 2 classes, enjoyed both.",02/24/2006,3.0,3.0,,5,It's my life,4.5,4.5,1,N/A,1140776593000,N/A,1484,N/A,,N/A,[],people,people
N/A,average,average,average,0,1859273,0,,good,2,FRE368,"great guy, fun prof, but i wouldn't say a great prof. would like to read some of his books though - they're probably more organized than his lectures...",03/28/2004,2.0,2.0,,5,N/A,3.5,3.5,1,N/A,1080482574000,N/A,1484,N/A,,N/A,[],people,people
N/A,average,good,average,0,1840095,0,,poor,2,FRENCH,"great guy, HORRIBLE prof",03/23/2004,4.0,4.0,,2,N/A,2.0,2.0,1,N/A,1080084698000,N/A,1484,N/A,,N/A,[],people,people
N/A,good,average,good,0,898093,0,,awesome,5,FSL163,great guy!,04/28/2003,3.0,3.0,,5,N/A,5.0,5.0,1,N/A,1051563465000,N/A,1484,N/A,,N/A,[],people,people
N/A,average,poor,good,0,444184,0,,good,3,FCS331,amazing guy!! - super nice and helpful...a dream prof.  (and cute!),12/17/2002,1.0,1.0,,5,N/A,4.0,4.0,1,N/A,1040153259000,N/A,1484,N/A,,N/A,[],people,people
