attendance,clarityColor,easyColor,helpColor,helpCount,id,notHelpCount,onlineClass,quality,rClarity,rClass,rComments,rDate,rEasy,rEasyString,rErrorMsg,rHelpful,rInterest,rOverall,rOverallString,rStatus,rTextBookUse,rTimestamp,rWouldTakeAgain,sId,takenForCredit,teacher,teacherGrade,teacherRatingTags,unUsefulGrouping,usefulGrouping
Mandatory,poor,good,poor,0,32937282,0,,awful,1,ECO204,This prof thinks he is the best ever and thinks he is so cool since his tests are super hard when really he is the worst ever. I wish this prof can see that if the test averages are 50-60s that implies that no one knows what is going on and his teaching style is ineffective. Really wish I did not take this class with him. I learned nothing.,02/27/2020,5.0,5.0,,1,N/A,1.0,1.0,1,No,1582820041000,No,1484,Yes,,C-,[],people,people
Not Mandatory,poor,good,poor,0,32553421,0,,awful,1,ECO204,"Hilarious doesn't help, his lecture is hard to follow. Have no interest in this course, and he makes it a lot harder. He is away for an awful lot of time, and TA would teach during tutorials. Fingers crossed for me to pass this course.",12/06/2019,5.0,5.0,,1,N/A,1.0,1.0,1,No,1575668659000,No,1484,Yes,,C+,"['Hilarious', 'Test heavy', ""Skip class? You won't pass.""]",people,people
N/A,poor,good,poor,0,32526200,0,,awful,1,EC204L010,He is an absolute stubborn professor with zero pity in student's bad condition.,12/04/2019,5.0,5.0,,1,N/A,1.0,1.0,1,No,1575493374000,No,1484,Yes,,Not sure yet,[],people,people
Mandatory,good,good,good,0,32224578,0,,good,4,ECO204,He is a very memorable prof. Many dislike his style but I found him to be very respectable and kept me engaged during every single lecture. His tests can be very intense but if you pay attention in class and take the time to learn/review all the content then you should pass no problem. Time and effort is the key to success here,09/12/2019,5.0,5.0,,4,N/A,4.0,4.0,1,No,1568254376000,Yes,1484,Yes,,A+,"['Hilarious', ""Skip class? You won't pass."", 'Amazing lectures']",people,people
Mandatory,good,good,good,0,32100410,0,,good,4,ECO204,"Although people do complain about him, ECO204 is a difficult course in general and he tries to explain the material as best as he can in class using jokes and humour to keep students attention. It actually helps me from falling asleep in class so I will say it is effective. He even writes his own textbooks for students to use and it is very helpful",07/16/2019,5.0,5.0,,4,N/A,4.0,4.0,1,No,1563293468000,Yes,1484,Yes,,N/A,[],people,people
N/A,average,good,average,0,32080852,0,,average,3,ECO204,Either you love him or you hate him. There is no in-between.,07/06/2019,4.0,4.0,,3,N/A,3.0,3.0,1,No,1562454668000,No,1484,Yes,,N/A,[],people,people
Mandatory,good,good,good,0,32077536,1,,good,4,ECO204,"Very challenging course that you must take if you are going for Finance. Not only his materials are applicable in work, he also prepares you for higher level courses.",07/04/2019,4.0,4.0,,4,N/A,4.0,4.0,1,No,1562259715000,Yes,1484,Yes,,N/A,"[""Skip class? You won't pass."", 'Hilarious', 'Lots of homework']",person,people
Mandatory,good,good,good,2,31940134,2,,good,4,ECO204,"As a prof/educator he is A+++ , very qualified to teach this course, knows what he is talking about, very engaging, great speaker, relatively fair test maker and grader. As a person... certified meany but a meany worth your time and tuition. Proceed with caution.",05/23/2019,4.0,4.0,,4,N/A,4.0,4.0,1,Yes,1558601825000,Yes,1484,Yes,,B,"[""Skip class? You won't pass."", 'Amazing lectures']",people,people
Mandatory,poor,good,poor,16,31454629,0,,awful,1,ECO204,"RUDEST PROFESSOR EVER! HE INTERRUPTS STUDENTS MID PRESENTATION TO MAKE STUDENT LOOK STUPID, WHEN REALLY HE'S THE ONE LOOKING LIKE A FOOL. HE ALSO MAKES DISRESPECTFUL FACES WHILE STUDENTS ARE SPEAKING. Everyone knows that judges ask questions at the end of a presentation, and they are certainly not asked by interrupting and with annoyed looks.",03/20/2019,5.0,5.0,,1,N/A,1.0,1.0,1,No,1553041403000,No,1484,Yes,,N/A,['Tough grader'],people,people
Not Mandatory,good,poor,good,4,31291819,74,,good,4,ECO204,"ECO204 is the easiest course I've ever taken at Rotman / UofT. People who complain about the (non-existent) &quot;difficulty&quot; of this course should re-evaluate their life decisions because it's not hard to get a 4.0 in this course if you have a positive IQ. Ajaz needs to make this course harder. This is UofT, not Ryerson man.",01/22/2019,1.0,1.0,,4,N/A,4.0,4.0,3,No,1548188758000,Yes,1484,Yes,,A+,"['Hilarious', 'Amazing lectures']",people,people
Mandatory,poor,good,poor,27,31277641,7,,awful,1,ECO204,"If I could rate him 0, I would. The content in this course is very difficult itself, and this man has the audacity to make it even harder! Pretty sure all the good reviews about him are written by him or his offspring. The man insults Rotman MBA students, students goes to the Canadian Harvard... when he went to Brown.",01/18/2019,5.0,5.0,,1,N/A,1.0,1.0,1,No,1547782424000,No,1484,Yes,,N/A,['Tough grader'],people,people
Mandatory,poor,good,poor,27,31246833,3,,awful,1,ECO204,HARDEST CLASS AND PROFESSOR EVER! He makes concepts very challenging compared to other professors. His Ryerson jokes were funny the first week but not anymore. Making us do presentations infront of 400 students... whereas other sections do not have to do this. It is really unfair.,01/12/2019,5.0,5.0,,1,N/A,1.0,1.0,1,No,1547256407000,No,1484,Yes,,N/A,"[""Skip class? You won't pass."", 'Lecture heavy', 'Tough grader']",people,people
Mandatory,poor,good,poor,22,30637895,2,,awful,1,ECO204,Don't take his eco204,10/31/2018,5.0,5.0,,1,N/A,1.0,1.0,1,No,1540998764000,No,1484,Yes,,N/A,"['Test heavy', 'Tough grader', 'Lecture heavy']",people,people
Mandatory,poor,good,poor,21,30637800,5,,awful,1,ECO204,Most ridiculous professor ever. reported and complained formally by 1k+ students I DON'T KNOW WHY HE'S STILL TEACHING. GO BACK TO USA,10/31/2018,5.0,5.0,,1,N/A,1.0,1.0,1,No,1540998074000,No,1484,Yes,,N/A,"['Test heavy', 'Tough grader', 'Lecture heavy']",people,people
Not Mandatory,poor,good,poor,20,30615282,1,,awful,1,ECO204,"Take ECO204 with him if you have a finance job interview. He assumes everyone will go into Finance and is taking certain courses (i.e. RSM332, ECO220). The contents are not difficult but the tests are unreasonably long .",10/26/2018,5.0,5.0,,1,N/A,1.0,1.0,1,No,1540556260000,No,1484,Yes,,A,"[""Skip class? You won't pass."", 'Tough grader', 'Test heavy']",person,people
Not Mandatory,good,good,good,21,30375198,18,,good,4,ECO204,"Ajaz is awesome, really funny and smart. His tests are challenging but fair. The final exam was graded very hard though. He knows his stuff and is a solid choice for a prof!",07/26/2018,4.0,4.0,,4,N/A,4.0,4.0,1,No,1532604279000,Yes,1484,Yes,,A-,"['Test heavy', 'Respected']",people,people
Mandatory,poor,good,poor,13,30348720,1,,awful,1,ECO204,Not enough practice questions in each chapter (7-20 if any) and his chapters are identical to lecture slideshows which are huge. Prof stormed out in the middle of a lecture (scheduled a make up lecture on a Sunday) He gives hints to the tests in class (some test questions he answers verbally in class and doesn't include the info on slides or book),07/16/2018,4.0,4.0,,1,N/A,1.0,1.0,1,Yes,1531756896000,No,1484,Yes,,N/A,"[""Skip class? You won't pass."", 'Gives good feedback']",person,people
Not Mandatory,good,good,good,1,30331197,15,,good,4,ECO204,"ECO 204 is the toughest mandatory course at Rotman. However, Professor Hussain makes it enjoyable. He is a top-level lecturer and can be very funny at times (will make fun of Ryerson at least 5 times a semester). He admits the course is difficult so he makes sure students do not fall behind. He marks tough but curves grades up (B- average).",07/09/2018,5.0,5.0,,4,N/A,4.0,4.0,1,No,1531149799000,Yes,1484,Yes,,N/A,[],people,person
Mandatory,good,good,good,2,30289666,17,,awesome,5,ECO204,"This professor is one of the jewels of UofT's Economic Department/Rotman Commerce. Absolutely a pleasure having him early on in undergrad, set the tone for the rest of the degree. If i had to name the top beneficial courses it would be his. Also, he's fun to be in class with and cares if you try hard. READ HIS NOTES AND LISTEN TO HIM!!!",06/23/2018,4.0,4.0,,5,N/A,5.0,5.0,1,Yes,1529720183000,Yes,1484,Yes,,A,"['Hilarious', 'Accessible outside class', 'Gives good feedback']",people,people
Mandatory,good,good,good,3,29863506,15,,good,4,ECO204,Great professor! ECO204 is a must take. Explains everything really well. Learnt more from that one class than i have in any of my other Rotman classes.,04/22/2018,4.0,4.0,,4,N/A,4.0,4.0,3,No,1524435223000,Yes,1484,Yes,,A,['Amazing lectures'],people,people
Mandatory,good,good,good,3,29849432,14,,awesome,5,ECO204,Amazing prof! Learnt a lot more from eco204 than I did from most Rotman courses.,04/20/2018,4.0,4.0,,5,N/A,5.0,5.0,1,Yes,1524186705000,Yes,1484,Yes,,N/A,"['Amazing lectures', ""Skip class? You won't pass."", 'Hilarious']",people,people
Not Mandatory,good,good,good,2,29832126,12,,awesome,5,ECO204,"He changed his teaching style this year and I loved it! Read his textbook, that gives you more intuition",04/18/2018,4.0,4.0,,5,N/A,5.0,5.0,1,No,1524058970000,Yes,1484,No,,N/A,"['Respected', 'Hilarious', 'Participation matters']",people,people
Mandatory,good,average,good,2,29817112,11,,awesome,5,ECO204,great prof,04/16/2018,3.0,3.0,,5,N/A,5.0,5.0,1,Yes,1523915839000,Yes,1484,Yes,,N/A,"['Caring', 'Gives good feedback', 'Respected']",people,people
Mandatory,good,average,good,1,29750781,7,,awesome,5,ECO204,"Great prof, funny lectures. Tests are very lecture and textbook based, so if a topic is in both lectures and the textbook, it'll definitely be on the exam. The topics are difficult but he takes time to explain the complex parts.",04/05/2018,3.0,3.0,,5,N/A,5.0,5.0,1,Yes,1522950287000,Yes,1484,Yes,,A+,"['Group projects', 'Gives good feedback', 'Lecture heavy']",people,person
Mandatory,good,good,good,1,29750516,2,,good,4,ECO204,"As an accounting specialist, I found this course was heavily geared towards finance/eco students. Also, the material was COMPLEX. Don't skip class and if you don't keep on top of the readings and lectures you're bound to fail. Take it from me, I bombed the 1st two tests but in the long run, there are ways to make up your grades. Funny lectures!",04/05/2018,4.0,4.0,,4,N/A,4.0,4.0,1,Yes,1522947993000,Yes,1484,Yes,,N/A,"['Test heavy', ""Skip class? You won't pass."", 'Hilarious']",people,person
N/A,average,good,average,4,29640904,2,,poor,2,ECO204,Hard class... at least hes kinda funny,03/10/2018,5.0,5.0,,2,N/A,2.0,2.0,1,No,1520696992000,No,1484,Yes,,N/A,[],people,people
Mandatory,good,good,good,0,29623182,4,,good,4,ECO204,"Great prof overall but if you don't do as he says, you are done. Work hard and go to class and he will love you for it. Skip class and his test will kill you :) Good Luck!",03/05/2018,4.0,4.0,,4,N/A,4.0,4.0,3,No,1520278055000,Yes,1484,Yes,,B+,"['Amazing lectures', 'Hilarious', ""Skip class? You won't pass.""]",people,people
Mandatory,poor,good,poor,4,29613993,0,online,awful,1,ECO204,"If you listen closely and pay attention in class (writing notes) and supplimenting that with a read of his textbook (+ doing the homework), you should be alright. Oh, and don't expect something not to be on the test. If he mentioned it, chances it will be there. Beware of subtle hints.",03/02/2018,5.0,5.0,,1,N/A,1.0,1.0,1,Yes,1519991924000,No,1484,Yes,,N/A,"[""Skip class? You won't pass."", 'Respected', 'Lots of homework']",people,people
Mandatory,good,good,good,0,29534093,6,,awesome,5,ECO204,this guys the best. by the far the best teacher i have had in rotman. explains thing amazingly and actually cares about students and will make try to make a relationship with you. super easy to talk to for advice. he challenges you so if you arent smart dont complain that his tests are hard,02/03/2018,4.0,4.0,,5,N/A,5.0,5.0,1,Yes,1517700836000,Yes,1484,Yes,,A,"['Inspirational', 'Amazing lectures', 'Hilarious']",people,people
Mandatory,average,good,average,4,29017464,1,,average,3,ECO204,"Professor Ajaz is a great prof overall. His lectures are really funny and he tries hard to explain the EXTREMELY COMPLEX material. The tests are super hard though and I found that it was geared mostly to Finance/Econ specialists. As an accounting specialist who hates Eco, I struggled alot with the course.",12/02/2017,5.0,5.0,,3,N/A,3.0,3.0,1,Yes,1512174423000,No,1484,Yes,,N/A,"['Get ready to read', 'Tough grader']",person,people
Not Mandatory,good,good,good,3,28996366,1,,awesome,5,ECO204,"The greatest professor I have had a Rotman so far. He explains the theoretical concepts exceptionally well and then applies them to real life examples to teach practical uses. If you are a mgmt/accounting specialist and dont want a future in economics or finance, avoid him as he is very tough and expects you to know all concepts to the core.",11/30/2017,4.0,4.0,,5,N/A,5.0,5.0,1,Yes,1512000612000,Yes,1484,Yes,,A+,"['Caring', 'Respected', 'Amazing lectures']",person,people
Not Mandatory,good,average,good,2,28910964,5,,awesome,5,ECO204,Ajaz is so excellent and we can learn so many things in his lecture. He provides some concepts in RSM 332 so that we can prepare well before we take RSM332. He has his own text book and the contents are very clear. The best Prof I met in my second year.,11/15/2017,3.0,3.0,,5,N/A,5.0,5.0,1,No,1510785066000,Yes,1484,Yes,,N/A,['Inspirational'],people,people
Not Mandatory,good,good,good,1,28752776,3,,good,4,ECO204,"I was skipping his classes now I regretted. Not that my mark was low, but that I didn't learn everything from him. I am taking Financial Risk Management exam I now and there are handful of content that were covered by him in ECO204. Including but not limited to VaR, Monte-Carlo simulation, Capital Market Lines etc. I hope I could express my thanks.",10/17/2017,4.0,4.0,,4,N/A,4.0,4.0,1,Yes,1508261476000,Yes,1484,Yes,,C+,"[""Skip class? You won't pass."", 'Hilarious', 'Lots of homework']",people,person
Not Mandatory,poor,good,poor,14,28634384,5,,awful,1,ECO1010,"Man, this guy sucks. I've taken a ton of math in undergrad and this guy can't explain a mathematical concept for his life. Sure, he's funny and keep things light, but is just an awful instructor who can't explain simple concepts at all. If you ask a question, he'll likely cut you off and try to answer before you even get your question across.",08/22/2017,4.0,4.0,,1,N/A,1.0,1.0,1,No,1503442263000,No,1484,Yes,,N/A,[],people,people
Mandatory,poor,good,poor,8,28597273,3,,awful,1,EC204L010,Worst Prof ever. Like enough said. Don't take his course.,08/08/2017,5.0,5.0,,1,N/A,1.0,1.0,1,No,1502231963000,No,1484,Yes,,N/A,[],people,people
Mandatory,poor,good,poor,8,28565937,3,,awful,1,ECO204,The worst prof at UofT. The material taught is useless and difficult and his teaching style doesn't help. Avoid at all costs. Save your 2nd year GPA and stay away from this man.,07/28/2017,5.0,5.0,,1,N/A,1.0,1.0,1,No,1501265411000,No,1484,Yes,,WD,"['Lots of homework', 'Tough grader', ""Skip class? You won't pass.""]",people,people
Mandatory,poor,good,poor,10,28537217,4,,awful,1,ECO204,horroible accent. You could hardly understanding wtf he is talking in the lecture except some dirty jokes. His pronunciation is really unclear. He should not be teaching.,07/17/2017,5.0,5.0,,1,N/A,1.0,1.0,1,No,1500308746000,No,1484,Yes,,D-,"['Lecture heavy', 'Tough grader']",people,people
N/A,good,average,good,5,28534108,9,,awesome,5,ECO204,"Thanks to Ajaz 3rd & 4th year was a breeze ! Kids who say the other profs are easier forget that they will write an exam created, in most part, by Ajaz so no way of getting around that. If you are in Economics and Accounting and you don't take you will most likely struggle in upper years because it only gets harder from here - yet Ajaz will prep u!",07/15/2017,2.0,2.0,,5,N/A,5.0,5.0,1,Yes,1500151572000,Yes,1484,Yes,,A-,"['Gives good feedback', 'Respected', 'Hilarious']",people,people
Mandatory,good,average,good,2,28532407,7,,awesome,5,EC204L010,BEST Prof for ECO204! Because of him I managed to get 75-80% i n all my 3rd year finance course. He is not that hard compared to the other profs + he writes 90% of the exam since he teaches the most sections. The way he teaches you really helps you with upper year courses since you gotta learn the material anyway - better to learn it now! THE BEST!,07/14/2017,3.0,3.0,,5,N/A,5.0,5.0,1,Yes,1500058075000,Yes,1484,Yes,,B+,"['Gives good feedback', 'Hilarious', 'Respected']",people,people
Mandatory,poor,good,poor,6,28527206,5,,awful,1,ECO204,"I DO NOT RECOMMEND  TAKING ECO204 WITH AJAZ. unless you are  some next genius or are really talented in economics, taking it with him is not worth it. I tried so hard and did terrible, never thought i would do so badly in university. this course took over my life, the exam was insanely difficult and i wish someone told me to stay away from him!!",07/12/2017,5.0,5.0,,1,N/A,1.0,1.0,1,No,1499889523000,No,1484,Yes,,C-,[],people,people
Mandatory,good,good,good,5,28429053,6,,awesome,5,ECO204,"He is the best instructor i ever had in u of t, test are extremely hard, if you skip his class, you wont pass for sure. really tough test but i miss him",06/06/2017,5.0,5.0,,5,N/A,5.0,5.0,1,No,1496782137000,Yes,1484,Yes,,B-,"['Gives good feedback', 'Amazing lectures', 'Tough grader']",people,people
Not Mandatory,good,good,good,6,28398905,8,,awesome,5,ECO204,"Easily one of the most useful lectures I have ever attended. He can be insensitive towards your feelings but that should be understandable if you are not too easily butthurt. And for whoever complaining about the difficulty of the course, it is MEANT to be challenging, or why do you think we are called UofTEARS??",05/29/2017,4.0,4.0,,5,N/A,5.0,5.0,1,No,1496098740000,Yes,1484,Yes,,A+,"[""Skip class? You won't pass."", 'Lecture heavy', 'So many papers']",people,people
N/A,poor,good,poor,20,28011594,2,,awful,1,ECO204,"The stupidest professor i have ever seen. Poor teaching quality, like to make fun in class through dirty and boring jokes, so much mistakes in course materials. Always waste students' time to do lots of meaningless things. His lectures are so confusing and always makes things more harder than it should be. Soooooo stupid.",04/07/2017,5.0,5.0,,1,N/A,1.0,1.0,1,No,1491534102000,No,1484,Yes,,N/A,"['Tough grader', 'Lecture heavy']",people,people
Mandatory,average,good,average,16,27814272,0,,poor,2,ECO204,"Ajaz seems like a funny person, but beware. 204 is one of the hardest courses offered at UofT and he is a large reason why. Take Karen (or another prof) if at all possible - most of Karen's feedback is old and her students last year got a ton of easy and free marks.",02/08/2017,5.0,5.0,,2,N/A,2.0,2.0,1,Yes,1486567319000,No,1484,Yes,,C+,"['Tough grader', ""Skip class? You won't pass."", 'Get ready to read']",people,people
Not Mandatory,poor,good,poor,10,27725280,0,,awful,1,ECO204,"Ajaz's lectures are mediocre at best because he attempts to make concepts harder than they really are. You can do well without attending his lectures, which are graph heavy, and self study for tests, which are number heavy. By the end of the course, you will be happy to never hear his repetitive jokes.",01/12/2017,4.0,4.0,,1,N/A,1.0,1.0,1,No,1484263804000,No,1484,Yes,,N/A,"['Test heavy', 'Lecture heavy', 'Lots of homework']",people,people
N/A,good,good,good,3,26959490,12,,awesome,5,ECO204,You will hate this class and you will hate this prof in the moment. You will stay up for hours reading his hand-made PDF textbook while pulling your hair out. You will lose all hope during the exams. You will pass the course with a fantastic grade because of a 40% curve. You will look back and realize he taught you how to learn properly and timeman,09/07/2016,5.0,5.0,,5,N/A,5.0,5.0,1,Yes,1473254653000,Yes,1484,Yes,,A,"['Get ready to read', 'Lots of homework', 'Tough grader']",people,people
Mandatory,poor,average,poor,17,26923417,2,,awful,1,ECO204,"Professor Ajaz is an incredibly poor pedagogue.  He is best described as an extreme narcissist; he spends as much time berating  students for misunderstanding his poorly worded lectures as he does teaching.  He is notorious for being unavailable, unwilling to answer questions, and generally uncaring about his student's learning.  Avoid at all costs",08/23/2016,3.0,3.0,,1,N/A,1.0,1.0,1,Yes,1471954208000,No,1484,Yes,,N/A,[],people,people
N/A,good,average,good,3,26605129,12,,awesome,5,ECO204,"Literally best prof of all time. As long as you have decent math foundations and do all required work, you'll be fine. Textbook is not necessarily required because his lectures and slides are very clear. This course is not as scary as it seems. Projects are very useful.",05/18/2016,2.0,2.0,,5,N/A,5.0,5.0,1,Yes,1463542754000,N/A,1484,Yes,,A+,"['Respected', 'Inspirational', 'Amazing lectures']",people,people
N/A,good,average,good,3,26564723,10,,awesome,5,ECO204,One of the best profs at U of T! Very easily approchable and his projects are very usefull. One of the most usefull courses at U of T that I have ever taken.,05/13/2016,3.0,3.0,,5,N/A,5.0,5.0,1,Yes,1463138262000,Yes,1484,Yes,,A,"['Respected', 'Amazing lectures']",people,people
Mandatory,average,good,average,2,26411252,9,,poor,2,ECO404,"Great prof, great class, but get ready to work.",04/28/2016,4.0,4.0,,2,N/A,2.0,2.0,1,No,1461881262000,N/A,1484,N/A,,A,"['Respected', 'Hilarious', 'Inspirational']",people,people
Not Mandatory,good,good,good,4,25986668,8,,awesome,5,ECO204,"One of the best professors in North America. Super enthusiastic about a boring topic. Keeps class engaged. The course itself is incredibly tough, and thus explaining the difficulty of the exams, and the lower averages. It's a course where brains and smartness doesn't help, only hard work can get you somewhere.",01/24/2016,5.0,5.0,,5,Really into it,5.0,5.0,1,No,1453651558000,N/A,1484,Yes,,B-,"['Respected', 'Gives good feedback', 'Tough grader']",people,people
Not Mandatory,good,good,good,2,24990750,3,,good,4,ECO204,"Professor Hussain is the best prof I've had at UofT!  It's been over a year since I graduated from UofT but I now value how he pushes you to excel and truly understand the concepts instead of counting on mere memorization. Hilarious, informative and all around great guy! ",06/23/2015,5.0,5.0,,4,It's my life,4.0,4.0,1,No,1435101549000,N/A,1484,Yes,,A,"['Hilarious', 'Inspirational', 'Respected']",people,people
N/A,average,average,average,6,23813643,4,,poor,2,RSM1210,"At the beginning the classes were okay because the materials were relatively simple and he cracks jokes here and there. However, towards the end of the course, his jokes got old and he was very unorganized (i.e. missed class, cancelled a exam Q&A session, a lot of mistakes on practice question solutions,etc)  ",11/14/2014,3.0,3.0,,2,Low,2.0,2.0,1,No,1415956967000,N/A,1484,Yes,,N/A,[],people,people
Mandatory,good,good,good,1,23621682,1,,good,4,RSM1210,"The most entertaining prof one can hope to come across. Makes economic sense, ensuring you understand the material and also don't fall asleep in class, thanks to his tequila jokes. Lectures material is very useful, though can get a bit too much at times. Overall tough course, but effective prof and hilarious lectures. ",10/01/2014,4.0,4.0,,4,Really into it,4.0,4.0,1,No,1412126605000,N/A,1484,Yes,,N/A,"['Amazing lectures', 'Hilarious', 'Respected']",person,person
N/A,good,average,good,1,23458123,3,,awesome,5,ECO204,I found Ajaz very delightful. He was a straight forward prof and explained the material as well as he could. My advice to potential students is to be super keen in his course. If you are the results will definitely follow. It seems hard on the surface but the concepts are easy when you put pen to paper.,07/20/2014,2.0,2.0,,5,Sorta interested,5.0,5.0,1,No,1405837808000,N/A,1484,N/A,,N/A,[],people,person
N/A,average,good,average,1,23141051,2,,average,2,ECO204,"It's now 2 years after completing this course and surprisingly passing it. It is quite traumatizing when taking it and after the final exam, you pretty much feel like a failure but you learn a lot through his real life examples. Most of the logic behind the algebra is very challenging to understand though. But Ajaz is a funny and friendly prof!",05/01/2014,5.0,5.0,,4,Sorta interested,3.0,3.0,1,No,1398951517000,N/A,1484,N/A,,N/A,[],people,person
N/A,poor,good,poor,2,23055740,1,,awful,1,ECO204,"ridiculous professor. lecture slides are totally useless. tutorial is actually more useful than his lecture. And he only bell curve by percentage, which only makes high mark higher and low mark lower relatively.",04/17/2014,5.0,5.0,,1,Low,1.0,1.0,1,No,1397748929000,N/A,1484,N/A,,N/A,[],person,people
N/A,good,good,average,3,21900150,0,,good,4,ECO204,Crazy dictator ! He doesn't care about anything! Lectures were entertaining at times and material was interesting but when going through some of the algebra on the home works or trying to figure out excel for his assignments you can really develop a hatred for him.,06/17/2013,5.0,5.0,,3,Really into it,3.5,3.5,1,No,1371488827000,N/A,1484,N/A,,N/A,[],people,people
N/A,good,good,good,0,21617481,1,,awesome,5,ECO204,"Professor Ajaz is a great professor! I ever had at university! His curriculum is very hard, but u learn a lot. I will say it again, the most amazing professor at U of T. Five stars to prof Ajaz!",04/27/2013,4.0,4.0,,4,Really into it,4.5,4.5,1,No,1367066202000,N/A,1484,N/A,,N/A,[],person,people
