attendance,clarityColor,easyColor,helpColor,helpCount,id,notHelpCount,onlineClass,quality,rClarity,rClass,rComments,rDate,rEasy,rEasyString,rErrorMsg,rHelpful,rInterest,rOverall,rOverallString,rStatus,rTextBookUse,rTimestamp,rWouldTakeAgain,sId,takenForCredit,teacher,teacherGrade,teacherRatingTags,unUsefulGrouping,usefulGrouping
N/A,good,good,good,0,18501842,0,,awesome,5,ENG5519,"Professor Cuddy-Keane's class was challenging, but also extremely rewarding. While a narratological approach obviously does not appeal to al students, she somehow manages to make even highly interdisciplinary and scientific work as that seem interesting, important, and compelling.  A class which has made me a better student, a writer, and human! :)",05/01/2011,5.0,5.0,,5,Really into it,5.0,5.0,1,Yes,1304263292000,N/A,1484,N/A,,N/A,[],people,people
N/A,good,average,good,0,16911037,0,,awesome,5,ENGC80,One of the very best professors I have had the opportunity to work with. Her assignments actually push you to be a better writer as opposed to simply gauging your current level. Take a course with her- it's an awesome experience.,03/25/2010,3.0,3.0,,4,Sorta interested,4.5,4.5,1,Yes,1269532904000,N/A,1484,N/A,,N/A,[],people,people
N/A,good,good,good,0,13302644,0,,awesome,5,ENG328,"Wonderful professor. Lectures are thought provoking -- a pleasure to go to. You learn a lot, grow as a student, thinker and as a human being. Great person and scholar who who maintains integrity and high standards of the English Dep't. Great selection of works and T.A.s. Challenging course but not impossible! The BEST!",06/30/2007,4.0,4.0,,5,Sorta interested,5.0,5.0,1,No,1183229031000,N/A,1484,N/A,,N/A,[],people,people
N/A,average,good,average,0,13124317,0,,average,3,ENG328,"Her course was the toughest course I have ever taken at UofT.I liked her lectures, but didn't like the tutorials.She also said that she wanted to prove to the UofT community that English courses are hard.Other students found the course VERY challenging.There were 74ppl in the course, but it dropped to 59ppl at the end of the year.",05/07/2007,5.0,5.0,,3,Sorta interested,3.0,3.0,1,No,1178567708000,N/A,1484,N/A,,N/A,[],people,people
Mandatory,good,good,good,0,10588624,0,,awesome,5,ENG423WOOLF,I liked her approach to literature.  I liked her approach to criticism.  I liked her approach to Woolf.  I liked her approach to pedagogy.  I liked her.  Tough marker and can run a bit of an intellectual sweatshop but the outcome outweighs the effort.,10/14/2005,4.0,4.0,,5,It's my life,5.0,5.0,1,N/A,1129296073000,N/A,1484,N/A,,A,[],people,people
N/A,good,good,good,0,1930794,0,,awesome,5,ENG328,One of the most inspiring and brilliant professors I've ever had.  Her lectures are thought-provoking and she clearly loves her students.  It is so refreshing to find a professor who cares this much and wants her students to succeed.,04/09/2004,4.0,4.0,,5,N/A,5.0,5.0,1,N/A,1081541810000,N/A,1484,N/A,,N/A,[],people,people
N/A,good,average,good,0,1019941,0,,good,4,ENG328Y,"A great professor.  Probably one of the best at UT.  Very helpful, and a brilliant lecturer.",06/19/2003,3.0,3.0,,4,N/A,4.0,4.0,1,N/A,1056044995000,N/A,1484,N/A,,N/A,[],people,people
