attendance,clarityColor,easyColor,helpColor,helpCount,id,notHelpCount,onlineClass,quality,rClarity,rClass,rComments,rDate,rEasy,rEasyString,rErrorMsg,rHelpful,rInterest,rOverall,rOverallString,rStatus,rTextBookUse,rTimestamp,rWouldTakeAgain,sId,takenForCredit,teacher,teacherGrade,teacherRatingTags,unUsefulGrouping,usefulGrouping
Mandatory,good,good,good,0,28601847,0,,awesome,5,TRN250Y,"It was clearly the most useful IR class,ineresting. She tries to raise the level of attention with jokes and with her Maryl Streep - like behaviour. LOTS OF READINGS, but they are not too critical, just helping to deepen our knowledge. Huge essays though and obviously they always try to average around 70. Finals/ Midterms were the same like before.",08/10/2017,4.0,4.0,,5,N/A,5.0,5.0,1,No,1502363113000,Yes,1484,N/A,,B-,"['Get ready to read', 'Participation matters', 'Amazing lectures']",people,people
Mandatory,good,good,good,0,28117270,0,,good,4,TRN250Y,"This professor is really approachable and welcoming. She is also very passionate about the subject. However, her voice is really monotone and makes you fall a sleep. I really could not help it but TRN250 was my least favourite class. The course is all over the place . Lecture notes (5-8 pages per class). About 200 pages per class in readings",04/25/2017,5.0,5.0,,4,N/A,4.0,4.0,1,No,1493088409000,Yes,1484,Yes,,N/A,"[""Skip class? You won't pass."", 'Get ready to read', 'Lecture heavy']",people,people
Mandatory,good,good,good,0,27972434,1,,awesome,5,TRN250Y,"I took TRN250  this past year and it was by far my favourite class.  Prof. MacDonald is truly caring, intelligent, and engaging. The material of the course is fascinating - history based and an unique approach to looking at IR. This course completely changed how I look at IR, history, and the world. Cannot recommend TRN250 & Prof. Macdonald enough!",03/30/2017,4.0,4.0,,5,N/A,5.0,5.0,1,Yes,1490902456000,Yes,1484,Yes,,A,"['Lecture heavy', 'Caring', 'Get ready to read']",person,people
Not Mandatory,good,average,good,0,27792753,0,,awesome,5,TRN411,"I had the pleasure of being in Professor MacDonald's TRN250 class as well as TRN411. Although the content of 250 wasn't the most interesting, Professor MacDonald was nothing but an engaging, enthusiastic and inspirational educator. She is one of the kindest professors I've had, and is VERY flexible in letting students pursue their interests.",01/31/2017,3.0,3.0,,5,N/A,5.0,5.0,1,No,1485878791000,Yes,1484,Yes,,N/A,"['Inspirational', 'Caring', 'Respected']",people,people
Not Mandatory,good,good,good,0,26825474,0,,good,4,TRN250Y,"Professor MacDonald is such a lovely person! She makes herself available to you and is always willing to give you advice and feedback. The course itself was pretty dry, but she did her best to make it interesting. She makes you think deeper.",07/22/2016,4.0,4.0,,4,N/A,4.0,4.0,1,No,1469192187000,Yes,1484,Yes,,N/A,"['Respected', 'Gives good feedback', 'Caring']",people,people
Not Mandatory,good,average,good,0,26377131,0,,awesome,5,TRN250Y,"Lovely professor that's passionate about her job, and motivates her students to explore their curiosities. However, I was not a fan of the inverted classroom style of learning. Her online modules were well structured, however the Q&A period (1st hr) was so boring. Skip the first hour and just go to tutorial. But still watch modules!!!",04/25/2016,3.0,3.0,,4,N/A,4.5,4.5,1,Yes,1461623850000,N/A,1484,Yes,,N/A,"['Get ready to read', 'Inspirational']",people,people
Not Mandatory,average,average,average,0,25337412,0,,average,2,TRN250Y,"The inverted classroom is the main beef with my experience of the professor. It leads to a classroom experience where the first hour of class is steeped in awkward silence and boredom. I'm sure the professor is wonderful teaching using other methods, but this experience is what sours me on her so far. ",11/03/2015,3.0,3.0,,3,Sorta interested,2.5,2.5,1,Yes,1446590675000,N/A,1484,Yes,,N/A,['Get ready to read'],people,people
N/A,good,average,good,2,24698561,0,,awesome,5,TRN250Y,"TRN250 uses the concept of an inverted class room. Lectures are online modules and there is a weekly seminar -style discussion. Very enjoyable material, focuses on norms such as sovereignty, humanitarian intervention and free trade. Lots of reading, but interesting. Great mock G20 session (taken for credit!). Prof is very approachable and helpful.",04/29/2015,3.0,3.0,,5,It's my life,5.0,5.0,1,Yes,1430327271000,N/A,1484,Yes,,N/A,[],people,people
