attendance,clarityColor,easyColor,helpColor,helpCount,id,notHelpCount,onlineClass,quality,rClarity,rClass,rComments,rDate,rEasy,rEasyString,rErrorMsg,rHelpful,rInterest,rOverall,rOverallString,rStatus,rTextBookUse,rTimestamp,rWouldTakeAgain,sId,takenForCredit,teacher,teacherGrade,teacherRatingTags,unUsefulGrouping,usefulGrouping
Mandatory,good,average,good,0,32939358,0,,awesome,5,HMB302,"One of the best and kindest profs at UofT. Lectures may seem dense initially, but he explains concepts clearly and logically which makes it easy to follow. Just attend lectures and take good notes, you'll do well. Highly recommend any course with him!",02/28/2020,3.0,3.0,,5,N/A,5.0,5.0,1,No,1582867093000,Yes,1484,Yes,,A+,"['Accessible outside class', 'Caring', 'Amazing lectures']",people,people
Mandatory,good,average,good,0,32721943,0,,awesome,5,HMB302,"My time with this beautiful man has come to an end. One of the kindest and funniest profs I've had the pleasure of learning from. Hes the definition of a prof who really wants you to succeed, and gives you all the tools to do so. My only advice for succeeding is to go to class and listen well. HMB202 and 302 were excellent courses.",12/19/2019,3.0,3.0,,5,N/A,5.0,5.0,1,No,1576788672000,Yes,1484,Yes,,N/A,"['Amazing lectures', 'Hilarious', 'Caring']",people,people
N/A,good,average,good,0,31463033,0,,awesome,5,HMB202,Very funny and passionate! Very good lecturer! Fair tests! Good Grader! definitely would take his course again! One of the bests in U of T.,03/21/2019,3.0,3.0,,5,N/A,5.0,5.0,1,No,1553193832000,Yes,1484,Yes,,N/A,"[""Skip class? You won't pass."", 'Respected', 'Hilarious']",people,people
Mandatory,good,average,good,2,28146939,1,,good,4,HMB202H1,"He doesn't stick to lecture slides very effectively, which is why I would 100% recommend attending class- as a lot of what he just says out loud is testable. That being said, the content is very interesting and conceptually simple if you have a science background. He is very clear verbally about what will be on tests, and follows through.",04/27/2017,2.0,2.0,,4,N/A,4.0,4.0,1,No,1493317514000,Yes,1484,Yes,,A+,['Clear grading criteria'],person,people
Mandatory,average,average,average,3,27650423,0,,average,3,HMB302,"He is a good guy overall. But he speaks so fast and most of the things he talks about in class are kind of irrelevant. He seems like he has a hard time focusing on ONE topic at a time. He moves back and forth between the slides. But overall, the test was FAIR and the lectures were fine. I just wish his slides were a liiiiittle bit more organized :(",12/31/2016,3.0,3.0,,3,N/A,3.0,3.0,1,Yes,1483212164000,No,1484,N/A,,A+,"['Accessible outside class', 'Lecture heavy', ""Skip class? You won't pass.""]",people,people
N/A,good,good,good,2,27254919,2,,awesome,5,HMB302,"Wilson is an amazing lecturer. You can see how passionate he is about his field and is very knowledgeable. It's not a bird course, but  the material isn't difficult to grasp, especially when you have Wilson who thoroughly goes through what you should know. He's not there to drag you down. He's amazing prof and would definitely recommend.",11/26/2016,4.0,4.0,,5,N/A,5.0,5.0,1,No,1480119574000,Yes,1484,Yes,,A+,"['Accessible outside class', 'Hilarious', 'Amazing lectures']",people,people
Not Mandatory,good,average,average,0,26204115,0,,average,5,HMB202H1,"Clear lecture style and usually ends up reducing lecture material by at least 25% because he goes very slowly. Extremely unhelpful when asked about test questions  and marking of exams, even when the test questions have errors",03/30/2016,3.0,3.0,,1,N/A,3.0,3.0,1,Yes,1459344917000,N/A,1484,Yes,,Not sure yet,"['Clear grading criteria', 'Get ready to read']",people,people
Not Mandatory,average,good,average,0,25133100,0,,average,2,HMB202,Likes to talk a lot with random but interesting stories even though you won't be tested on it. The exams were fair and the labs are fun. Average for my class was a B which is fair compared to other classes.,08/19/2015,4.0,4.0,,3,Really into it,2.5,2.5,1,Yes,1439972294000,N/A,1484,Yes,,N/A,"['Clear grading criteria', 'Get ready to read', 'Group projects']",people,people
Mandatory,poor,good,average,3,24416172,3,,poor,1,HMB202,Everyone in my year read the his notes and studied his lectures following past year's advice. But this year he definitely crucified everyone who didn't read the textbook. The test was short answer and multiple choice. The multiple choice was around 60% textbook and 40% lecture material but main concepts were never even touched upon. gl,02/26/2015,5.0,5.0,,3,It's my life,2.0,2.0,3,Yes,1424971750000,N/A,1484,Yes,,N/A,"['Group projects', 'Tough grader', 'Get ready to read']",people,people
Not Mandatory,average,good,average,0,23026665,0,,average,3,HMB202H1,Jumps around in topics and throws in strange vocabulary during lectures. Unwilling to help students of this course. He also does not mark the written short answers fairly for this course.,04/11/2014,4.0,4.0,,2,Really into it,2.5,2.5,1,Yes,1397251321000,N/A,1484,N/A,,A-,[],people,people
N/A,good,good,good,0,23026662,3,,good,4,HMB302H1,"Riveting course. Wilson's definitely an expert in histology. Lecutres are clear, though he walks around and sometimes it's hard to hear. Friendly and helpful during office hours as he can re-recite lecture material to clarify certain concepts. Lab exams are traumatizing, but you'll be fine if you study and attend  labs.",04/11/2014,4.0,4.0,,4,It's my life,4.0,4.0,1,No,1397251191000,N/A,1484,N/A,,N/A,[],people,people
N/A,good,average,good,0,20196066,1,,awesome,5,HMB202,"Compared to many other people who rate the proff's based on their exams, I found him to be an exceptional proff, although his textbook readings were awkward, he has a demanding teaching style that really gets you engaged. Very approachable and a nice person. His knowledge in the course and the way he conveys his lectures is outstanding.",05/04/2012,3.0,3.0,,4,It's my life,4.5,4.5,1,Yes,1336132569000,N/A,1484,N/A,,N/A,[],person,people
N/A,average,average,poor,1,19946251,0,,poor,2,HMB202,"Taught the first part of HMB202. The MT was definitely weird; the MC Qs did not directly address the topics we learned (although the SA Qs did). Also, watch out for his textbook scam (he profits from sale). 2/10 chapters were needed for the MT (none for the 2nd half of semester), and he rearranged some chapters so we couldn't buy last year's book",03/24/2012,3.0,3.0,,1,Sorta interested,1.5,1.5,1,No,1332633565000,N/A,1484,N/A,,N/A,[],people,person
N/A,average,poor,average,0,18140524,0,,average,3,HMB202,"Nothing special about his teaching. Test was very easy, if you had come to class, paid attention, and studied his notes. Would have been nice if he had told us that we didn't need the textbook in the first class, rather than just before the midterm though.",01/14/2011,1.0,1.0,,3,Really into it,3.0,3.0,1,No,1295032497000,N/A,1484,N/A,,N/A,[],people,people
N/A,average,average,poor,4,17963817,0,,poor,2,HMB302,"Be calm, be collected and be ready to have felt like you wasted your time--you'll need it when you want to speak to him about a test.  You have to understand that he is rather insecure about criticism toward his wonderfully crafted test questions.",12/16/2010,2.0,2.0,,1,Sorta interested,1.5,1.5,1,Yes,1292502149000,N/A,1484,N/A,,N/A,[],people,people
N/A,average,good,average,0,17943865,1,,average,3,HMB202,"Same as someone else had said already. He's pretty nice, friendly, and has a caring attitude. He's very knowledgeable in the area, but his tests comes off with arbitrary questions and weird wordings. It doesn't help that he is relatively hard to reach, compared to other professors at UofT.",12/14/2010,5.0,5.0,,3,Really into it,3.0,3.0,1,Yes,1292366876000,N/A,1484,N/A,,N/A,[],person,people
N/A,good,good,good,1,15614675,0,,good,4,HMB302,"if he did not become a prof, he makes one great salesman. I still remember he said, &quot;wait a minute, there is more!&quot; but ya, tests were hard and everything in lab looks magenta to me",04/06/2009,5.0,5.0,,4,Sorta interested,4.0,4.0,1,Yes,1239048636000,N/A,1484,N/A,,N/A,[],people,person
N/A,good,good,average,2,14635551,0,,good,4,HMB302,"sounds enthusiastic, but can be a bit of a jerk sometimes, esp. when it comes to tests",07/05/2008,5.0,5.0,,3,Sorta interested,3.5,3.5,1,Yes,1215219548000,N/A,1484,N/A,,N/A,[],people,people
N/A,good,good,good,0,12445263,3,,awesome,5,HMB302,"Seriously, this guy is amazing! One of the best Profs out there. His lectures are organized, clear and he is very enthusiastic about biology. Makes a dry subject really fun to learn. Great labs too. But man, his exams are very long and he marks hard, but I have to admit he gives a fair test. One of the best Profs ever! Definitely myfavourite course",11/18/2006,4.0,4.0,,5,It's my life,5.0,5.0,1,Yes,1163866192000,N/A,1484,N/A,,N/A,[],people,people
N/A,poor,good,poor,3,12259701,1,,awful,1,HMB302,"Seriously, this guy sucks!",09/30/2006,4.0,4.0,,1,Meh,1.0,1.0,1,No,1159643168000,N/A,1484,N/A,,N/A,[],person,people
N/A,good,good,good,1,3942783,0,,good,4,HMB302,"Comes off as a nice, caring guy but is unpredictable. Sometimes, marks reasonably and sometimes almost completely arbitrarily and horrendously (i.e. final exam)",05/31/2005,4.0,4.0,,4,It's my life,4.0,4.0,1,N/A,1117530096000,N/A,1484,N/A,,N/A,[],people,person
N/A,good,average,good,0,1231388,0,,awesome,5,HMB302,He's one of U of T's BEST!!,10/28/2003,3.0,3.0,,5,N/A,5.0,5.0,1,N/A,1067359126000,N/A,1484,N/A,,N/A,[],people,people
