attendance,clarityColor,easyColor,helpColor,helpCount,id,notHelpCount,onlineClass,quality,rClarity,rClass,rComments,rDate,rEasy,rEasyString,rErrorMsg,rHelpful,rInterest,rOverall,rOverallString,rStatus,rTextBookUse,rTimestamp,rWouldTakeAgain,sId,takenForCredit,teacher,teacherGrade,teacherRatingTags,unUsefulGrouping,usefulGrouping
Mandatory,good,average,good,2,31534809,0,,awesome,5,HIS378,Will always remember Professor Savage as one of my favourite lecturers at U of T during my undergrad. He was so passionate about teaching and showed real enthusiasm about the material. If youre reading this Professor thanks for being so cool &amp; dont let academia kill your passion!! Lol,04/04/2019,2.0,2.0,,5,N/A,5.0,5.0,1,Yes,1554422315000,Yes,1484,Yes,,B+,"['Inspirational', 'Caring', 'Amazing lectures']",people,people
N/A,good,average,good,1,30332697,0,,awesome,5,USA310,The best history class I've ever taken at U of T was with him. Extremely kind and really cares about his students. Quick with marking too! Would highly recommend taking one of his classes if you can,07/09/2018,2.0,2.0,,5,N/A,5.0,5.0,1,Yes,1531179463000,Yes,1484,Yes,,A,"['Caring', 'Beware of pop quizzes', 'Amazing lectures']",people,person
Not Mandatory,poor,average,poor,0,29709286,10,,awful,1,HIS378,"A nice person, and approachable, but terrible as a professor. His lectures aren't well informed and viewpoints are bias. Unaccepting of differing viewpoints. He assigns too many readings, and some don't relate to lecture",03/28/2018,3.0,3.0,,1,N/A,1.0,1.0,1,No,1522246194000,No,1484,Yes,,N/A,"['Accessible outside class', 'Get ready to read', 'Lecture heavy']",people,people
N/A,good,average,good,3,29654901,0,,awesome,5,USA310,"Savage was super approachable and always willing to talk to his students. He returns assignments very quickly, and clearly prioritizing teaching. He is a very fair grader and makes his expectations known and reasonable. Also one of the most phenomenal lecturers I've ever had - he presents with unparalleled clarity and enthusiasm. Highly Recommended",03/14/2018,2.0,2.0,,5,N/A,5.0,5.0,1,No,1521068367000,Yes,1484,Yes,,A,"['Amazing lectures', ""Skip class? You won't pass."", 'Accessible outside class']",people,people
Not Mandatory,good,average,good,3,29285314,0,,awesome,5,USA310,"Great professor. Teaches in an entertaining, but informative way (in a 2 hour lecture I would have 5 pages of typed notes). Funny guy, marks really quick which is really nice.",12/19/2017,3.0,3.0,,5,N/A,5.0,5.0,1,Yes,1513726750000,Yes,1484,Yes,,A,"['Beware of pop quizzes', 'Amazing lectures', 'Get ready to read']",people,people
Not Mandatory,poor,good,poor,0,29076415,12,,awful,1,HIS378,Terrible prof. Uses a great deal of bias to the point that there is limited objective learning that a student will intake.,12/07/2017,5.0,5.0,,1,N/A,1.0,1.0,1,Yes,1512616792000,No,1484,Yes,,WD,[],people,people
Mandatory,good,average,good,3,28946398,0,,awesome,5,HIS378,"Really nice, fair grader, easy course if you keep up with lectures. Great guy.",11/21/2017,2.0,2.0,,5,N/A,5.0,5.0,1,No,1511268522000,Yes,1484,Yes,,Not sure yet,['Accessible outside class'],people,people
Mandatory,good,average,good,4,28707314,0,,awesome,5,HIS378,Really nice and attentive and his lectures are my favourite this year. I always look forward to his class on Fridays because he's such a great speaker and the content is really interesting. He also deserves the chili pepper - pretty cute in a nerdy way. Just another reason to show up hehe,10/01/2017,3.0,3.0,,5,N/A,5.0,5.0,1,Yes,1506862284000,Yes,1484,Yes,,N/A,"['Caring', 'Amazing lectures', 'Accessible outside class']",people,people
Mandatory,good,average,good,2,28150453,0,,awesome,5,HIS388,Best prof I've had at U of T- so fair and kind! He gives a lot of reading but it is always interesting and he goes over information thoroughly in lectures. Would recommend his course to anyone.,04/28/2017,2.0,2.0,,5,N/A,5.0,5.0,1,Yes,1493340614000,Yes,1484,Yes,,A,"['Respected', 'Get ready to read', 'Gives good feedback']",people,people
