attendance,clarityColor,easyColor,helpColor,helpCount,id,notHelpCount,onlineClass,quality,rClarity,rClass,rComments,rDate,rEasy,rEasyString,rErrorMsg,rHelpful,rInterest,rOverall,rOverallString,rStatus,rTextBookUse,rTimestamp,rWouldTakeAgain,sId,takenForCredit,teacher,teacherGrade,teacherRatingTags,unUsefulGrouping,usefulGrouping
N/A,poor,good,poor,0,229247,0,,awful,1,JUP250,this guy makes psy100 look like the work of a genious,06/23/2002,5.0,5.0,,1,N/A,1.0,1.0,1,N/A,1024829193000,N/A,1484,N/A,,N/A,[],people,people
N/A,poor,good,poor,0,229067,0,,awful,1,JUP250,No Comments,06/22/2002,5.0,5.0,,1,N/A,1.0,1.0,1,N/A,1024768171000,N/A,1484,N/A,,N/A,[],people,people
N/A,good,average,good,0,228953,0,,awesome,5,JUP250,Bad-review people probably just did bad in the course. John is amazing!!! =),06/22/2002,3.0,3.0,,5,N/A,5.0,5.0,1,N/A,1024747477000,N/A,1484,N/A,,N/A,[],people,people
N/A,poor,good,poor,0,228947,0,,awful,1,JUP250,this guy is spiteful because hes not good enough,06/22/2002,5.0,5.0,,1,N/A,1.0,1.0,1,N/A,1024742332000,N/A,1484,N/A,,N/A,[],people,people
N/A,poor,good,poor,0,228614,0,,awful,1,JUP250,"fast and boring lecture, very subjective marking, this guy is not coming back",06/21/2002,5.0,5.0,,1,N/A,1.0,1.0,1,N/A,1024658483000,N/A,1484,N/A,,N/A,[],people,people
Mandatory,poor,good,poor,0,228526,0,,awful,1,JUP250,"will fail you if you are better then him, too bad it will cost you dearly",06/21/2002,5.0,5.0,,1,N/A,1.0,1.0,1,N/A,1024622667000,N/A,1484,N/A,,A+,[],people,people
N/A,good,average,good,0,228437,0,,good,4,JUP250,No Comments,06/20/2002,3.0,3.0,,4,N/A,4.0,4.0,1,N/A,1024613056000,N/A,1484,N/A,,N/A,[],people,people
N/A,poor,good,poor,0,228349,0,,awful,1,JUP250,"all you have is class notes, so write fast, text is useless, marks hard",06/20/2002,5.0,5.0,,1,N/A,1.0,1.0,1,N/A,1024602868000,N/A,1484,N/A,,A,[],people,people
N/A,good,average,good,0,228199,0,,awesome,5,JUP250,He is a rock star to the max!  The best teacher I have had in university yo.,06/20/2002,3.0,3.0,,5,N/A,5.0,5.0,1,N/A,1024575954000,N/A,1484,N/A,,N/A,[],people,people
N/A,average,good,average,0,228065,0,,poor,2,JUP250,No Comments,06/20/2002,4.0,4.0,,2,N/A,2.0,2.0,1,N/A,1024536028000,N/A,1484,N/A,,N/A,[],people,people
N/A,average,average,average,0,228037,0,,poor,2,JUP250,"easy as heck, but cant lecture",06/20/2002,2.0,2.0,,2,N/A,2.0,2.0,1,N/A,1024531671000,N/A,1484,N/A,,N/A,[],people,people
N/A,poor,poor,poor,0,227984,0,,awful,1,JUP250,No Comments,06/19/2002,1.0,1.0,,1,N/A,1.0,1.0,1,N/A,1024527008000,N/A,1484,N/A,,N/A,[],people,people
N/A,average,good,average,0,218880,0,,average,3,JUP250,He is the rebirth of cool.,05/30/2002,5.0,5.0,,3,N/A,3.0,3.0,1,N/A,1022757192000,N/A,1484,N/A,,N/A,[],people,people
N/A,good,good,good,0,214989,0,,awesome,5,JUP250Y,"John's course is by far the most interesting, informative course I've taken!",05/21/2002,4.0,4.0,,5,N/A,5.0,5.0,1,N/A,1021989988000,N/A,1484,N/A,,N/A,[],people,people
N/A,good,good,good,0,189704,0,,awesome,5,JUP250,Best prof I've ever had. Truly inspiring.,04/24/2002,4.0,4.0,,5,N/A,5.0,5.0,1,N/A,1019692432000,N/A,1484,N/A,,N/A,[],people,people
N/A,good,good,good,0,165564,0,,good,4,JUP250Y,"Unbelievably brilliant, insane man--the course is difficult, but worth the work.",04/08/2002,4.0,4.0,,4,N/A,4.0,4.0,1,N/A,1018224558000,N/A,1484,N/A,,N/A,[],people,people
N/A,good,good,average,0,149436,0,,good,4,JUP250,Amazing prof but hard course. Be prepared to write really fast & read lots,03/27/2002,5.0,5.0,,3,N/A,3.5,3.5,1,N/A,1017194911000,N/A,1484,N/A,,N/A,[],people,people
Mandatory,average,good,average,0,63497,0,,average,3,JUP250,This dude talks too fast.. Hard to take good notes.,11/28/2001,4.0,4.0,,3,N/A,3.0,3.0,1,N/A,1006912607000,N/A,1484,N/A,,N/A,[],people,people
N/A,good,good,good,0,52673,0,,awesome,5,JUP250,Fabulous!  Take anything with him!,10/30/2001,4.0,4.0,,5,N/A,5.0,5.0,1,N/A,1004406382000,N/A,1484,N/A,,N/A,[],people,people
N/A,good,good,good,0,52658,0,,awesome,5,JUP250,Excellent prof. imparts his enthusiasm to the class. Known as Mr. Vivacious,10/30/2001,4.0,4.0,,5,N/A,5.0,5.0,1,N/A,1004400324000,N/A,1484,N/A,,N/A,[],people,people
N/A,good,good,good,0,50520,0,,awesome,5,JUP250,"Not an easy course, but he is an unbelievably good professor.  Worth any pain yo",10/22/2001,4.0,4.0,,5,N/A,5.0,5.0,1,N/A,1003769658000,N/A,1484,N/A,,N/A,[],people,people
N/A,good,good,good,0,45958,0,,awesome,5,JUP250,No Comments,09/30/2001,4.0,4.0,,5,N/A,5.0,5.0,1,N/A,1001855218000,N/A,1484,N/A,,N/A,[],people,people
