attendance,clarityColor,easyColor,helpColor,helpCount,id,notHelpCount,onlineClass,quality,rClarity,rClass,rComments,rDate,rEasy,rEasyString,rErrorMsg,rHelpful,rInterest,rOverall,rOverallString,rStatus,rTextBookUse,rTimestamp,rWouldTakeAgain,sId,takenForCredit,teacher,teacherGrade,teacherRatingTags,unUsefulGrouping,usefulGrouping
Mandatory,good,average,good,1,32853157,0,,awesome,5,ECE361,"Such a great professor. Clarify everything so clearly in lectures. Humorous and the lecture is engaging. You will never regret enrolling in his class. Really care about students. Since he was once the student of U of T, he knows what we are caring about :-)",01/21/2020,3.0,3.0,,5,N/A,5.0,5.0,1,No,1579574393000,Yes,1484,Yes,,N/A,"['Inspirational', 'Amazing lectures', ""Skip class? You won't pass.""]",people,person
Mandatory,good,good,good,1,32850724,0,,awesome,5,ECE361,"Great prof who makes great lectures with very detailed slides. Very enjoyable to be in his class, makes great jokes and cares about his students.",01/20/2020,4.0,4.0,,5,N/A,5.0,5.0,1,No,1579489528000,Yes,1484,Yes,,N/A,"['Respected', 'Amazing lectures', 'Hilarious']",people,person
Mandatory,good,average,good,1,32669506,0,,awesome,5,ECE361,He really cares about his students!,12/15/2019,3.0,3.0,,5,N/A,5.0,5.0,1,Yes,1576449854000,Yes,1484,Yes,,N/A,[],people,person
N/A,good,good,good,1,29634825,1,,awesome,5,APS105,An amazing prof!,03/08/2018,4.0,4.0,,5,N/A,5.0,5.0,1,No,1520519403000,Yes,1484,Yes,,N/A,"['Caring', 'Hilarious', 'Amazing lectures']",person,person
Mandatory,good,good,good,1,29556561,0,,awesome,5,APS105,Very amusing lectures,02/11/2018,4.0,4.0,,5,N/A,5.0,5.0,1,No,1518379216000,Yes,1484,Yes,,N/A,"['Hilarious', 'Amazing lectures', 'Inspirational']",people,person
Mandatory,good,average,good,4,29432116,0,,awesome,5,ECE361,"Hamid is a great prof. He talks about himself in the third person, which is a bit weird, but he is a funny guy. I found his lectures really engaging; he did his best to not just read off of the PowerPoint slides. His tests were sometimes a bit confusing, but he did give students bonus marks when the midterm average was low.",01/10/2018,3.0,3.0,,5,N/A,5.0,5.0,1,No,1515616173000,Yes,1484,Yes,,A-,"['Caring', 'Hilarious', 'Participation matters']",people,people
