attendance,clarityColor,easyColor,helpColor,helpCount,id,notHelpCount,onlineClass,quality,rClarity,rClass,rComments,rDate,rEasy,rEasyString,rErrorMsg,rHelpful,rInterest,rOverall,rOverallString,rStatus,rTextBookUse,rTimestamp,rWouldTakeAgain,sId,takenForCredit,teacher,teacherGrade,teacherRatingTags,unUsefulGrouping,usefulGrouping
Not Mandatory,good,poor,good,0,25061714,0,,awesome,5,COS126,Dr Bazinet is a hard working man and you can tell he comes from Cornwall Ontario.,07/23/2015,1.0,1.0,,5,It's my life,5.0,5.0,1,Yes,1437665672000,N/A,1484,Yes,,B+,"['Caring', 'Gives good feedback', 'Tough grader']",people,people
N/A,good,average,good,0,23693334,1,online,awesome,5,NFS489,I was really impressed by the passion he shows towards what he does and how available he is for his students.,10/25/2014,3.0,3.0,,4,Really into it,4.5,4.5,1,Yes,1414207228000,N/A,1484,Yes,,N/A,"['Respected', 'Caring', 'Gives good feedback']",person,people
Not Mandatory,good,average,good,0,22826496,0,,good,4,NFS489,"Great Professor who was enthusiastic about his research and enjoys teaching. He is very helpful and approachable. The final essay is difficult but if you follow the instructions and clarify everything, you will do well!",02/07/2014,2.0,2.0,,4,Really into it,4.0,4.0,1,No,1391790634000,N/A,1484,N/A,,A,[],people,people
Not Mandatory,good,average,average,0,22621724,0,,good,4,NFS489H1,"Nice prof, explains things well. Very interesting lecture material. HORRIBLE ESSAY  WORTH 55% OF TOTAL GRADE!!!& marked extremely hard- takes a lot of time and effort to do and many people do very bad!!!",12/19/2013,3.0,3.0,,3,Really into it,3.5,3.5,1,No,1387493374000,N/A,1484,N/A,,N/A,[],people,people
N/A,good,average,good,0,18311018,0,,good,4,NFS489,Easy Course. Easy grade,03/25/2011,2.0,2.0,,4,It's my life,4.0,4.0,1,No,1301015137000,N/A,12184,N/A,,N/A,[],people,people
