attendance,clarityColor,easyColor,helpColor,helpCount,id,notHelpCount,onlineClass,quality,rClarity,rClass,rComments,rDate,rEasy,rEasyString,rErrorMsg,rHelpful,rInterest,rOverall,rOverallString,rStatus,rTextBookUse,rTimestamp,rWouldTakeAgain,sId,takenForCredit,teacher,teacherGrade,teacherRatingTags,unUsefulGrouping,usefulGrouping
Mandatory,good,average,good,6,26990997,1,,good,4,MAT135H1F,"Amazing, easy to understand prof.",09/23/2016,3.0,3.0,,4,N/A,4.0,4.0,1,No,1474653824000,Yes,1484,Yes,,N/A,"['Hilarious', 'Respected', 'Inspirational']",person,people
Mandatory,good,average,good,11,26828474,0,,awesome,5,MAT237Y,"A great prof among all the MAT237 profs, the tests were not so hard since I took the course in the summer, but be aware that 237 is a hard course.",07/24/2016,3.0,3.0,,5,N/A,5.0,5.0,1,No,1469320211000,Yes,1484,Yes,,N/A,"['Participation matters', 'Amazing lectures', 'Get ready to read']",people,people
Not Mandatory,good,average,good,11,26808622,0,,awesome,5,MAT237Y1,"Just brilliant! Probably, the best in business.",07/15/2016,3.0,3.0,,5,N/A,5.0,5.0,1,Yes,1468598884000,Yes,1484,Yes,,A,"['Caring', 'Amazing lectures', 'Accessible outside class']",people,people
N/A,good,good,good,11,26772110,0,,awesome,5,MAT237,Best lecturer ever. Hands down. The course material I hated but he made it somewhat enjoyable!,06/30/2016,5.0,5.0,,5,N/A,5.0,5.0,1,No,1467304368000,Yes,1484,Yes,,N/A,"['Caring', ""Skip class? You won't pass."", 'Amazing lectures']",people,people
Not Mandatory,good,average,good,18,26661883,0,,awesome,5,MAT237,He is handsome,05/27/2016,3.0,3.0,,5,N/A,5.0,5.0,1,No,1464363386000,Yes,1484,Yes,,A,"['Caring', 'Respected', 'Gives good feedback']",people,people
Not Mandatory,good,good,good,13,26618738,0,,awesome,5,MAT237Y,Best and hottest prof I can ever ask for. Tyler is a very knowlegeable and helpful instructor. He is willing to answer questions that are beyond syllabus; he also answers stupid questions (eg. difference between x and x )patiently. His lectures are never boring. I'm considering doing a math major because of this course.,05/19/2016,4.0,4.0,,5,N/A,5.0,5.0,1,No,1463678299000,N/A,1484,Yes,,A,[],people,people
Not Mandatory,good,good,good,10,26580822,0,,awesome,4,MAT237Y,"this is the best (not even one of the best) instructor that i have ever seen in U of T. I would say his easy-understandable lecture notes and fast responding at Piazza is the biggest reason that I passed this course and got a final mark of 77, especially I am not really good at doing math and this is a ""famous"" course due to its hardness.",05/15/2016,4.0,4.0,,5,N/A,4.5,4.5,1,No,1463333423000,N/A,1484,Yes,,B+,"['Gives good feedback', 'Tough grader', 'Respected']",people,people
Not Mandatory,good,good,good,9,26496629,0,,awesome,5,MAT237,Great!,05/07/2016,4.0,4.0,,5,N/A,5.0,5.0,1,Yes,1462592733000,N/A,1484,Yes,,A,[],people,people
Mandatory,good,average,good,12,26274547,1,,awesome,5,MAT237Y,"I have to say Tyler is one of the best instructor  i have ever had in UofT. MAT237 is a really tough course, but Tyler makes it easier. He has a fantastic notes posted online, and answered every PIAZZA's question quickly and clearly. Tests are highly related to his notes, once you understand the notes, it is easy to achieve 75+.",04/11/2016,3.0,3.0,,5,N/A,5.0,5.0,1,No,1460411227000,N/A,1484,Yes,,A-,"['Amazing lectures', 'Respected']",person,people
Mandatory,good,good,good,14,26188033,1,,awesome,5,MAT237,He is the only teacher to run the piazza! Definetly goes above and beyond.,03/27/2016,4.0,4.0,,5,N/A,5.0,5.0,1,No,1459081397000,N/A,1484,Yes,,N/A,"['Amazing lectures', 'Inspirational']",person,people
N/A,good,average,good,18,26156451,1,,awesome,5,MAT237Y,"If there were a poem about multivariate calculus, it would be a recording of his lectures. Also, he provides notes online which are fantastic",03/18/2016,3.0,3.0,,5,Sorta interested,5.0,5.0,1,No,1458262413000,N/A,1484,Yes,,B+,[],person,people
N/A,good,average,good,10,26125133,2,,awesome,5,MAT237Y,"Very good professor, aids in conceptual understanding.",03/08/2016,3.0,3.0,,5,It's my life,5.0,5.0,1,No,1457470353000,N/A,1484,Yes,,N/A,"['Inspirational', 'Caring', 'Amazing lectures']",people,people
Not Mandatory,good,average,good,11,26115686,0,,awesome,5,MAT237Y,so good,03/05/2016,3.0,3.0,,5,It's my life,5.0,5.0,1,No,1457196474000,N/A,1484,Yes,,N/A,"['Respected', 'Hilarious', 'Inspirational']",people,people
N/A,good,average,good,8,26044301,2,,awesome,5,MAT237Y,great!!!,02/10/2016,3.0,3.0,,5,Sorta interested,5.0,5.0,1,No,1455093042000,N/A,1484,Yes,,N/A,"['Amazing lectures', 'Hilarious']",people,people
N/A,average,good,average,4,26024808,13,,average,3,MAT237,"Took this during the summer, he know his stuff very well, but he throw too many hard questions and the average on the final was a fail and he never curved the exam. Do not take this course with him",02/03/2016,4.0,4.0,,3,Low,3.0,3.0,1,No,1454514726000,N/A,1484,Yes,,N/A,[],people,people
Mandatory,good,average,good,6,25949161,3,,awesome,5,MAT237,its a hard class but he makes it soo much easier!!,01/15/2016,3.0,3.0,,5,Low,5.0,5.0,1,No,1452893810000,N/A,1484,Yes,,B,"['Caring', 'Gives good feedback', 'Amazing lectures']",people,people
Mandatory,good,good,good,10,25563733,0,,awesome,5,MAT237,Lucky enough to have him for both 137 and 237! Just amazing. I hope hes around next year when I take 337. ,12/06/2015,4.0,4.0,,5,Really into it,5.0,5.0,1,No,1449420723000,Yes,1484,Yes,,B+,"['Inspirational', 'Amazing lectures']",people,people
Mandatory,good,poor,good,14,25493685,0,,awesome,5,MAT237,Tyler's great. I liked that he focused on conceptual understanding rather than the memorization of concepts. ,11/27/2015,1.0,1.0,,5,Sorta interested,5.0,5.0,1,No,1448630902000,N/A,1484,Yes,,B,"['Caring', 'Hilarious', 'Amazing lectures']",people,people
Mandatory,good,poor,good,10,25477127,0,,awesome,5,MAT237,Very well organized and the instructor did a good job of explaining things.,11/23/2015,1.0,1.0,,5,Sorta interested,5.0,5.0,1,No,1448302055000,N/A,1484,Yes,,B+,"['Amazing lectures', 'Hilarious', 'Respected']",people,people
N/A,average,good,average,7,25165180,16,,average,3,MAT237,"He teaches very well and everything seems to be clear. BUT.. He refuses to tell us the averages of anything, and no solutions are provide to the problems. He promises to give us at least 50% if we do all the 1,2 star but he decided to throw a three star question just to screw us over and his final was somewhat hard...",09/01/2015,4.0,4.0,,3,Sorta interested,3.0,3.0,1,No,1441124176000,N/A,1484,Yes,,N/A,"['Amazing lectures', 'Tough grader']",people,people
N/A,good,average,good,16,25156187,8,,awesome,5,MAT237,Tyler is great. I can't describe how good his lectures are in words. ,08/27/2015,3.0,3.0,,5,It's my life,5.0,5.0,1,No,1440708816000,N/A,1484,Yes,,N/A,"['Amazing lectures', 'Inspirational', 'Caring']",people,people
N/A,good,poor,good,27,25149704,17,,awesome,5,MAT237Y,"The below rater is pretty misleading. Tyler is a great professor, one of the best professors I've had yet at U of T. I took the course in the summer, and he designed it in a way that is helpful to students. He gave office hours every day, and was always approachable. I was never bored in class. The final was not that difficult. ",08/25/2015,1.0,1.0,,5,It's my life,5.0,5.0,1,No,1440519328000,N/A,1484,Yes,,N/A,"['Respected', 'Caring', 'Inspirational']",people,people
N/A,average,good,average,14,25137029,35,,poor,2,MAT237,"Hie teaches this course pretty well and knows his material, however he doesn't to post solutions to any problems and his final was hard",08/20/2015,4.0,4.0,,2,Low,2.0,2.0,3,No,1440077948000,N/A,1484,Yes,,N/A,['Lecture heavy'],people,people
N/A,good,average,good,9,24611393,0,,awesome,5,MAT137Y,"Great lectures, would recommend",04/16/2015,2.0,2.0,,5,Really into it,5.0,5.0,1,Yes,1429207709000,N/A,1484,N/A,,A+,"['Amazing lectures', 'Inspirational']",people,people
N/A,good,average,good,19,23663991,0,,good,4,MAT137Y1,You know he's good when I'm willing to go to a 9 am class,10/16/2014,3.0,3.0,,4,Sorta interested,4.0,4.0,1,Yes,1413496368000,N/A,1484,N/A,,Not sure yet,"['Hilarious', 'Amazing lectures']",people,people
N/A,good,poor,good,7,23643230,0,,awesome,5,MAT,"Helpful, cares about students, charismatic. Enough said :)",10/09/2014,1.0,1.0,,5,It's my life,5.0,5.0,1,No,1412877003000,N/A,1484,Yes,,N/A,"['Caring', 'Hilarious', 'Inspirational']",people,people
N/A,good,average,good,8,23547114,0,,awesome,5,MAT237,"Tyler was an excellent professor, as he had clear passion for the material and for students. His tests were hard, but he created a great learning environment.",08/21/2014,3.0,3.0,,5,Really into it,5.0,5.0,1,No,1408634292000,N/A,1484,N/A,,N/A,[],people,people
N/A,good,average,good,5,23523465,0,,awesome,5,MAT237,great,08/12/2014,3.0,3.0,,5,Really into it,5.0,5.0,1,Yes,1407879339000,N/A,1484,N/A,,N/A,[],people,people
N/A,good,average,good,8,23465781,0,,awesome,5,MAT237,"This guy is awesome. He is very charismatic, and keeps you interested in the course. He actually makes you think in the exam and throughout the course. Very motivational and concise, enough said.",07/23/2014,3.0,3.0,,5,It's my life,5.0,5.0,1,Yes,1406111131000,N/A,1484,N/A,,N/A,[],people,people
Not Mandatory,good,average,good,6,23458370,0,,awesome,5,MAT135H1F,"Mr. Holden is a super nice guy. His lectures are easy to follow and he made the materials clear. His tests are my biggest complaints! The tests are hard, the mid term avg was 44%, fortunately the final exam was fair.",07/20/2014,3.0,3.0,,5,It's my life,5.0,5.0,1,Yes,1405861279000,N/A,1484,N/A,,N/A,[],people,people
Not Mandatory,good,average,good,5,22994083,0,,awesome,5,MAT135H1S,His class is pretty easy to follow but exam questions are DIFFICULT!,04/05/2014,2.0,2.0,,5,Really into it,5.0,5.0,1,Yes,1396718442000,N/A,1484,N/A,,N/A,[],people,people
Not Mandatory,good,poor,good,6,22952714,0,,awesome,5,MAT135H1S,Super nice guy. Had stopped eating lunch and came for office hour!,03/26/2014,1.0,1.0,,5,It's my life,5.0,5.0,1,Yes,1395867672000,N/A,1484,N/A,,A+,[],people,people
Not Mandatory,good,poor,good,6,22828491,0,,awesome,5,MAT135H1,He's wonderfully charismatic and engaging. I don't fall asleep in his class.,02/08/2014,1.0,1.0,,5,Low,5.0,5.0,1,No,1391896467000,N/A,1484,N/A,,N/A,[],people,people
