attendance,clarityColor,easyColor,helpColor,helpCount,id,notHelpCount,onlineClass,quality,rClarity,rClass,rComments,rDate,rEasy,rEasyString,rErrorMsg,rHelpful,rInterest,rOverall,rOverallString,rStatus,rTextBookUse,rTimestamp,rWouldTakeAgain,sId,takenForCredit,teacher,teacherGrade,teacherRatingTags,unUsefulGrouping,usefulGrouping
Not Mandatory,good,average,good,0,31446338,0,,awesome,5,ENG237,"Super great professor, participation and lecture attendance aren't mandatory, but it's worth it to go. If you're the type to skim the required readings, she does a good job at pulling out key quotes and discussing them. She mixes short-stories and full length novels which makes it easy to keep up. Really flexible on deadlines and extensions.",03/18/2019,3.0,3.0,,5,N/A,5.0,5.0,1,Yes,1552876103000,Yes,1484,Yes,,N/A,"['Accessible outside class', 'Amazing lectures', 'Get ready to read']",people,people
Not Mandatory,good,average,good,0,26939419,0,,good,4,ENG324,"Very nice prof and easy to approach. She's always willing to help out her students. Her lectures can be boring since they're mostly built around quotes & discussing it in groups. But the reading selection was phenomenal! I fell in love with so many new authors! If you enjoy Victorian lit, then you won't regret having her as a prof.",08/29/2016,3.0,3.0,,4,N/A,4.0,4.0,1,Yes,1472462507000,Yes,1484,Yes,,N/A,"['Caring', 'Gives good feedback']",people,people
Not Mandatory,average,average,average,0,26186458,0,,average,3,ENG324,"Her lectures are clear and easy to understand. She's always willing to provide help if you need it, which is great. The only drawbacks I find from her courses is that the lectures are mostly revolved around discussing quotes. This can become rather tedious, especially when there's over 8 quotes for 1 lecture.",03/26/2016,3.0,3.0,,3,N/A,3.0,3.0,1,Yes,1459007396000,N/A,1484,Yes,,N/A,"['Caring', 'Gives good feedback', 'Clear grading criteria']",people,people
Not Mandatory,good,good,good,0,26177262,0,,awesome,5,ENG324,"She's fantastic, one of the best professors I have had in my undergraduate degree. Lectures are clear, fun, and discussion based. This is a must take class for any English Undergrad student.",03/23/2016,4.0,4.0,,5,N/A,5.0,5.0,1,Yes,1458774939000,N/A,1484,Yes,,A,"['Amazing lectures', 'Inspirational', 'Participation matters']",people,people
Not Mandatory,good,average,good,0,25495582,0,,good,4,ENG324,She is extremely kind and aware that students have certain stresses at school. Her lectures are helpful and she's truly interested in things you have to say. Her grading is fair and she gives constructive comments. The books she assigns are also very interesting and you can tell that she's passionate about Victorian literature. She's also funny!,11/28/2015,3.0,3.0,,4,Really into it,4.0,4.0,1,Yes,1448713808000,N/A,1484,Yes,,N/A,"['Hilarious', 'Gives good feedback', 'Caring']",people,people
