attendance,clarityColor,easyColor,helpColor,helpCount,id,notHelpCount,onlineClass,quality,rClarity,rClass,rComments,rDate,rEasy,rEasyString,rErrorMsg,rHelpful,rInterest,rOverall,rOverallString,rStatus,rTextBookUse,rTimestamp,rWouldTakeAgain,sId,takenForCredit,teacher,teacherGrade,teacherRatingTags,unUsefulGrouping,usefulGrouping
Not Mandatory,poor,good,poor,0,32428087,0,,awful,1,TRN410,"Such a horrible lecturer. If you already have an understanding of course material before coming in, you should be good. If you don't, you will not learn anything. His lectures are SO boring, and if you ask him a question in office hours, he goes on a 5 minute tangent not related to your question. He's nice though. Had him for 250 and 410",11/17/2019,4.0,4.0,,1,N/A,1.0,1.0,1,Yes,1574021050000,No,1484,Yes,,B-,['Get ready to read'],people,people
Mandatory,good,average,good,0,31211598,0,,good,4,TRN410,"His lectures are pretty typical for an IR class, but you can tell he clearly finds the topics fascinating, which is nice, and he is always available to give help. i've had him as a teacher/ta twice, for trn250 and trn410, and John is truly a gem. One of the kindest, knowledgeable professors i've come across. Would recommend his class.",01/07/2019,3.0,3.0,,4,N/A,4.0,4.0,1,Yes,1546825635000,Yes,1484,Yes,,A-,"['Gives good feedback', 'Respected', 'Lecture heavy']",people,people
Not Mandatory,poor,average,poor,0,30700268,0,,awful,1,TRN250,"The worst professor that barely teaches anything. He definitely has some good aspects for sure (like being available via email and office hours). However, his lectures are SO BORING AND UNENGAGING. If you're already good, then you'll be fine in his class as his grading isn't that tough. However, if you're not yet and are trying to learn, then no.",11/11/2018,3.0,3.0,,1,N/A,1.0,1.0,1,Yes,1541943054000,No,1484,Yes,,N/A,"['Get ready to read', 'Accessible outside class']",people,people
Mandatory,good,good,good,0,30283547,0,,awesome,5,TRN250,"john is a wonderful ta and professor. if you pay attention, and do the work, you will do fine, and he always makes himself available to help.",06/21/2018,4.0,4.0,,5,N/A,5.0,5.0,1,Yes,1529543889000,Yes,1484,Yes,,N/A,[],people,people
Mandatory,good,good,good,1,29985987,0,,awesome,5,TRN250Y1,"Dirks is a wonderful prof. He used to be a TA for TRN250, and he's now doing a great job w/ the course. His voice is painfully monotone, and you may fall asleep. But he makes extra effort to be available to students in office hours, and responds promptly to e-mails. Plus, the grading in his courses isn't too tough compared to other IR classes.",05/04/2018,4.0,4.0,,5,N/A,5.0,5.0,1,Yes,1525436117000,Yes,1484,Yes,,A,"['Lecture heavy', 'Accessible outside class', 'Get ready to read']",people,person
