attendance,clarityColor,easyColor,helpColor,helpCount,id,notHelpCount,onlineClass,quality,rClarity,rClass,rComments,rDate,rEasy,rEasyString,rErrorMsg,rHelpful,rInterest,rOverall,rOverallString,rStatus,rTextBookUse,rTimestamp,rWouldTakeAgain,sId,takenForCredit,teacher,teacherGrade,teacherRatingTags,unUsefulGrouping,usefulGrouping
Mandatory,good,average,good,0,32867037,0,,awesome,5,ECO101,SHE'S AMAZING AT TEACHING! GIVES CLEAR NOTES THAT HELP UNDERSTAND THE MATERIAL!,01/25/2020,3.0,3.0,,5,N/A,5.0,5.0,1,Yes,1579952477000,Yes,1484,Yes,,C,"['Gives good feedback', 'Amazing lectures', 'Participation matters']",people,people
Mandatory,poor,poor,poor,0,32688629,0,,awful,1,ECON101,Not very good at teaching,12/17/2019,1.0,1.0,,1,N/A,1.0,1.0,1,Yes,1576564442000,No,1484,Yes,,N/A,[],people,people
Mandatory,poor,good,poor,0,32676586,0,,awful,1,ECO101,"Bad lecture, difficult for year 1 students to understand the knowledge from the slide, but she is a good prof.",12/16/2019,5.0,5.0,,1,N/A,1.0,1.0,1,Yes,1576515142000,No,1484,Yes,,Not sure yet,[],people,people
Mandatory,poor,good,poor,0,32572697,0,,awful,1,ECO101,Prof. Freitas is a good person but she is not a good lecturer. Her lectures are unorganized and she cannot grasp the key points. We have in class quizzes which counts towards final grade and sometimes she didn't make the in-class questions explicit. I wouldn't suggest you take her course.,12/09/2019,4.0,4.0,,1,N/A,1.0,1.0,1,Yes,1575872134000,No,1484,No,,B,"['Lots of homework', 'Get ready to read', 'Participation matters']",people,people
Not Mandatory,average,good,average,1,29428785,2,,poor,2,ECO324,Very unorganized and hard to read lecture slides. Was not clear about what she expected from the class. Would always talk about a 'framework' to be used to guide our answers in mid term and final writing but we were never clear of what the actual framework was. Had to ask her to clear a lot of things up otherwise I was lost.,01/10/2018,4.0,4.0,,2,N/A,2.0,2.0,1,No,1515591076000,No,1484,Yes,,A-,"[""Skip class? You won't pass.""]",people,person
