attendance,clarityColor,easyColor,helpColor,helpCount,id,notHelpCount,onlineClass,quality,rClarity,rClass,rComments,rDate,rEasy,rEasyString,rErrorMsg,rHelpful,rInterest,rOverall,rOverallString,rStatus,rTextBookUse,rTimestamp,rWouldTakeAgain,sId,takenForCredit,teacher,teacherGrade,teacherRatingTags,unUsefulGrouping,usefulGrouping
Not Mandatory,poor,good,poor,3,27298151,0,,awful,1,ENG554,"Took reactor physics at CCNY. Horrible, just horrible. Gives extremely long pointless theory lectures with an extensive load of formulas with not a single example on how to apply or use them. Also, there are no problems in the book, so there is basically no practice at all. Gives good partial credit on exams, but still the average is 40/100. Avoid.",12/01/2016,5.0,5.0,,1,N/A,1.0,1.0,1,No,1480593595000,No,1484,Yes,,D+,"['Test heavy', 'Lecture heavy', 'Get ready to read']",people,people
N/A,good,good,good,1,13020193,1,,good,4,CHE01,It would be a shame if he didn't get the Faculty Teaching Award.,04/16/2007,5.0,5.0,,4,Really into it,4.0,4.0,1,Yes,1176763656000,N/A,1484,N/A,,N/A,[],person,person
N/A,good,average,good,0,12088097,1,,awesome,5,CHE212468,Excellent lecturer. Very complete notes. Great at answering questions and giving fair marks. Always bells. Great prof overall!,07/18/2006,3.0,3.0,,5,Really into it,5.0,5.0,1,N/A,1153261607000,N/A,1484,N/A,,N/A,[],person,people
N/A,good,poor,good,1,3233241,0,,awesome,5,CHE212,BEST PROF EVER,01/17/2005,1.0,1.0,,5,It's my life,5.0,5.0,1,N/A,1105969864000,N/A,1484,N/A,,N/A,[],people,person
N/A,poor,good,poor,0,1459389,0,,poor,1,CHE468,"pretty boring prof., answers questions though. course was harrddddd. if you have to pick an elective, don't pick this one!",12/08/2003,4.0,4.0,,2,N/A,1.5,1.5,1,N/A,1070893922000,N/A,1484,N/A,,N/A,[],people,people
N/A,good,average,good,0,666871,0,,awesome,5,CHE212,"Good lecture notes and clear instructions.. Nice Prof. but slightly boring, plz dont just writing stuffs on the board, make some jokes...",03/03/2003,3.0,3.0,,5,N/A,5.0,5.0,1,N/A,1046726642000,N/A,1484,N/A,,N/A,[],people,people
