attendance,clarityColor,easyColor,helpColor,helpCount,id,notHelpCount,onlineClass,quality,rClarity,rClass,rComments,rDate,rEasy,rEasyString,rErrorMsg,rHelpful,rInterest,rOverall,rOverallString,rStatus,rTextBookUse,rTimestamp,rWouldTakeAgain,sId,takenForCredit,teacher,teacherGrade,teacherRatingTags,unUsefulGrouping,usefulGrouping
N/A,good,good,good,0,16722076,0,,good,4,HISNEW,GREAT PROF!!! BEST CLASSES I HAVE TAKEN AT UOFT(NEW351 AND HIS295). HELPFUL AND VERY KNOWLEDGEABLE,01/13/2010,5.0,5.0,,4,It's my life,4.0,4.0,1,Yes,1263393321000,N/A,1484,N/A,,N/A,[],people,people
N/A,good,average,good,0,14812450,0,,awesome,4,HIST295,"A class with Soske is definately not a bird course, but he is quick to learn student's names, notices when they put in real effort,  is always respectful of questions and accomodates good discussions or relevant sidetracks with his flexible lecture schedule. If you don't want to have your intellectual world shaken, don't take this course.",09/12/2008,3.0,3.0,,5,Really into it,4.5,4.5,1,Yes,1221206302000,N/A,1484,N/A,,N/A,[],people,people
N/A,good,average,good,0,14811949,0,,awesome,4,HIS389,"Taking a class with Jon Soske is  probably one of the most enlightening experiences you'll have in your entire time at U of T. He's articulate, intelligent, and he challenges you to think outside your anglo-american box, which for U of T is highly refreshing. The courses he teaches can be difficult, but extremely rewarding if you   let them be.",09/11/2008,3.0,3.0,,5,Really into it,4.5,4.5,1,Yes,1221173411000,N/A,1484,N/A,,N/A,[],people,people
N/A,good,average,good,0,14811502,0,,awesome,5,HIS295,Soske's class is no walk through the park..but it is easily one the most beneficial classes offered at UofT. He's very knowledgeable and a great public speaker. The assigned readings really reflect how well he understands his field of study. The material is challenging but Soske goes out of his way to ensure that students understand the theory,09/11/2008,3.0,3.0,,4,Sorta interested,4.5,4.5,1,Yes,1221161175000,N/A,1484,N/A,,N/A,[],people,people
N/A,good,good,good,0,14811085,0,,awesome,5,HIS295,Jon Soske was a great professor who gave very insightful lectures. He was also available twice a week during his office hours to explain our readings and help us with our assignments. I attended almost all of the lectures for His 295 and I was overall throughly impressed with the professor's overall knowledge of Africa's history and people.,09/11/2008,4.0,4.0,,5,Really into it,5.0,5.0,1,Yes,1221149429000,N/A,1484,N/A,,N/A,[],people,people
N/A,average,good,average,0,14503411,0,,average,2,HIS296Y,Jon has &quot;Nerd&quot; written all over him. Very knowledgeable and lives like an intellectual.,05/21/2008,5.0,5.0,,3,Sorta interested,2.5,2.5,1,No,1211344749000,N/A,1484,N/A,,N/A,[],people,people
