attendance,clarityColor,easyColor,helpColor,helpCount,id,notHelpCount,onlineClass,quality,rClarity,rClass,rComments,rDate,rEasy,rEasyString,rErrorMsg,rHelpful,rInterest,rOverall,rOverallString,rStatus,rTextBookUse,rTimestamp,rWouldTakeAgain,sId,takenForCredit,teacher,teacherGrade,teacherRatingTags,unUsefulGrouping,usefulGrouping
Mandatory,good,average,good,6,25063299,0,,awesome,5,MAT136,This Prof worked with me personally making me feel like less of a number and more like a human student. Without his support I would not have passed this course. He is incredibly nice and caring.,07/24/2015,3.0,3.0,,5,Really into it,5.0,5.0,1,Yes,1437699701000,N/A,1484,Yes,,N/A,"['Caring', 'Hilarious', 'Gives good feedback']",people,people
Mandatory,good,average,good,4,25021220,0,,awesome,5,MAT136,"Passionate about his field, extremely friendly. He really wants the best for his students and makes math that much less intimidating. Being a life sci student, he enable me to really enjoy math for what it is and his enthusiasm is contagious.",07/07/2015,2.0,2.0,,5,Sorta interested,5.0,5.0,1,Yes,1436234881000,N/A,1484,Yes,,A,"['Amazing lectures', 'Respected', 'Gives good feedback']",people,people
Mandatory,good,average,good,4,24953269,0,,good,4,MAT136,Great guy. Makes some lame but funny jokes during class which keep it kind of interesting. ,06/10/2015,3.0,3.0,,4,Low,4.0,4.0,1,Yes,1433931586000,N/A,1484,Yes,,N/A,"['Tough grader', ""Skip class? You won't pass.""]",people,people
Mandatory,good,poor,good,11,23621018,0,,awesome,5,136,Amazing prof. he managed to make a 3hr calculus class enjoyable. You could really tell he put a lot of preparation into his lectures. ,09/30/2014,1.0,1.0,,5,Sorta interested,5.0,5.0,1,Yes,1412109113000,Yes,1484,Yes,,N/A,['Amazing lectures'],people,people
Not Mandatory,average,average,average,3,23458363,14,,average,2,MAT136,"Mr. Eagle is a nice guy, however, his hand writing and notes is so unorganized. I'd say that as long as u do the problems in the textbook you'll be fine.",07/20/2014,3.0,3.0,,3,Really into it,2.5,2.5,1,Yes,1405861124000,N/A,1484,N/A,,N/A,[],people,people
