attendance,clarityColor,easyColor,helpColor,helpCount,id,notHelpCount,onlineClass,quality,rClarity,rClass,rComments,rDate,rEasy,rEasyString,rErrorMsg,rHelpful,rInterest,rOverall,rOverallString,rStatus,rTextBookUse,rTimestamp,rWouldTakeAgain,sId,takenForCredit,teacher,teacherGrade,teacherRatingTags,unUsefulGrouping,usefulGrouping
N/A,good,average,good,0,24222517,0,,good,4,CHE324,"He's a great prof, he tries to get you to think like a true engineer. If you put in effort and show up to class you will enjoy his classes and learn a lot.",01/03/2015,3.0,3.0,,4,Really into it,4.0,4.0,1,No,1420320148000,N/A,1484,Yes,,N/A,"['Hilarious', 'Respected', 'Inspirational']",people,people
Not Mandatory,good,average,good,0,22753993,0,,awesome,5,CHE113,"Brilliant prof, he tries to connect higher level concepts so it's important to have a base understanding. Really helpful in office hours.",01/14/2014,3.0,3.0,,5,Really into it,5.0,5.0,1,No,1389742877000,N/A,1484,N/A,,A,[],people,people
N/A,poor,good,poor,1,22191226,5,,awful,1,CHE451,"Not helpful at all. Not wise, not helpful, arrogant.",10/18/2013,5.0,5.0,,1,Meh,1.0,1.0,1,No,1382105131000,N/A,1484,N/A,,N/A,[],people,person
N/A,average,good,poor,1,17662703,2,,poor,2,CHE324,He is arrogant and condescending. Materials are delivered fine but not a easy person to deal with.,10/16/2010,4.0,4.0,,1,Low,1.5,1.5,1,No,1287250427000,N/A,1484,N/A,,N/A,[],people,person
N/A,good,good,good,0,13020221,1,,awesome,4,CHE01,A true engineer!,04/16/2007,4.0,4.0,,5,It's my life,4.5,4.5,1,No,1176763919000,N/A,1484,N/A,,N/A,[],person,people
N/A,good,poor,good,0,12280645,1,,awesome,5,CHE324,"cool prof, he will pick on u at least once on the list, if u try to answer a question, u will get a good grade",10/12/2006,1.0,1.0,,5,It's my life,5.0,5.0,1,Yes,1160653251000,N/A,1484,N/A,,N/A,[],person,people
N/A,good,poor,good,0,2502747,0,,awesome,5,CHE332,No Comments,09/28/2004,1.0,1.0,,5,It's my life,5.0,5.0,3,N/A,1096409264000,N/A,1484,N/A,,N/A,[],people,people
