attendance,clarityColor,easyColor,helpColor,helpCount,id,notHelpCount,onlineClass,quality,rClarity,rClass,rComments,rDate,rEasy,rEasyString,rErrorMsg,rHelpful,rInterest,rOverall,rOverallString,rStatus,rTextBookUse,rTimestamp,rWouldTakeAgain,sId,takenForCredit,teacher,teacherGrade,teacherRatingTags,unUsefulGrouping,usefulGrouping
Mandatory,average,average,average,2,30355328,0,,poor,2,MAT332,He's okay. Tests involve lots of memorization.,07/18/2018,2.0,2.0,,2,N/A,2.0,2.0,1,Yes,1531942516000,No,1484,Yes,,A-,[],people,people
Not Mandatory,good,average,good,1,30283475,3,,awesome,5,MAT332,"It was a very interesting course by a nice prof! Clear lectures, help at office hours, interesting stuff, and an easy pass if you study.",06/21/2018,3.0,3.0,,5,N/A,5.0,5.0,1,No,1529541909000,Yes,1484,Yes,,N/A,[],people,person
Mandatory,average,average,average,1,29484784,1,,average,3,MAT332,Nice guy.,01/21/2018,3.0,3.0,,3,N/A,3.0,3.0,1,Yes,1516569837000,No,1484,Yes,,A-,"['Caring', 'Beware of pop quizzes']",person,person
Not Mandatory,good,average,good,1,29074058,1,,awesome,5,MAT332,"Really good professor! always kind, caring, and patient to the questions.",12/06/2017,2.0,2.0,,5,N/A,5.0,5.0,1,Yes,1512602547000,Yes,1484,Yes,,N/A,"['Inspirational', 'Caring']",person,person
Not Mandatory,good,average,good,4,24516039,2,,awesome,4,MAT332,"Interesting lectures, always helpful at his office, can explain things again if you need it. Cheerful and never tough on you! Very nice prof!",03/29/2015,3.0,3.0,,5,Really into it,4.5,4.5,1,No,1427636947000,N/A,1484,Yes,,A+,"['Caring', 'Inspirational']",people,people
N/A,good,average,good,3,24278323,1,,awesome,5,MAT332,Interesting material and engaging lectures,01/13/2015,3.0,3.0,,5,Really into it,5.0,5.0,1,Yes,1421118360000,N/A,1484,Yes,,N/A,[],person,people
N/A,good,average,good,3,24229100,0,,awesome,5,MAT332,good guy,01/05/2015,2.0,2.0,,5,Really into it,5.0,5.0,1,Yes,1420450284000,N/A,1484,Yes,,N/A,[],people,people
N/A,good,poor,good,4,21404186,1,,awesome,5,MAT301,"Articulate, patient, knowledgable. Tests gave plenty of time, and had well chosen questions that tested understanding (rather than straight memorization). Not a fan of the textbook, however (Contemporary Abstract Algebra).",03/12/2013,1.0,1.0,,5,Really into it,5.0,5.0,1,No,1363078746000,N/A,1484,N/A,,N/A,[],person,people
N/A,good,average,good,3,21346450,1,,awesome,5,MAT223,He is an awesome professor. He is so patient with students' questions. He is knowledgable and explains concepts really well. Absolutely recommend him,02/16/2013,2.0,2.0,,5,Sorta interested,5.0,5.0,1,Yes,1361032756000,N/A,1484,N/A,,N/A,[],person,people
