attendance,clarityColor,easyColor,helpColor,helpCount,id,notHelpCount,onlineClass,quality,rClarity,rClass,rComments,rDate,rEasy,rEasyString,rErrorMsg,rHelpful,rInterest,rOverall,rOverallString,rStatus,rTextBookUse,rTimestamp,rWouldTakeAgain,sId,takenForCredit,teacher,teacherGrade,teacherRatingTags,unUsefulGrouping,usefulGrouping
N/A,good,average,good,0,22858592,0,,awesome,5,MAT134,He is one of the best profs on the UTM campus,02/21/2014,2.0,2.0,,5,It's my life,5.0,5.0,1,Yes,1393023534000,N/A,1484,N/A,,N/A,[],people,people
Not Mandatory,good,poor,good,0,22547824,0,,awesome,5,MAT290,"Extremely helpful, crystal clear explanation, and very approachable. Basically one of, if not the best instructor I've ever met in my first two years in university. That final exam though...",12/13/2013,1.0,1.0,,5,It's my life,5.0,5.0,1,No,1386975297000,N/A,1484,N/A,,N/A,[],people,people
N/A,good,poor,good,0,22428221,0,,awesome,5,MAT290,10/10 would professor again.,12/04/2013,1.0,1.0,,5,Sorta interested,5.0,5.0,1,No,1386117825000,N/A,1484,N/A,,N/A,[],people,people
Not Mandatory,good,poor,good,0,22125555,0,,awesome,5,MAT137,One of the best profs I've ever had! Answers your questions in class and makes sure everyone's on the same page before moving on. He's animated and engaging and uses simple language to reword theorems to help you understand. If only he was teaching my other math courses too...,09/17/2013,1.0,1.0,,5,It's my life,5.0,5.0,1,Yes,1379415036000,N/A,1484,N/A,,N/A,[],people,people
N/A,good,average,good,0,21967918,0,,awesome,5,MAT137,"Great personality! Best Math professor I've ever had. Explained concepts really well. Always make sure everyone understands it. He is a singer and improviser,too!",07/14/2013,2.0,2.0,,5,It's my life,5.0,5.0,1,Yes,1373825161000,N/A,1484,N/A,,N/A,[],people,people
N/A,good,average,good,0,21834812,0,,awesome,5,MAT137,Amazing prof! Could explain concepts so clearly. Always ensured all of his students understood the material. Best math teacher I've ever had!,05/28/2013,2.0,2.0,,5,Really into it,5.0,5.0,1,Yes,1369738486000,N/A,1484,N/A,,N/A,[],people,people
