attendance,clarityColor,easyColor,helpColor,helpCount,id,notHelpCount,onlineClass,quality,rClarity,rClass,rComments,rDate,rEasy,rEasyString,rErrorMsg,rHelpful,rInterest,rOverall,rOverallString,rStatus,rTextBookUse,rTimestamp,rWouldTakeAgain,sId,takenForCredit,teacher,teacherGrade,teacherRatingTags,unUsefulGrouping,usefulGrouping
Not Mandatory,good,average,good,2,24722668,1,,awesome,5,SOC313,"Professor Caron is an exceptional professor. As the previous comments have mentioned, he truly does care about the academic success of his students. His passion for the course content and for teaching shines through during lecture which keeps you engaged. Amazing professor, a gem to UofT's faculty, staff, and department of sociology.",05/02/2015,2.0,2.0,,5,It's my life,5.0,5.0,1,Yes,1430587563000,Yes,1484,Yes,,A,"['Get ready to read', 'Inspirational']",person,people
N/A,good,poor,good,1,24701540,0,,awesome,5,313,Absolutely amazing professor and individual. One of the very rare professors at the university who actually cares about you. ,04/29/2015,1.0,1.0,,5,Really into it,5.0,5.0,1,Yes,1430345151000,N/A,1484,Yes,,N/A,"['Caring', 'Inspirational', 'Amazing lectures']",people,person
Not Mandatory,good,average,good,2,24567670,0,,awesome,5,SOC212,"Gives you the chance to choose what 40% of your mark will be based off of - reflections, online posts, long essay, or in-class participation. You can choose any combination. The other 60% comes from a midterm and the final. ",04/09/2015,2.0,2.0,,4,Really into it,4.5,4.5,1,Yes,1428573485000,Yes,1484,Yes,,Not sure yet,"['Amazing lectures', 'Clear grading criteria']",people,people
N/A,good,average,good,0,24532707,0,,awesome,5,SOC101,Professor Caron is the best when it comes to teaching. He is crystal- clear with his explanations and his lectures are always very well- organised. Also he tries extremely hard to help students and to be relatable too. He is so sweet !,04/01/2015,3.0,3.0,,5,Really into it,5.0,5.0,1,Yes,1427909041000,N/A,1484,Yes,,A+,"['Caring', 'Inspirational', 'Get ready to read']",people,people
Not Mandatory,good,average,good,0,24517098,0,,awesome,4,SOC101Y,Always there for you when you're unsure about the content. Extremely approachable and gives clear explanations.,03/29/2015,2.0,2.0,,5,Really into it,4.5,4.5,1,Yes,1427658650000,Yes,1484,Yes,,A+,"['Gives good feedback', 'Caring']",people,people
Mandatory,good,good,good,0,24512297,0,,awesome,5,SOC101Y1,He is the nicest and most hardworking professor I have ever met. ,03/27/2015,4.0,4.0,,5,Really into it,5.0,5.0,1,Yes,1427490357000,N/A,1484,N/A,,A-,"['Caring', 'Respected', 'Inspirational']",people,people
Not Mandatory,good,average,good,0,24488924,0,,awesome,5,SOC101,"Prof Caron is easily one of the best profs I've had this year. He really and truly cares for his students, and goes out of his way to help. He is very clear, very easy to listen to, and he makes lectures interesting. I would definitely not hesitate to take a class with him again! If you have a chance, go for it!!",03/23/2015,3.0,3.0,,5,Really into it,5.0,5.0,1,Yes,1427107595000,N/A,1484,Yes,,Not sure yet,"['Caring', 'Amazing lectures', 'Respected']",people,people
N/A,good,good,good,0,24279146,0,,awesome,5,SOC212,"Very interesting teacher, and it is a very interactive class. that said it is not an easy A and this class is a lot of work but it is very rewarding. One of the best professors I've ever had. He treats his students like peers or coworkers a quality that is hard to come by at U of T. ",01/13/2015,5.0,5.0,,5,It's my life,5.0,5.0,1,Yes,1421148037000,N/A,1484,Yes,,N/A,"['Inspirational', 'Lots of homework', 'Participation matters']",people,people
N/A,good,average,good,3,24256690,0,,awesome,5,SOC313,"He's fantastic, he's one of the few profs at U of T who really cares about teaching and invests a lot of extra time with students. As cheesy as it sounds, learning with him is actually an experience rather than just a chore. ",01/08/2015,2.0,2.0,,5,It's my life,5.0,5.0,1,Yes,1420751591000,Yes,1484,Yes,,A-,"['Participation matters', 'Inspirational']",people,people
Mandatory,good,average,good,3,23863280,0,,awesome,5,SOC101,"Professor Caron has got to be the most kind man out there. He is extremely clear in his lectures, and very straight forward. He is very understanding and helpful. He is also very organized and definitely in the best interest of his students. He puts up several online mini lectures to help you further understand a topic. Best of the best .",11/20/2014,2.0,2.0,,5,It's my life,5.0,5.0,1,Yes,1416500290000,N/A,1484,Yes,,Not sure yet,"['Respected', 'Caring', 'Amazing lectures']",people,people
Mandatory,good,poor,good,0,23625724,0,,awesome,5,SOC101,Lectures are pretty organized and have great relevance with the textbook. tests are fairly easy if you did the readings and grading on term papers is also fair. so basically if you put some effort you should be good. the prof is definitely approachable and helpful.,10/02/2014,1.0,1.0,,5,It's my life,5.0,5.0,1,Yes,1412263155000,Yes,1484,Yes,,A+,['Participation matters'],people,people
Mandatory,good,average,good,1,23620359,0,,awesome,5,SOC101,"Extremely nice guy. Will go out of his way to help you in any way he can. Answers all emails really fast and posts frequent reminders to students. Managed to create somewhat of a classroom environment in a 1500 student lecture hall, which is a great achievement. If you go to his office hours, you'll find he's an extremely friendly and relatable guy",09/30/2014,3.0,3.0,,5,Really into it,5.0,5.0,1,Yes,1412093708000,N/A,1484,Yes,,A+,"['Caring', 'Gives good feedback', 'Participation matters']",people,person
N/A,good,average,good,1,23530914,0,,awesome,4,SOC212,"Amazing professor!! If you are efficient with your time and use your resources wisely you can do extremely well, plus he is willing to cater to your needs as a student. I very much enjoyed this class with him.",08/15/2014,2.0,2.0,,5,It's my life,4.5,4.5,1,Yes,1408093564000,N/A,1484,N/A,,N/A,[],people,person
N/A,good,average,good,0,23471747,1,,awesome,5,SOC101Y1Y,"My favourite professor during my first year at uoft! He's willing to sacrifice his time (beyond office hours) to help you and his lectures, though the general nature of first year courses can be boring, are thorough and interactive. He's such a cutie!!",07/25/2014,2.0,2.0,,5,Sorta interested,5.0,5.0,1,Yes,1406257908000,N/A,1484,N/A,,N/A,[],person,people
N/A,good,poor,good,0,23383529,0,,awesome,5,SOC101,"The course itself is very dry and boring, but Caron attempts to make the material interesting. You NEED to attend class as there are in class participation marks. The tests are really easy, most of the questions are common sense.",06/18/2014,1.0,1.0,,5,Really into it,5.0,5.0,1,Yes,1403120665000,N/A,1484,N/A,,N/A,[],people,people
N/A,average,average,average,2,23350581,4,,average,3,SOC101,"A really boring course, and the prof doesn't make it any better. Actually I think there would be no lots of difference if the course was taught completely online",06/06/2014,2.0,2.0,,2,Sorta interested,2.5,2.5,1,Yes,1402054294000,N/A,1484,N/A,,N/A,[],people,people
N/A,good,average,good,0,23258565,0,,awesome,5,SOC313,"One of the best professors I've ever encountered, he's one of those that you'd want to take ever course he teaches, not specifically for the course but bc he's just someone you'd want to learn from. Doesn't show favouritism and is really welcoming of all questions and comments.",05/15/2014,2.0,2.0,,5,Really into it,5.0,5.0,1,Yes,1400179676000,N/A,1484,N/A,,B+,[],people,people
Not Mandatory,good,poor,good,1,23108304,0,,awesome,5,SOC101,"AMAZING PROF. Lectures are organized and clear, tests and expectations quite fair and straightforward. You'll do well if you put in effort. What distinguishes him is that he genuinely cares about students and responds to them individually. He doesn't seem fake, pretending to care about you or playing favorites, like some other profs I know. Superb!",04/27/2014,1.0,1.0,,5,Sorta interested,5.0,5.0,1,Yes,1398604928000,N/A,1484,N/A,,A+,[],people,person
Mandatory,average,poor,average,2,23076885,0,,good,3,SOC101,Very cool and helpful prof but horrible course. Too ideologically driven to be interesting. The right answer is what they tell you it is...,04/22/2014,1.0,1.0,,4,Meh,3.5,3.5,1,Yes,1398178878000,N/A,1484,N/A,,A-,[],people,people
Mandatory,good,average,good,2,23073147,0,,awesome,5,SOC212H,"One of the best profs at UofT! His ILP (Individual Learning Plan) system allows everyone to be graded on their strengths. I never talked to him personally, but he was quick to respond to questions through email or on the discussion board. He makes the class interesting as well. I recommend his classes!",04/21/2014,2.0,2.0,,5,Really into it,5.0,5.0,1,Yes,1398121925000,N/A,1484,N/A,,N/A,[],people,people
Mandatory,good,average,good,0,23070965,0,,awesome,5,SOC101Y1,"He was so helpful and so ready to help everyone, even if he had to go out of his way to do it! Definitely helped me survive first year!",04/21/2014,2.0,2.0,,5,Low,5.0,5.0,1,Yes,1398102066000,N/A,1484,N/A,,B-,[],people,people
Mandatory,good,average,good,0,23070063,1,,awesome,4,SOC101,Easy and nice prof,04/21/2014,2.0,2.0,,5,Low,4.5,4.5,1,Yes,1398094165000,N/A,1484,N/A,,B+,[],person,people
N/A,good,poor,good,1,23058393,1,,awesome,5,SOC101,"Super hot, amazing professor, the course wouldn't have been the same without him",04/18/2014,1.0,1.0,,5,It's my life,5.0,5.0,1,Yes,1397786313000,N/A,1484,N/A,,N/A,[],person,person
Mandatory,good,average,good,1,23048932,0,,awesome,5,SOC101,"Prof. Caron was definitely my favorite prof this year! I like his system of i-clicker participation points, easy way to get marks while forcing you to attend lecture and do the readings. He is a really nice guy and answers any questions.",04/16/2014,2.0,2.0,,5,Really into it,5.0,5.0,1,Yes,1397663449000,N/A,1484,N/A,,N/A,[],people,person
Not Mandatory,good,average,good,1,23045981,0,,awesome,5,SOC101,"he goes out of his way to help students he really cares and wants your success- many office hours, encourages& replies to ALL emails of a class of 1500, lectures are a bit boring he almost repeats what's in the textbook but he's still a great prof, very knowledgable (+ he's VERY good looking)",04/16/2014,2.0,2.0,,5,Low,5.0,5.0,1,Yes,1397616383000,N/A,1484,N/A,,A,[],people,person
Mandatory,good,average,good,0,23044718,0,,awesome,4,SOC101,great professor,04/15/2014,2.0,2.0,,5,Really into it,4.5,4.5,1,Yes,1397600613000,N/A,1484,N/A,,C+,[],people,people
Mandatory,good,average,good,0,23042067,0,,awesome,5,SOC101,"GREAT prof, super dedicated and very easy to communicate with via Twitter/Email. You can tell he is just such a genuinely nice guy who loves what he teaches!",04/15/2014,3.0,3.0,,5,Sorta interested,5.0,5.0,1,Yes,1397577340000,N/A,1484,N/A,,INC,[],people,people
N/A,good,poor,good,0,23041115,0,,awesome,5,SOC101Y,"Great Prof!! But if you do the textbook readings don't even bother coming to class, he talks about the exact same things.",04/15/2014,1.0,1.0,,5,Low,5.0,5.0,1,Yes,1397569965000,N/A,1484,N/A,,N/A,[],people,people
N/A,good,average,good,0,23040723,0,,awesome,4,SOC101,Great prof. His lectures are engaging and he's always available to help. His sweater vests >,04/15/2014,2.0,2.0,,5,Really into it,4.5,4.5,1,Yes,1397566409000,N/A,1484,N/A,,N/A,[],people,people
Mandatory,good,average,good,0,23040658,0,,awesome,5,SOC101Y1,Awesome prof! Makes class really interesting and does try his hardest to help his students with any questions or concerns. He's really understanding and does make an effort to connect with his students. I really hope everyone gets a chance to be his student!,04/15/2014,2.0,2.0,,5,Sorta interested,5.0,5.0,1,Yes,1397565854000,N/A,1484,N/A,,N/A,[],people,people
N/A,good,average,good,1,23040595,0,,awesome,5,SOC101,"One of my favourite professors during first year.  He was so helpful answering emails and discussion board questions, as well as on Twitter.  Very thorough and interesting.  It also helps that he is nice to look at! Can't wait to take is Crime and Deviance course next year! :)",04/15/2014,2.0,2.0,,5,Really into it,5.0,5.0,1,Yes,1397565185000,N/A,1484,N/A,,N/A,[],people,person
Not Mandatory,good,poor,good,0,23040491,0,,awesome,4,SOC101Y,AMAZING PROF!!,04/15/2014,1.0,1.0,,5,Low,4.5,4.5,1,Yes,1397564230000,N/A,1484,N/A,,N/A,[],people,people
Mandatory,good,average,good,0,23040432,0,,awesome,5,SOC101,"Christian Caron was one of the best professors i've had, he made sociology class engaging and would always make the class fun and interesting. It was very easy to understand the material that he was teaching. I would recommend this class to anyone who wanted to start getting into the Sociology field.",04/15/2014,3.0,3.0,,4,It's my life,4.5,4.5,1,Yes,1397563684000,N/A,1484,N/A,,A-,[],people,people
Not Mandatory,good,average,good,1,23040426,0,,awesome,5,SOC101,Literally the best and nicest prof ever! He's so sweet and always does his best to answer everyone's questions and helps whoever needs it. His sweater vest collection is also so on point,04/15/2014,2.0,2.0,,5,Sorta interested,5.0,5.0,1,Yes,1397563611000,N/A,1484,N/A,,B-,[],people,person
Mandatory,good,average,good,1,23040403,0,,awesome,5,SOC101Y1,"This guy is actually unreal. Nicest dude, rocks the sweater vest so hard. His ""bless you"" line is classic. I really hope he's my professor in other sociology/criminology courses down the road!",04/15/2014,2.0,2.0,,5,It's my life,5.0,5.0,1,Yes,1397563402000,N/A,1484,N/A,,A+,[],people,person
N/A,good,average,good,0,23039780,0,,awesome,4,SOC101,Awesome professor!,04/15/2014,2.0,2.0,,5,Really into it,4.5,4.5,1,Yes,1397556620000,N/A,1484,N/A,,N/A,[],people,people
Not Mandatory,good,average,good,0,23038986,0,,awesome,5,SOC101Y1Y,"Prof Caron is amazing! He's super helpful, and makes sure students understand the material well. He makes his lectures very interesting, and his fashion sense is on point (you will love the sweater vests)! Keep rocking prof Caron, you are the best. :)",04/15/2014,2.0,2.0,,5,Really into it,5.0,5.0,1,Yes,1397524156000,N/A,1484,N/A,,N/A,[],people,people
Mandatory,good,poor,good,0,23038817,0,,awesome,5,SOC101Y1,"Best professor in my first year experience. Make sure you show up to class for in class participation marks, contribute online, and review review review! It is a very simple multiple choice based class with 2 major, but easy assignments.",04/15/2014,1.0,1.0,,5,Really into it,5.0,5.0,1,Yes,1397521639000,N/A,1484,N/A,,N/A,[],people,people
N/A,good,average,good,0,22934566,0,,awesome,4,SOC101Y,"NICEST GUY.  He dedicates so much of his time to this class, you can really tell that he cares about us as students.  He is always open to helping people. I can't say enough about how much I appreciate all of the time and effort he puts into our giant class.",03/21/2014,2.0,2.0,,5,Sorta interested,4.5,4.5,1,Yes,1395444867000,N/A,1484,N/A,,N/A,[],people,people
Mandatory,good,average,good,0,22888523,0,,awesome,5,SOC101Y1,Amazing prof. He does his job and he does it extremely well. You can tell he dedicates SO much of his time (if not all of it) to being the best prof he can be. It's very inspirational actually. He also encourages his students to email him directly (we're talking in a class of 1500+ students) THAT's amazing. Wish I was more interested in Sociology!,03/05/2014,2.0,2.0,,5,It's my life,5.0,5.0,1,Yes,1394045941000,N/A,1484,N/A,,B+,[],people,people
Mandatory,good,average,good,1,22821548,0,,awesome,4,SOC212,"Amazing! He was so engaging and really cared about the students and the subject. He was very understanding of the stress that students are under and accommodated schedules with the use of ILPs so everyone could play into their strengths. I would love to take another course with him! I wanted to do well for him too, not just myself.",02/05/2014,3.0,3.0,,5,Really into it,4.5,4.5,1,Yes,1391625669000,N/A,1484,N/A,,N/A,[],people,person
N/A,average,average,average,0,22469719,0,,good,3,SOC212,"I like him as a person but not as a professor. Doesn't use class time effectively (ie. he will spend half an hour at the beginning of class talking about administrative issues, and throughout lecture will take unnecessary and somewhat irrelevant questions from students, then take 5 minutes to give a 30 second answer). ILPs were also stressful.",12/08/2013,3.0,3.0,,4,Really into it,3.5,3.5,1,Yes,1386524225000,N/A,1484,N/A,,N/A,[],people,people
Mandatory,good,average,good,0,22193628,0,,awesome,5,SOC101Y,He's a great teacher. He makes the lectures engaging with activities in each lecture. He explains concepts very well and gives lots of examples related to the concepts. I think he understands what is it to be a university student. You can get a fair mark as long as you try.,10/19/2013,2.0,2.0,,5,It's my life,5.0,5.0,1,Yes,1382214668000,N/A,1484,N/A,,B+,[],people,people
