attendance,clarityColor,easyColor,helpColor,helpCount,id,notHelpCount,onlineClass,quality,rClarity,rClass,rComments,rDate,rEasy,rEasyString,rErrorMsg,rHelpful,rInterest,rOverall,rOverallString,rStatus,rTextBookUse,rTimestamp,rWouldTakeAgain,sId,takenForCredit,teacher,teacherGrade,teacherRatingTags,unUsefulGrouping,usefulGrouping
Mandatory,good,good,good,0,32112254,0,,good,4,ARC201,"Alex's studio classes are extremely intense. We would often be expected to meet with him outside of class, at short notice, on weekends, to discuss our projects. Overall the class was very rewarding, and I improved greatly over the semester. However, the stress of the course was insane and I'm not sure I would put myself through it again.",07/22/2019,5.0,5.0,,4,N/A,4.0,4.0,1,No,1563796325000,No,1484,Yes,,A-,"['Inspirational', ""Skip class? You won't pass."", 'Tough grader']",people,people
Mandatory,average,good,average,1,31494469,0,,poor,2,ARC313,"Alex is clearly a talented designer, but - as many talented people are - I found him to be difficult personality-wise and not that great at teaching. He undoubtedly plays favorites and grades accordingly. Unless he takes a liking to your work and/or personality, you will suffer in his class (note: genuine hard work will not save you either).",03/28/2019,4.0,4.0,,2,N/A,2.0,2.0,1,No,1553795971000,No,1484,Yes,,B,['Tough grader'],people,person
Mandatory,average,good,average,1,26603902,0,,good,3,ARC201,"Tough and picky prof. Really harsh. Offers good advise though but he looks for perfection. Would call your work as garbage if he doesnt like it. For one wants a high GPA, dont take his class! Will never take his class again! You will learn, but unpleasantly.",05/18/2016,5.0,5.0,,4,N/A,3.5,3.5,1,No,1463529841000,N/A,1484,Yes,,B,"['Tough grader', 'Gives good feedback', ""Skip class? You won't pass.""]",people,person
Mandatory,good,good,good,0,26040722,0,,good,4,ARC314,It's a challenge but probably the most valuable studio he teaches,02/09/2016,4.0,4.0,,4,It's my life,4.0,4.0,1,No,1455009428000,N/A,1484,Yes,,A-,"['Participation matters', ""Skip class? You won't pass."", 'Tough grader']",people,people
Mandatory,poor,good,poor,2,25491575,0,,awful,1,ARC101,Don't take him,11/26/2015,5.0,5.0,,1,Really into it,1.0,1.0,1,No,1448543705000,N/A,1484,Yes,,A-,['Tough grader'],people,people
Mandatory,good,good,good,1,25486443,4,,awesome,5,ARC101,"Alex is one of the most talented architects in the city. Visit Bar Raval at 505 College street and see his work in person. His class is difficult - architecture is difficult. If your serious about this, take his class, having Alex as a prof is an incredible opportunity and you will learn a ton.  If you want your ego stroked, go somewhere else.  ",11/24/2015,4.0,4.0,,5,It's my life,5.0,5.0,1,No,1448408349000,N/A,1484,Yes,,A,"['Gives good feedback', 'Inspirational', 'Tough grader']",people,person
N/A,average,good,poor,1,25190946,0,,poor,2,ARC221,Extremely critical. Learned more from the teaching assistants than him. Would never take again.,09/15/2015,5.0,5.0,,1,Low,1.5,1.5,1,No,1442341005000,N/A,1484,Yes,,N/A,"['Participation matters', ""Skip class? You won't pass."", 'Tough grader']",people,person
Mandatory,poor,good,poor,2,25100779,0,,poor,1,ARC101,tough dude.,08/07/2015,4.0,4.0,,2,Really into it,1.5,1.5,1,No,1438945914000,N/A,1484,Yes,,B+,"['Tough grader', ""Skip class? You won't pass.""]",people,people
