attendance,clarityColor,easyColor,helpColor,helpCount,id,notHelpCount,onlineClass,quality,rClarity,rClass,rComments,rDate,rEasy,rEasyString,rErrorMsg,rHelpful,rInterest,rOverall,rOverallString,rStatus,rTextBookUse,rTimestamp,rWouldTakeAgain,sId,takenForCredit,teacher,teacherGrade,teacherRatingTags,unUsefulGrouping,usefulGrouping
Not Mandatory,good,average,good,0,32897778,0,,awesome,5,INI236,Always leave this class inspired and stimulated.,02/08/2020,3.0,3.0,,5,N/A,5.0,5.0,1,Yes,1581140815000,Yes,1484,Yes,,A+,"['Respected', 'Gives good feedback', 'Accessible outside class']",people,people
N/A,good,good,good,0,32897776,0,online,awesome,5,INI236,Very informative course. Really well set up for those who have an inquisitive mind.,02/08/2020,4.0,4.0,,5,N/A,5.0,5.0,1,Yes,1581140775000,Yes,1484,No,,B,"['Inspirational', 'Get ready to read', 'Clear grading criteria']",people,people
Mandatory,good,good,good,0,32897775,0,,awesome,5,INI234,"This professor is a fountain of knowledge. She is is encouraging and inspires all of her class, no matter what your level, to push yourself to reach your full potential.",02/08/2020,5.0,5.0,,5,N/A,5.0,5.0,1,Yes,1581140736000,Yes,1484,Yes,,A+,"['Respected', 'Amazing lectures', 'Inspirational']",people,people
Mandatory,good,good,good,0,32897770,0,,awesome,5,INI236,Pure Class! Has made such a difference with how I analyse and collate information. #SkilllsForLife,02/08/2020,4.0,4.0,,5,N/A,5.0,5.0,1,No,1581140613000,Yes,1484,No,,A,"['Caring', 'Respected', 'Gives good feedback']",people,people
Mandatory,good,good,good,0,32897768,0,,awesome,5,INI236,Really enjoyed Prof Medha's lecture. She understands the city from many perspectives. I recommend this course,02/08/2020,4.0,4.0,,5,N/A,5.0,5.0,1,Yes,1581140380000,Yes,1484,Yes,,A+,"['Respected', 'Gives good feedback', 'Participation matters']",people,people
Mandatory,poor,poor,poor,0,32557828,0,,awful,1,INI234,"bad...I dont rate profs but if I can stop one person from taking a course with her, i'll know I did something right.",12/07/2019,1.0,1.0,,1,N/A,1.0,1.0,1,No,1575702246000,No,1484,Yes,,N/A,[],people,people
Mandatory,good,average,good,0,31890404,0,,good,4,INI236,"Professor Mehta is new to the Urban Studies department, but she is well suited to the courses she teaches. Her own research passions come through in her lectures, and she is good at making connections beyond the classroom in her assignments. The concepts she teaches can be repetitive, but they are taught well and thoroughly.",05/16/2019,2.0,2.0,,4,N/A,4.0,4.0,1,No,1558015084000,Yes,1484,Yes,,N/A,"['Accessible outside class', 'Group projects', 'Caring']",people,people
