attendance,clarityColor,easyColor,helpColor,helpCount,id,notHelpCount,onlineClass,quality,rClarity,rClass,rComments,rDate,rEasy,rEasyString,rErrorMsg,rHelpful,rInterest,rOverall,rOverallString,rStatus,rTextBookUse,rTimestamp,rWouldTakeAgain,sId,takenForCredit,teacher,teacherGrade,teacherRatingTags,unUsefulGrouping,usefulGrouping
N/A,good,poor,good,0,203153,0,,awesome,5,VIC120,Thanks to Danesi I got my butt out of bed in the morning.  And he's funny!,05/07/2002,1.0,1.0,,5,N/A,5.0,5.0,1,N/A,1020743390000,N/A,1484,N/A,,N/A,[],people,people
N/A,good,poor,good,0,193088,0,,awesome,5,VIC120Y,Makes all the info memorable. I love him!,04/27/2002,1.0,1.0,,5,N/A,5.0,5.0,1,N/A,1019951002000,N/A,1484,N/A,,N/A,[],people,people
Mandatory,good,average,good,0,154900,0,,awesome,5,VIC120,simply the best prof you'll have.,03/31/2002,2.0,2.0,,5,N/A,5.0,5.0,1,N/A,1017612224000,N/A,1484,N/A,,N/A,[],people,people
N/A,good,poor,good,0,152900,0,,awesome,4,VIC120,"One of the nicest profs at U of T, and one of the most interesting courses too",03/29/2002,1.0,1.0,,5,N/A,4.5,4.5,1,N/A,1017407600000,N/A,1484,N/A,,N/A,[],people,people
N/A,good,poor,good,0,136326,0,,awesome,4,VIC120,he's getting funnier in his old age....,03/14/2002,1.0,1.0,,5,N/A,4.5,4.5,1,N/A,1016135082000,N/A,1484,N/A,,N/A,[],people,people
N/A,average,average,good,0,132556,0,,good,3,VIC120,"Obsessed with his cat, but that's what makes it worth waking up",03/11/2002,2.0,2.0,,5,N/A,4.0,4.0,1,N/A,1015863972000,N/A,1484,N/A,,N/A,[],people,people
N/A,good,poor,good,0,124171,0,,awesome,5,VIC120,The nicest man you'd ever met,02/26/2002,1.0,1.0,,5,N/A,5.0,5.0,1,N/A,1014763157000,N/A,1484,N/A,,N/A,[],people,people
N/A,good,poor,good,0,124126,0,,awesome,5,VIC120,great prof! he treats his students as humans!,02/26/2002,1.0,1.0,,5,N/A,5.0,5.0,1,N/A,1014760093000,N/A,1484,N/A,,N/A,[],people,people
N/A,poor,good,poor,0,109444,0,,awful,1,EZA,good to see a prof known as pushover,02/11/2002,5.0,5.0,,1,N/A,1.0,1.0,1,N/A,1013437355000,N/A,1484,N/A,,N/A,[],people,people
Mandatory,good,poor,good,0,108275,0,,awesome,5,VIC120,He is the best!!!,02/10/2002,1.0,1.0,,5,N/A,5.0,5.0,1,N/A,1013369319000,N/A,1484,N/A,,A,[],people,people
N/A,good,average,good,0,99244,0,,awesome,5,VIC120,Great Prof ! - extremely entertaining and great examples,02/06/2002,3.0,3.0,,5,N/A,5.0,5.0,1,N/A,1013031341000,N/A,1484,N/A,,N/A,[],people,people
N/A,good,poor,good,0,90107,0,,good,4,VIC120Y,The easiest class EVER at UofT.,02/04/2002,1.0,1.0,,4,N/A,4.0,4.0,1,N/A,1012816686000,N/A,1484,N/A,,N/A,[],people,people
N/A,good,poor,average,0,67034,0,,good,4,VIC120,No Comments,12/06/2001,1.0,1.0,,3,N/A,3.5,3.5,1,N/A,1007659711000,N/A,1484,N/A,,N/A,[],people,people
N/A,good,average,average,0,52508,0,,good,4,VIC120Y,"So funny, he makes waking up early lots of fun!!",10/29/2001,2.0,2.0,,3,N/A,3.5,3.5,1,N/A,1004372401000,N/A,1484,N/A,,N/A,[],people,people
