attendance,clarityColor,easyColor,helpColor,helpCount,id,notHelpCount,onlineClass,quality,rClarity,rClass,rComments,rDate,rEasy,rEasyString,rErrorMsg,rHelpful,rInterest,rOverall,rOverallString,rStatus,rTextBookUse,rTimestamp,rWouldTakeAgain,sId,takenForCredit,teacher,teacherGrade,teacherRatingTags,unUsefulGrouping,usefulGrouping
Mandatory,poor,poor,poor,2,30533233,0,,awful,1,APS111,"Lectures poorly organized with no logical transition from one topic to another. There is often repetition, same stuff taught over and over. The textbook is wrote by herself with ambiguous sentences and repetitive content. Definitions of the same thing differs as you go into different chapters. It's nice she created the demand of her book with ESP.",10/01/2018,1.0,1.0,,1,N/A,1.0,1.0,1,Yes,1538382076000,No,1484,Yes,,N/A,[],people,people
Mandatory,good,good,good,1,27097431,0,,good,4,APS111,"Tip: Even though they warn not to look at past exams, DO go through as many tests as you can well before your exam (while studying) since, although the content may be different the further back you go, the types of questions are mostly the same and often repeated! Also, the TB doesn't have any exam Q., so past tests are your only practice!",10/30/2016,4.0,4.0,,4,N/A,4.0,4.0,1,Yes,1477824234000,Yes,1484,Yes,,INC,"['Inspirational', 'Group projects', 'Clear grading criteria']",people,person
Not Mandatory,good,average,good,0,26989112,0,,good,4,APS111,"she is a very nice and lovely prof, although this course seems common sense but it will become very useful and it should be easy to get good marks",09/22/2016,3.0,3.0,,4,N/A,4.0,4.0,1,Yes,1474572058000,Yes,1484,Yes,,N/A,"['Accessible outside class', 'Participation matters', 'Respected']",people,people
Mandatory,average,average,average,0,25673892,0,,good,2,APS111,What she said in the lectures didn't seem very clear to me then but before the midterm I realized  that the participation itself helped me so much that I didn't have to study much. The lectures may not be very exciting but she teaches as if the material is very easy and that helps me as a student to learn better. ,12/13/2015,2.0,2.0,,5,Sorta interested,3.5,3.5,1,No,1450037369000,N/A,1484,Yes,,N/A,"['Inspirational', 'Participation matters', 'Lecture heavy']",people,people
Mandatory,poor,average,poor,3,25196154,1,,awful,1,APS111,She taught us about soggy samosas in Engineering Strategies and Practice. ,09/17/2015,3.0,3.0,,1,Meh,1.0,1.0,1,No,1442533371000,N/A,1484,Yes,,N/A,['Participation matters'],person,people
N/A,average,good,average,1,23624894,1,,poor,2,APS111,Too much squabbling.,10/02/2014,5.0,5.0,,2,Meh,2.0,2.0,1,No,1412243474000,N/A,1484,Yes,,N/A,[],person,person
N/A,good,good,good,4,20765440,0,,awesome,4,APS111,"Yes, the course can seem useless and terrible at first, but believe me, she's a good prof. you tend to realise he value AFTER she stops lecturing and the other ESP profs take over...",11/01/2012,4.0,4.0,,5,Really into it,4.5,4.5,1,Yes,1351794260000,N/A,1484,N/A,,N/A,[],people,people
N/A,average,average,poor,0,18009592,2,,poor,2,APS111,"APS is the worst class you can have, so boring.",12/20/2010,3.0,3.0,,1,Meh,1.5,1.5,1,No,1292886615000,N/A,1484,N/A,,N/A,[],people,people
N/A,average,average,average,4,17695126,4,,poor,3,APS111,Big ego gets in the way of lecturing.,10/26/2010,3.0,3.0,,1,Meh,2.0,2.0,1,No,1288119089000,N/A,1484,N/A,,N/A,[],people,people
N/A,average,average,average,2,16703550,3,,poor,2,APS111,full of herself,01/10/2010,2.0,2.0,,2,Sorta interested,2.0,2.0,1,No,1263127822000,N/A,1484,N/A,,N/A,[],people,people
N/A,poor,good,poor,0,14326302,2,,awful,1,APS111,bah,04/22/2008,5.0,5.0,,1,Meh,1.0,1.0,1,No,1208824107000,N/A,1484,N/A,,N/A,[],people,people
N/A,average,good,average,1,11574423,0,,good,3,APS111,"Great class ever, she has heart and soul for this job, a bit judgemental sometimes, but her heart is in the right place, very helpful to the students, despite her crazy schedule and mandates, she still manages to meet one one on one and help out...",03/15/2006,4.0,4.0,,4,It's my life,3.5,3.5,1,N/A,1142413857000,N/A,1484,N/A,,N/A,[],people,person
Mandatory,poor,average,poor,0,11087797,1,,awful,1,APS111,Worst Course Ever,12/08/2005,2.0,2.0,,1,Meh,1.0,1.0,1,N/A,1134038782000,N/A,1484,N/A,,WD,[],person,people
N/A,poor,good,poor,1,10986455,1,,awful,1,APS111,Should never be forgiven nor absolved of the sin that is Engineering Strategies and Practices.,11/25/2005,5.0,5.0,,1,Meh,1.0,1.0,1,N/A,1132949625000,N/A,1484,N/A,,N/A,[],person,person
Mandatory,poor,good,poor,1,10954127,1,,awful,1,APS111,APS111 is the worst class ever,11/19/2005,5.0,5.0,,1,Meh,1.0,1.0,1,N/A,1132418310000,N/A,1484,N/A,,N/A,[],person,person
N/A,good,average,good,1,10605148,0,,awesome,5,APS111112,She's great!,10/18/2005,3.0,3.0,,5,Really into it,5.0,5.0,1,N/A,1129669914000,N/A,1484,N/A,,N/A,[],people,person
N/A,good,poor,good,1,10436591,2,,awesome,5,APS,She's so hot!,09/21/2005,1.0,1.0,,5,It's my life,5.0,5.0,1,N/A,1127336780000,N/A,1484,N/A,,N/A,[],people,person
N/A,good,poor,good,0,3393228,0,,awesome,5,APS,No Comments,02/24/2005,1.0,1.0,,5,It's my life,5.0,5.0,1,N/A,1109284871000,N/A,1484,N/A,,N/A,[],people,people
N/A,good,average,good,1,3383044,0,,awesome,5,MIE3SOMETHING,"McCahan is the best professor in the department undoubtedly.One in a million. Everything she touches is gold, she gives total effort to every test and every problem. We all know this is very rare. Dont do your thesis with her if you want to slack off, she gives a lot and expects a lot in return.",02/22/2005,3.0,3.0,,5,It's my life,5.0,5.0,1,N/A,1109088505000,N/A,1484,N/A,,N/A,[],people,person
N/A,good,average,good,1,2951976,0,,awesome,5,MIE311,"Excellent Thermodynamics Prof!  Very helpful, witty jokes and most importantly nice.  Problem sets are essential in the course....Don't Do Them = Failing course.",12/08/2004,3.0,3.0,,5,Sorta interested,5.0,5.0,1,N/A,1102531654000,N/A,1484,N/A,,N/A,[],people,person
N/A,poor,poor,average,0,2894833,1,,average,1,APS111,shoulnt bring herself down to the other profs in this course,12/02/2004,1.0,1.0,,5,Meh,3.0,3.0,1,N/A,1102029322000,N/A,1484,N/A,,N/A,[],person,people
N/A,good,average,good,1,1818188,0,,awesome,5,APS111112,"very helpful, good lecturer, funny.. really the best ESP prof we had all year",03/17/2004,2.0,2.0,,5,N/A,5.0,5.0,1,N/A,1079559826000,N/A,1484,N/A,,N/A,[],people,person
N/A,good,good,good,0,730975,0,,awesome,5,MIE311,"excellent, simply the best.  very high educational value",03/21/2003,4.0,4.0,,5,N/A,5.0,5.0,1,N/A,1048244703000,N/A,1484,N/A,,N/A,[],people,people
N/A,good,average,good,0,714046,0,,awesome,5,MIE311515,No Comments,03/16/2003,3.0,3.0,,5,N/A,5.0,5.0,1,N/A,1047853890000,N/A,1484,N/A,,N/A,[],people,people
N/A,good,good,good,1,713886,0,,awesome,5,MIE310,Only prof who will work harder on your projects than you do,03/16/2003,4.0,4.0,,5,N/A,5.0,5.0,1,N/A,1047849664000,N/A,1484,N/A,,N/A,[],people,person
N/A,good,average,good,1,447007,0,,awesome,5,MIE310,One of the best profs I've ever had!!!,12/18/2002,3.0,3.0,,5,N/A,5.0,5.0,1,N/A,1040209751000,N/A,1484,N/A,,N/A,[],people,person
