attendance,clarityColor,easyColor,helpColor,helpCount,id,notHelpCount,onlineClass,quality,rClarity,rClass,rComments,rDate,rEasy,rEasyString,rErrorMsg,rHelpful,rInterest,rOverall,rOverallString,rStatus,rTextBookUse,rTimestamp,rWouldTakeAgain,sId,takenForCredit,teacher,teacherGrade,teacherRatingTags,unUsefulGrouping,usefulGrouping
Mandatory,good,average,good,1,30380774,0,,awesome,5,PSY220,Took her class during the Summer of 2018 and I must say she is a wonderful professor overall! Very knowledgeable and she is always willing to help any questions you may have. I would recommend her class to anyone at UofT. Her tests are based solely on lecture material (which is a plus bc I basically ignored the textbook and got a high A).,07/27/2018,2.0,2.0,,5,N/A,5.0,5.0,1,No,1532734001000,Yes,1484,Yes,,A,"['Inspirational', ""Skip class? You won't pass."", 'Caring']",people,person
Not Mandatory,good,average,good,0,25816822,0,,awesome,5,PSY220,"Very interesting lectures, still remember her lessons over two years later. She has a deep knowledge of her subject and is an excellent teacher.",12/23/2015,3.0,3.0,,5,It's my life,5.0,5.0,1,Yes,1450914734000,N/A,1484,Yes,,B-,"['Inspirational', 'Gives good feedback', 'Amazing lectures']",people,people
N/A,good,average,good,0,24625032,0,,awesome,5,PSY220,"No papers ! Tests are based on lecture materials ( she co-authored the textbook, so lectures and textbooks are basically say the same thing ). You don't really have to memorize the researchers' name ( though she said so) they just serve as retrieval cues on the tests. Overall, great prof !",04/19/2015,3.0,3.0,,5,It's my life,5.0,5.0,1,No,1429476508000,N/A,1484,Yes,,N/A,"['Amazing lectures', 'Hilarious', ""Skip class? You won't pass.""]",people,people
N/A,good,average,good,0,24466140,0,,awesome,5,PSY220,Attend lectures  A,03/16/2015,2.0,2.0,,5,It's my life,5.0,5.0,1,No,1426526911000,Yes,1484,Yes,,N/A,"['Amazing lectures', ""Skip class? You won't pass.""]",people,people
Not Mandatory,good,average,good,0,24448679,0,,awesome,5,PSY220,EASY. GREAT PROF. GREAT LECTURES. MUST TAKE.,03/10/2015,2.0,2.0,,4,Really into it,4.5,4.5,1,Yes,1426005329000,Yes,1484,Yes,,A,"[""Skip class? You won't pass."", 'Amazing lectures']",people,people
Not Mandatory,good,average,good,0,22766032,0,,awesome,5,PSY220,"Took her class in Fall 2012 (finally getting around to rating it).She was very organized & clear--since she co-wrote the textbook,there was no disparity b/t her lectures & the book.I learned a ton!I like that she emphasized learning psychs' names;it's a good habit to adopt early on in your studies. Hint:final exam is detailed.Read the book closely!",01/17/2014,3.0,3.0,,5,Really into it,5.0,5.0,1,Yes,1389967749000,N/A,1484,N/A,,A+,[],people,people
