attendance,clarityColor,easyColor,helpColor,helpCount,id,notHelpCount,onlineClass,quality,rClarity,rClass,rComments,rDate,rEasy,rEasyString,rErrorMsg,rHelpful,rInterest,rOverall,rOverallString,rStatus,rTextBookUse,rTimestamp,rWouldTakeAgain,sId,takenForCredit,teacher,teacherGrade,teacherRatingTags,unUsefulGrouping,usefulGrouping
N/A,average,poor,average,1,11060231,0,,average,3,SOC101,"I can't stand it when prof's make us by all their stupid textbooks so they can get a paycheck (like, American soc for Americans..what&#63;&#63;). He's not great at all, a total name dropper, sits on a high horse, has been teaching the same course for like 15 years or something. SOMETIMES he cracks a good joke...thats rare though.",12/05/2005,1.0,1.0,,3,Meh,3.0,3.0,1,N/A,1133821971000,N/A,1484,N/A,,N/A,[],people,person
Mandatory,good,average,good,0,11047147,0,,good,4,SOC101,Tepperman is a good prof! I personally like his sense of humor but a lot of people dont. His lectures are long with a lot of slides and he moves fairly quickly-the subject material is interesting at times and boring at others but Tepperman tries to keep everything going with his jokes. Tests are ok. Lectres can feel realy long but overall gr8 class,12/04/2005,3.0,3.0,,4,Really into it,4.0,4.0,1,N/A,1133696135000,N/A,1484,N/A,,A-,[],people,people
Mandatory,good,good,average,0,10989406,0,,average,4,SOC101,"Don't Take this Class, unless u enjoy reading and have a lot of time in your hand.",11/27/2005,5.0,5.0,,2,It's my life,3.0,3.0,1,N/A,1133071821000,N/A,1484,N/A,,N/A,[],people,people
N/A,average,good,average,0,10888377,0,,good,3,SOC101,"gives confusing tests...is a nice prof but way too boring in my opinion. Tepperman says SOC101 is a bird course, yet its soo hard! i like the topics discussed in class though",11/12/2005,4.0,4.0,,4,It's my life,3.5,3.5,1,N/A,1131793466000,N/A,1484,N/A,,N/A,[],people,people
N/A,poor,average,poor,0,10205347,0,,awful,1,101,I have never met a professor with fewer social graces in any class I have taken.  I hear all he has published for years is intro. textbooks.,09/04/2005,3.0,3.0,,1,It's my life,1.0,1.0,1,N/A,1125844463000,N/A,1484,N/A,,N/A,[],people,people
Mandatory,good,good,good,0,10085347,0,,awesome,5,SOC382Y,One of the best profs i've had. You read an article that you think is really uninteresting and he talks about it in class and brings it to life making you understand it in a whole new way. Sooo helpful. Really wants you to succeed. Takes a genuine interest in his students. Such a great guy. Clearly loves what he does and this passion is contagious.,08/02/2005,4.0,4.0,,5,Sorta interested,5.0,5.0,1,N/A,1123012067000,N/A,1484,N/A,,N/A,[],people,people
Mandatory,good,average,good,0,3593593,0,,awesome,5,SOC382,"A wonderful teacher (refreshing for the U of T). This course however was not as interesting as I thought it would be. Prof Tepperman is a very interesting person, very knowledgeable, flexible in terms of meeting his students' needs, and an all around good guy, so he saved the course.",04/10/2005,3.0,3.0,,5,It's my life,5.0,5.0,1,N/A,1113135025000,N/A,1484,N/A,,A-,[],people,people
N/A,good,poor,good,0,3367731,0,,awesome,5,SOC101,"Great teacher and human being. Incredibly knowledgeable, helpful and kind. The best!",02/17/2005,1.0,1.0,,5,It's my life,5.0,5.0,1,N/A,1108650448000,N/A,1484,N/A,,N/A,[],people,people
N/A,good,average,good,0,3246670,0,,good,4,SOC101,"Listens well, open-minded. I had a problem with some of the things he said about other periods of history since he got the facts wrong.",01/19/2005,2.0,2.0,,4,Low,4.0,4.0,1,N/A,1106146806000,N/A,1484,N/A,,N/A,[],people,people
N/A,good,good,good,0,2384075,0,,awesome,4,SOC101Y,"Took his class 2 summers ago. In 4 months,we did more reading than the class that runs for twice as long in the fall/winter terms. Course reader (rough copy his unpublished book, errors & all) was expensive. But Tepperman was very approachable & helpful.",08/11/2004,4.0,4.0,,5,N/A,4.5,4.5,1,N/A,1092262812000,N/A,1484,N/A,,N/A,[],people,people
Mandatory,good,poor,good,0,1807334,0,,awesome,5,SOC100Y,"Good teacher. However, constantly makes references to the holocaust. Tends to stifle debate within the class.",03/15/2004,1.0,1.0,,5,N/A,5.0,5.0,1,N/A,1079316223000,N/A,1484,N/A,,C,[],people,people
Mandatory,good,good,good,0,1763863,1,,awesome,5,SOC101,"Fantastic Prof.  Clear, good lecturer, encourages student participation.  He is interesting, open minded.  Would highly recommend taking his course.",03/01/2004,5.0,5.0,,5,N/A,5.0,5.0,1,N/A,1078099887000,N/A,1484,N/A,,N/A,[],person,people
N/A,good,average,good,0,1271628,0,,awesome,5,SOC327,"extremely intelligent.  may seem intimidating at first, but is very caring, and understanding.  Gives honest feedback in HELP, not to belittle.  SOC327 best course i've taken",11/05/2003,3.0,3.0,,5,N/A,5.0,5.0,1,N/A,1068074807000,N/A,1484,N/A,,N/A,[],people,people
N/A,good,average,good,0,737920,0,,awesome,5,SOC100,Awesome,03/24/2003,3.0,3.0,,5,N/A,5.0,5.0,1,N/A,1048511873000,N/A,1484,N/A,,N/A,[],people,people
N/A,poor,good,poor,0,654946,0,,awful,1,100,where did they get this clown&#63;,02/28/2003,4.0,4.0,,1,N/A,1.0,1.0,1,N/A,1046464731000,N/A,1484,N/A,,N/A,[],people,people
N/A,average,average,average,0,537057,0,,average,2,SOC101,No Comments,02/03/2003,2.0,2.0,,3,N/A,2.5,2.5,1,N/A,1044287530000,N/A,1484,N/A,,N/A,[],people,people
N/A,good,average,good,0,444545,0,,awesome,4,SOC327,Soc 101ers have Prof Tepperman wrong. He is a wonderful and smart prof.,12/17/2002,3.0,3.0,,5,N/A,4.5,4.5,1,N/A,1040157548000,N/A,1484,N/A,,N/A,[],people,people
N/A,good,average,good,0,170986,0,,good,4,SOC101,very interesting professor,04/10/2002,2.0,2.0,,4,N/A,4.0,4.0,1,N/A,1018480735000,N/A,1484,N/A,,N/A,[],people,people
N/A,average,average,average,0,167692,0,,average,3,101,Does he even do research or just publish intro textbooks&#63;-,04/09/2002,3.0,3.0,,3,N/A,3.0,3.0,1,N/A,1018353067000,N/A,1484,N/A,,N/A,[],people,people
N/A,average,good,average,0,42326,0,,poor,2,SOC101,He's BORING and CHILDISH,09/09/2001,4.0,4.0,,2,N/A,2.0,2.0,1,N/A,1000075750000,N/A,1484,N/A,,N/A,[],people,people
Mandatory,good,poor,good,0,36161,0,,good,4,SOC101,he usually makes the students question their answers,07/19/2001,1.0,1.0,,4,N/A,4.0,4.0,1,N/A,995504554000,N/A,1484,N/A,,B-,[],people,people
N/A,good,average,good,0,31916,0,,good,5,SOC101,He's easy going and pretty funny... but he always thinks HE is right (of course),07/07/2001,2.0,2.0,,3,N/A,4.0,4.0,1,N/A,994530051000,N/A,1484,N/A,,N/A,[],people,people
N/A,good,average,good,0,31135,0,,awesome,5,SOC101,One of the funniest professor I have ever seen!!,07/03/2001,2.0,2.0,,5,N/A,5.0,5.0,1,N/A,994127431000,N/A,1484,N/A,,N/A,[],people,people
