attendance,clarityColor,easyColor,helpColor,helpCount,id,notHelpCount,onlineClass,quality,rClarity,rClass,rComments,rDate,rEasy,rEasyString,rErrorMsg,rHelpful,rInterest,rOverall,rOverallString,rStatus,rTextBookUse,rTimestamp,rWouldTakeAgain,sId,takenForCredit,teacher,teacherGrade,teacherRatingTags,unUsefulGrouping,usefulGrouping
Not Mandatory,good,good,good,0,25495006,1,,awesome,5,ECE1501,"He is the best professor ever! The course materials are hard and tough and tests are arguably insane! However, you have this wonderful professor and he turns rocks into flowers. I have taken two undergrad courses lectured by him and now I am taking a grad course of his. Great memory! I am so moved by his help and kindness when I had hard time. Best",11/28/2015,4.0,4.0,,5,It's my life,5.0,5.0,1,Yes,1448671886000,N/A,1484,Yes,,N/A,"['Caring', 'Amazing lectures', 'Tough grader']",person,people
N/A,good,average,good,0,15115675,0,,awesome,4,ECE1501,I personally think he's the best prof. around in U of T. I took 3 of his undergrad courses when I was an undergrad and I took 1 grad course when I started my Master's. Simply the best lecturer and very helpful all around. His tests/finals are fair I would say.,12/05/2008,2.0,2.0,,5,Really into it,4.5,4.5,1,Yes,1228496459000,N/A,1484,N/A,,N/A,[],people,people
N/A,good,average,good,0,14067932,0,,awesome,5,ECE417,He is my role model,02/03/2008,2.0,2.0,,5,It's my life,5.0,5.0,1,Yes,1202054143000,N/A,1484,N/A,,N/A,[],people,people
N/A,good,good,good,0,11395191,0,,awesome,5,ECE316,"This course changed my life, and Prof. K. is responsible.",01/20/2006,4.0,4.0,,5,It's my life,5.0,5.0,1,N/A,1137761088000,N/A,1484,N/A,,N/A,[],people,people
N/A,poor,average,poor,0,10828720,1,,awful,1,ECE,"don't trust this guy!  he acted all nice during the semester, and then killed us on the exam.  apparently, he's done that for the past few years.  When i tried to talk to him about my exam, he was very cold and different.  It's all an act, he's careless, manipulative, and not nice at all.",11/06/2005,2.0,2.0,,1,Sorta interested,1.0,1.0,1,N/A,1131286782000,N/A,1484,N/A,,N/A,[],person,people
N/A,good,average,good,0,10705245,1,,awesome,5,ECE316,Best prof I have ever had in my 4 yrs at U of T Electrical Engineering!! He is simply the best...and he is very intelligent! They should have more professors like him!! There are very few like him so enjoy his class while it lasts folks!,11/04/2005,2.0,2.0,,5,It's my life,5.0,5.0,3,N/A,1131138574000,N/A,1484,N/A,,N/A,[],person,people
N/A,good,average,average,0,3397831,0,,average,5,ECE,"The year I had him, he  was moody and irratable. He was a clear lecturer though, but he was a bit manipulative so I always felt uncomfortable around him. For whatever reason it seems like he's acting like a nicer guy.  Enjoy it while it lasts.",02/26/2005,3.0,3.0,,1,Really into it,3.0,3.0,1,N/A,1109435201000,N/A,1484,N/A,,N/A,[],people,people
Mandatory,good,poor,good,0,3386539,0,,awesome,5,ECE418,"Very smart, cares about the students, does his best to make you understand. A super plus.",02/23/2005,1.0,1.0,,5,Really into it,5.0,5.0,1,N/A,1109166529000,N/A,1484,N/A,,N/A,[],people,people
N/A,good,average,good,0,2348447,0,,awesome,5,ECE190,"The Best Professor ever, Knows his stuff very well, extremely smart. His teaching is very clear, and he helps out students all the time. I would like to take his class again. Simply amazing prof.",07/28/2004,3.0,3.0,,5,N/A,5.0,5.0,1,N/A,1091017235000,N/A,1484,N/A,,N/A,[],people,people
N/A,good,average,good,0,2193073,0,,awesome,5,ECE418,"He was elected the best prof of the year for U of T when I took this course.  This course is simply the most difficult ever.  However, he made it so simple and we learn so much from him, if you are taking his course! don't worry, btw, he is very smart!",05/27/2004,2.0,2.0,,5,N/A,5.0,5.0,1,N/A,1085656291000,N/A,1484,N/A,,N/A,[],people,people
N/A,good,average,good,0,1961336,0,,awesome,5,ECE190,He impressed me with his tricks from Pascal's triangle... I now show them off at cocktail parties.,04/14/2004,3.0,3.0,,5,N/A,5.0,5.0,1,N/A,1081976828000,N/A,1484,N/A,,N/A,[],people,people
N/A,good,average,good,0,1934013,0,,awesome,5,ECE190,Great prof,04/10/2004,2.0,2.0,,5,N/A,5.0,5.0,1,N/A,1081637571000,N/A,1484,N/A,,N/A,[],people,people
N/A,good,average,good,0,1927352,0,,awesome,5,ECE190,AMAZING PROF... Simply the best.,04/09/2004,3.0,3.0,,5,N/A,5.0,5.0,1,N/A,1081470097000,N/A,1484,N/A,,N/A,[],people,people
N/A,good,poor,good,0,1899780,0,,awesome,5,ECE190,:),04/05/2004,1.0,1.0,,5,N/A,5.0,5.0,1,N/A,1081127127000,N/A,1484,N/A,,N/A,[],people,people
N/A,good,average,good,0,1892456,0,,awesome,5,ECE190,loved the leather jacket,04/02/2004,3.0,3.0,,5,N/A,5.0,5.0,1,N/A,1080936417000,N/A,1484,N/A,,N/A,[],people,people
N/A,good,average,good,0,1892454,0,,awesome,5,ECE190,AWESOME!!,04/02/2004,3.0,3.0,,5,N/A,5.0,5.0,1,N/A,1080936405000,N/A,1484,N/A,,N/A,[],people,people
N/A,poor,good,poor,0,1721023,0,,awful,1,ECE190,No Comments,02/15/2004,5.0,5.0,,1,N/A,1.0,1.0,1,N/A,1076876495000,N/A,1484,N/A,,N/A,[],people,people
N/A,average,good,average,0,1498508,0,,good,3,ECC190,No Comments,12/13/2003,4.0,4.0,,4,N/A,3.5,3.5,1,N/A,1071307608000,N/A,1484,N/A,,N/A,[],people,people
N/A,good,average,good,0,1409578,0,,awesome,5,ECE190,"Great explanations, great prof, Teaches really well and uses very good examples! His chuckles make you laugh!",11/30/2003,3.0,3.0,,5,N/A,5.0,5.0,1,N/A,1070228307000,N/A,1484,N/A,,N/A,[],people,people
N/A,good,poor,good,0,1286433,0,,awesome,5,ECE190,"Not only is this man good looking, he's appealing to all genders simultaneously.  Although I consider myself a heterosexual, I find myself drawn to this paragon of profdom.  Oh, Professor Kishang, please stop wearing musk!",11/08/2003,1.0,1.0,,5,N/A,5.0,5.0,1,N/A,1068322732000,N/A,1484,N/A,,N/A,[],people,people
N/A,good,poor,good,0,1253904,0,,awesome,5,ECE190,the most good looking man in the whole world ... he is soooo good looking .... i mean wow!,11/03/2003,1.0,1.0,,5,N/A,5.0,5.0,1,N/A,1067864221000,N/A,1484,N/A,,N/A,[],people,people
N/A,good,poor,good,0,1239231,0,,awesome,5,ECE190,No Comments,10/29/2003,1.0,1.0,,5,N/A,5.0,5.0,1,N/A,1067467860000,N/A,1484,N/A,,N/A,[],people,people
N/A,average,good,poor,0,1187885,0,,poor,2,ECE101,No Comments,10/14/2003,4.0,4.0,,1,N/A,1.5,1.5,1,N/A,1066115296000,N/A,1484,N/A,,N/A,[],people,people
N/A,poor,good,poor,0,929025,0,,awful,1,ECE481,No Comments,05/05/2003,5.0,5.0,,1,N/A,1.0,1.0,1,N/A,1052175250000,N/A,1484,N/A,,N/A,[],people,people
N/A,poor,good,poor,0,890530,0,,awful,1,ECE418,No Comments,04/26/2003,5.0,5.0,,1,N/A,1.0,1.0,1,N/A,1051387690000,N/A,1484,N/A,,N/A,[],people,people
N/A,poor,good,poor,0,660719,0,,awful,1,ECE418,talks down to you - not very friendly - has very difficult exams/tests,03/02/2003,5.0,5.0,,1,N/A,1.0,1.0,1,N/A,1046595317000,N/A,1484,N/A,,N/A,[],people,people
N/A,poor,good,poor,0,618143,0,,awful,1,418,"maybe it is just me, but he was rather rude during office hours.",02/23/2003,5.0,5.0,,1,N/A,1.0,1.0,1,N/A,1045962593000,N/A,1484,N/A,,N/A,[],people,people
N/A,good,good,good,0,600511,0,,awesome,5,ECE418,One of the best profs you can find.,02/20/2003,4.0,4.0,,5,N/A,5.0,5.0,1,N/A,1045737015000,N/A,1484,N/A,,N/A,[],people,people
N/A,good,good,good,0,600488,0,,awesome,5,ECE418,"Aside from his tests/exams, extremely good prof",02/20/2003,5.0,5.0,,5,N/A,5.0,5.0,1,N/A,1045736814000,N/A,1484,N/A,,N/A,[],people,people
N/A,good,good,good,0,511729,0,,good,4,ECE418,Good prof but exams are WAY TOO HARD!!,01/23/2003,5.0,5.0,,4,N/A,4.0,4.0,1,N/A,1043281120000,N/A,1484,N/A,,N/A,[],people,people
N/A,good,good,good,0,102943,0,,awesome,5,ECE418,"Great prof, the best in engineering at u of t",02/07/2002,4.0,4.0,,5,N/A,5.0,5.0,1,N/A,1013117237000,N/A,1484,N/A,,N/A,[],people,people
N/A,average,average,poor,0,89793,0,,poor,2,ECE203,"What happened to all of us in the final exam, Frank&#63;",02/03/2002,3.0,3.0,,1,N/A,1.5,1.5,1,N/A,1012737252000,N/A,1484,N/A,,N/A,[],people,people
N/A,good,average,good,0,87515,0,,awesome,5,ECE418ECE,No Comments,01/29/2002,3.0,3.0,,4,N/A,4.5,4.5,1,N/A,1012322371000,N/A,1484,N/A,,N/A,[],people,people
