attendance,clarityColor,easyColor,helpColor,helpCount,id,notHelpCount,onlineClass,quality,rClarity,rClass,rComments,rDate,rEasy,rEasyString,rErrorMsg,rHelpful,rInterest,rOverall,rOverallString,rStatus,rTextBookUse,rTimestamp,rWouldTakeAgain,sId,takenForCredit,teacher,teacherGrade,teacherRatingTags,unUsefulGrouping,usefulGrouping
N/A,good,average,good,0,20374999,0,,awesome,4,SOC205,"Fantastic. Subbed in SOC101, didn't get to develop own curriculum, still added. This course is awesome: no text, free download papers, project is soc. observations, not just an essay. Includes lots of her current observations/pictures to add to lectures. So funny too! Very approachable, tries to get to know you. Hope for more courses with her!",06/03/2012,2.0,2.0,,5,Really into it,4.5,4.5,1,No,1338682806000,N/A,1484,N/A,,N/A,[],people,people
N/A,good,average,good,0,20175079,0,,awesome,5,SOC101,Totally awesome prof. knows a lot but is pretty funny so  her lectures are easy to follow. Some of my friends even came to hear her.,05/02/2012,3.0,3.0,,5,It's my life,5.0,5.0,1,No,1335964267000,N/A,1484,N/A,,N/A,[],people,people
N/A,good,average,good,0,20150340,0,,awesome,5,SOC220,Prof Kenny is the best prof EVER. She's funny and engaging and incredibly smart. I learned a lot in this class.,04/29/2012,3.0,3.0,,5,It's my life,5.0,5.0,1,Yes,1335736537000,N/A,1484,N/A,,N/A,[],people,people
N/A,good,average,good,0,19889041,0,,awesome,5,SOC101,"Kenny is a great, animated professor. It's unfortunate she has to read Brym's notes, with her own stuff she is easy to follow and well liked. She is funny and at the same time able to keep focus.",03/07/2012,2.0,2.0,,5,Really into it,5.0,5.0,1,Yes,1331141819000,N/A,1484,N/A,,N/A,[],people,people
N/A,poor,good,poor,0,19828979,0,,awful,1,SOC101,"She reads, literally, READS from a paper at lecture. Enough said. ",02/15/2012,5.0,5.0,,1,It's my life,1.0,1.0,1,No,1329319847000,N/A,1484,N/A,,N/A,[],people,people
N/A,average,average,average,0,19593111,0,,good,3,SOC220,"I absolutely loved this class and cannot say enough about Prof Kenny. The material was challenging at times but the lectures and assignments were creative and interesting. She really just wants you to learn, do well and take something away from the course. She's very witty and down to earth. Awesome!",12/21/2011,3.0,3.0,,4,It's my life,3.5,3.5,1,No,1324470970000,N/A,1484,N/A,,N/A,[],people,people
