attendance,clarityColor,easyColor,helpColor,helpCount,id,notHelpCount,onlineClass,quality,rClarity,rClass,rComments,rDate,rEasy,rEasyString,rErrorMsg,rHelpful,rInterest,rOverall,rOverallString,rStatus,rTextBookUse,rTimestamp,rWouldTakeAgain,sId,takenForCredit,teacher,teacherGrade,teacherRatingTags,unUsefulGrouping,usefulGrouping
Not Mandatory,good,good,good,0,29570740,0,,awesome,5,ECE552,Best and possibly funniest lecturer I've ever had.,02/15/2018,4.0,4.0,,5,N/A,5.0,5.0,1,No,1518736401000,Yes,1484,Yes,,N/A,"['Amazing lectures', 'Inspirational', 'Hilarious']",people,people
N/A,good,good,good,0,28739351,0,,awesome,5,ECE552,"Great prof, hard tests",10/12/2017,5.0,5.0,,5,N/A,5.0,5.0,1,No,1507848706000,Yes,1484,Yes,,N/A,[],people,people
N/A,good,average,good,0,22038330,0,,awesome,5,ECE243,"Very fun prof! And teaches very well. Many ppl from other sections ended up attending his lectures instead, so his lectures were always full. Luv him as a prof!",08/08/2013,2.0,2.0,,4,It's my life,4.5,4.5,1,Yes,1375993402000,N/A,1484,N/A,,N/A,[],people,people
N/A,good,poor,good,0,17617910,0,,awesome,5,ECE243,"Another hilarious prof. He knows his subject so well he made me and some other classmates wear party cones on our heads to explain the concept of a program counter. All I saw in class were cameras flashing.  He's very helpful too. Has too much passion for the course to see any of his students fail.  And did I mention the fact that he IS his own textbook lol. Not really though. But he wrote the online couse manual and revises it every year. Now, he recites his notes",09/28/2010,1.0,1.0,,5,It's my life,5.0,5.0,1,No,1285639438000,N/A,1484,N/A,,N/A,[],people,people
N/A,good,average,good,0,16822866,0,,awesome,5,ECE243,Best prof ever! Extremely patient and clear. Doesn't give up until you understand it :D,02/23/2010,2.0,2.0,,5,It's my life,5.0,5.0,1,No,1266884373000,N/A,1484,N/A,,N/A,[],people,people
N/A,good,poor,good,0,3641157,0,,awesome,5,ECE243,"very cute prof, jump...shift....lol~~~~good though",04/16/2005,1.0,1.0,,5,It's my life,5.0,5.0,1,N/A,1113652352000,N/A,1484,N/A,,N/A,[],people,people
N/A,good,average,good,0,3399313,0,,awesome,5,ECE243,"he is a good teacher he is very funny too",02/27/2005,3.0,3.0,,4,Low,4.5,4.5,1,N/A,1109510016000,N/A,1484,N/A,,N/A,[],people,people
N/A,good,average,good,0,3366273,0,,good,4,ECE243,"nothing wrong with him good professor",02/17/2005,2.0,2.0,,4,Really into it,4.0,4.0,1,N/A,1108609647000,N/A,1484,N/A,,N/A,[],people,people
Not Mandatory,poor,average,poor,1,2971864,5,,awful,1,DIGITAL,this guy was such a jerk.. he was rude when u didnt understand questions and very un available.Pretty****ty at teaching too..,12/10/2004,3.0,3.0,,1,It's my life,1.0,1.0,1,N/A,1102646227000,N/A,1484,N/A,,N/A,[],people,person
