attendance,clarityColor,easyColor,helpColor,helpCount,id,notHelpCount,onlineClass,quality,rClarity,rClass,rComments,rDate,rEasy,rEasyString,rErrorMsg,rHelpful,rInterest,rOverall,rOverallString,rStatus,rTextBookUse,rTimestamp,rWouldTakeAgain,sId,takenForCredit,teacher,teacherGrade,teacherRatingTags,unUsefulGrouping,usefulGrouping
N/A,good,average,good,0,17417357,0,,good,4,ENG307,"she's highly enthusiastic and passionate about the course, and material covered.",07/14/2010,3.0,3.0,,4,Really into it,4.0,4.0,1,Yes,1279067927000,N/A,1484,N/A,,N/A,[],people,people
N/A,good,average,good,0,16183716,0,,awesome,5,ENG306,The University of Toronto needs more Professor Lavoie's!!!,09/11/2009,2.0,2.0,,4,Sorta interested,4.5,4.5,1,Yes,1252674803000,N/A,1484,N/A,,N/A,[],people,people
N/A,good,average,good,0,16177819,0,,awesome,5,ENG306,"I love this professor. Can't wait until she gets tenure. She is extremely witty and extremely insightful into the material, especially poetry. Has the perfect balance between lecture and class participation. Her grading is fair and ensures that you have plenty of chances to gain easy marks. It was a pleasure to attend class every week.",09/08/2009,3.0,3.0,,5,Meh,5.0,5.0,1,Yes,1252414599000,N/A,1484,N/A,,N/A,[],people,people
N/A,good,good,good,0,16101336,0,,awesome,5,ENG307,I love her.,08/07/2009,5.0,5.0,,5,It's my life,5.0,5.0,1,Yes,1249658072000,N/A,1484,N/A,,N/A,[],people,people
N/A,good,good,good,0,16097544,0,,good,4,ENG307,"Took this as a summer course, if you are taking one course its a manageable course load, its a lot if you are doing more than one. Really need to attend class she tests on quotes and passages from the readings. You can find most of the poems studied online, so you don't need the anthology. Do the work and go to class its ok, not a bird course!",08/06/2009,4.0,4.0,,4,Low,4.0,4.0,1,Yes,1249566513000,N/A,1484,N/A,,N/A,[],people,people
N/A,good,average,good,0,16089896,1,,awesome,4,ENG307,"Professor Lavoie is _so_ kind and patient.  Three-hour lectures with her this summer flew by; she's never boring, really knows her stuff, and my writing improved because of her copious commentary on my writing journals, etc.  She was really accessible.  I know a lot of people who've taken every course they can get with her.",08/04/2009,3.0,3.0,,5,Really into it,4.5,4.5,1,Yes,1249376811000,N/A,1484,N/A,,N/A,[],person,people
N/A,good,good,good,0,15744633,0,,awesome,5,ENG306,"Hard marker, but her strict essay guidelines will essentially help you write better. Great lecturer. Lots of energy and a good sense of humor. She seems intimidating at first, but she is very approachable and friendly. Am I the only one who thought she was hot&#63;",05/01/2009,4.0,4.0,,4,Meh,4.5,4.5,1,Yes,1241173047000,N/A,1484,N/A,,N/A,[],people,people
N/A,good,good,good,0,15742747,0,,awesome,5,ENG306,"Really great professor.  Very knowledgeable and entertaining.  Excellent lecturer.  Very approachable.  Heavy reading list.  Tough marker, but excellent feedback.",04/30/2009,5.0,5.0,,5,Really into it,5.0,5.0,1,Yes,1241132772000,N/A,1484,N/A,,N/A,[],people,people
N/A,good,good,good,0,15729597,0,,awesome,5,ENG5101,"Tough class.  Lots of reading.  Excellent lecturer.  Very approachable.  Funny and nice.  Very hard marker, but I learned more from her than any other professor about writing a good essay.  Her comments and feedback on papers was very thorough.  I can now write a somewhat descent paper!!",04/29/2009,4.0,4.0,,5,Really into it,5.0,5.0,1,Yes,1241012919000,N/A,1484,N/A,,N/A,[],people,people
N/A,good,good,good,0,15485651,0,,awesome,4,ENG306,I don't know what these people are talking about.  How could anyone be nicer or more helpful to her students&#63;,02/24/2009,4.0,4.0,,5,It's my life,4.5,4.5,1,Yes,1235497831000,N/A,1484,N/A,,N/A,[],people,people
N/A,good,good,good,0,15256174,0,,awesome,5,ENG307,"She's condescending at times, but I enjoyed most of her lectures anyway. She is very intelligent and knowledgeable. Awkwardly, she would ask random questions about you on the sign-in sheet, which I didn't always want to answer. She's quirky I guess. I loved the reading material.",12/21/2008,4.0,4.0,,4,Meh,4.5,4.5,1,Yes,1229852604000,N/A,1484,N/A,,N/A,[],people,people
N/A,good,good,average,0,15113166,0,,average,5,ENG306,"worst prof i've ever had. ever. i don't care how &quot;funny&quot; or &quot;eloquent&quot; she is, i don't know what her problem is, she doesn't help anyone and is the hardest marker i've ever come by in U of T thus far. avoid at all costs.",12/05/2008,5.0,5.0,,1,Meh,3.0,3.0,1,Yes,1228479444000,N/A,1484,N/A,,N/A,[],people,people
N/A,good,good,good,0,14505215,0,,good,4,ENG322,"Lavoie is casual, humourous, and yet classy and eloquent. Although I had moments of frustration in the class because of the challenging readings, I left with a great appreciation for the depth of the texts and, overall, with a better understandings of the time period. Be prepared- this class requires close readings. The pay off is worthwhile.",05/21/2008,4.0,4.0,,4,Sorta interested,4.0,4.0,1,Yes,1211381522000,N/A,1484,N/A,,N/A,[],people,people
N/A,average,good,average,0,14499725,0,,good,3,ENG205,"Quirky but very interesting.  Gotta love an English prof. who uses 8 Mile to exemplify 18th c. literature.  Very approachable, but you've got to do the work (it seems so many people forget that aspect of university).",05/20/2008,4.0,4.0,,4,Really into it,3.5,3.5,1,Yes,1211293979000,N/A,1484,N/A,,N/A,[],people,people
N/A,average,average,average,0,14297364,0,,poor,3,ENG234H,Alright lecturer but not very nice to students. I emailed her about exam info because I missed class and the first word in her email was &quot;Annoying.&quot; Either tell me in an appropriate manner or don't tell me at all. Very rude and childish. Not approachable.,04/15/2008,3.0,3.0,,1,Sorta interested,2.0,2.0,1,No,1208291312000,N/A,1484,N/A,,N/A,[],people,people
N/A,good,average,good,0,13103020,0,,good,4,ENG306,"I liked that she brought in contemporary examples, but at times lectures were rather dry. I didn't like that she would read through an entire poem during class instead of lecturing about it. This made studding for the ID part of the exam difficult. She was friendly and helpful nonetheless. Did anyone else want to nominate her for what not to wear&#63;",05/03/2007,3.0,3.0,,4,Low,4.0,4.0,1,Yes,1178199783000,N/A,1484,N/A,,N/A,[],people,people
N/A,average,average,poor,0,12964738,0,,poor,2,ENG304,"Tried to get me out of her office as fast as possible and there wasnt even a line up outside. Told me to give up on being a lawyer, lectures were disorganized, always seemed frazzled, made an innapropriate comment about a serious illness.",04/02/2007,3.0,3.0,,1,Low,1.5,1.5,1,Yes,1175557396000,N/A,1484,N/A,,N/A,[],people,people
N/A,average,average,average,0,11713103,0,,average,3,ENG,okay,04/15/2006,3.0,3.0,,3,Sorta interested,3.0,3.0,1,N/A,1145132070000,N/A,1484,N/A,,N/A,[],people,people
N/A,good,average,good,0,10165756,0,,awesome,5,ENG3,"Professor Lavoie is approachable and pleasant.  She uses a lot of contemporary examples in her lectures and her classes are very organized.  She has a great sense of humor, which makes the learning environment very positive.  I always looked forward to her classes.",08/25/2005,2.0,2.0,,5,Sorta interested,5.0,5.0,1,N/A,1124988174000,N/A,1484,N/A,,N/A,[],people,people
N/A,good,average,good,0,2386479,0,,awesome,5,ENG204322,"Obviously loves what she does and cares about her students.  She was so good, I took a second class with her.  One of my all-time favorite profs.  She really knows her stuff.",08/12/2004,2.0,2.0,,5,N/A,5.0,5.0,1,N/A,1092353519000,N/A,1484,N/A,,N/A,[],people,people
N/A,average,average,average,0,797244,0,,average,3,ENG204,Meh.,04/07/2003,3.0,3.0,,3,N/A,3.0,3.0,1,N/A,1049694882000,N/A,1484,N/A,,N/A,[],people,people
N/A,good,average,good,0,640994,0,,awesome,5,ENG120,No Comments,02/26/2003,2.0,2.0,,5,N/A,5.0,5.0,1,N/A,1046285829000,N/A,1484,N/A,,N/A,[],people,people
N/A,good,average,good,0,464159,0,,awesome,4,ENG322,genuinely wants her students to learn; good sense of humour,12/28/2002,3.0,3.0,,5,N/A,4.5,4.5,1,N/A,1041094734000,N/A,1484,N/A,,N/A,[],people,people
N/A,good,average,good,0,195765,0,,awesome,5,ENG120,"intelectually stimulating lectures, very approachable, kind and helpful.",04/30/2002,2.0,2.0,,5,N/A,5.0,5.0,1,N/A,1020180656000,N/A,1484,N/A,,N/A,[],people,people
N/A,good,average,good,0,178048,0,,awesome,5,ENG322,Interesting lectures and great sense of humour!,04/15/2002,2.0,2.0,,5,N/A,5.0,5.0,1,N/A,1018914622000,N/A,1484,N/A,,N/A,[],people,people
N/A,good,average,good,0,162769,0,,awesome,5,ENG120,No Comments,04/05/2002,2.0,2.0,,5,N/A,5.0,5.0,1,N/A,1018030804000,N/A,1484,N/A,,N/A,[],people,people
N/A,good,average,good,0,146401,0,,awesome,4,ENG306,she's young so she's still enthusiastic about what she does!,03/24/2002,3.0,3.0,,5,N/A,4.5,4.5,1,N/A,1017000032000,N/A,1484,N/A,,N/A,[],people,people
N/A,good,good,good,0,66253,0,,awesome,5,ENG336,"Very sweet, very interesting lectures and she cares about the students.",12/04/2001,4.0,4.0,,4,N/A,4.5,4.5,1,N/A,1007507104000,N/A,1484,N/A,,N/A,[],people,people
