attendance,clarityColor,easyColor,helpColor,helpCount,id,notHelpCount,onlineClass,quality,rClarity,rClass,rComments,rDate,rEasy,rEasyString,rErrorMsg,rHelpful,rInterest,rOverall,rOverallString,rStatus,rTextBookUse,rTimestamp,rWouldTakeAgain,sId,takenForCredit,teacher,teacherGrade,teacherRatingTags,unUsefulGrouping,usefulGrouping
Not Mandatory,good,good,good,0,27971419,0,,awesome,5,ECE330,He is actually a good professor,03/30/2017,5.0,5.0,,5,N/A,5.0,5.0,1,Yes,1490889937000,Yes,1484,Yes,,Audit/No Grade,"['Respected', 'Tough grader']",people,people
N/A,good,good,good,0,21813935,0,,awesome,5,ENGL220,"Peter Herman is a world-class scholar, a brilliant man and an unparalleled writer. I'm lucky to have had this class; it's a wonder to have a course led by a luminary in their field. Take him.",05/22/2013,4.0,4.0,,5,Really into it,5.0,5.0,1,Yes,1369263813000,N/A,1484,N/A,,N/A,[],people,people
N/A,poor,good,poor,0,17798347,2,,awful,1,ECE110,"He is always late for lectures, and he sometimes forgets to bring his lecture notes. Sometimes, he comes back to the lecture room after searching for his notes, &quot;I lost my notes!&quot;. He confuses whatever you've learned so far. If you have him, you MUST avoid his lectures at all cost, even your balls.",11/20/2010,5.0,5.0,,1,Meh,1.0,1.0,3,Yes,1290283136000,N/A,1484,N/A,,N/A,[],people,people
N/A,good,average,good,0,15063573,0,,good,5,PSYCHPSYC,"This man is very intelligent. I loved coming to class just to listen to him speak; his sense of humour here and there also made the lectures more enjoyable. Although his test questions weren't always fair and I didn't do too well, I loved this course!",11/25/2008,3.0,3.0,,3,Really into it,4.0,4.0,1,Yes,1227653184000,N/A,1484,N/A,,N/A,[],people,people
N/A,average,good,average,0,10033112,0,,average,3,ECE330,"This guy is just there to collect a paycheck, he doesn't care about the students and he shows up late to his own tests.",07/17/2005,4.0,4.0,,2,Sorta interested,2.5,2.5,3,N/A,1121559370000,N/A,1484,N/A,,N/A,[],people,people
N/A,good,good,good,0,3561752,0,,awesome,5,PSY309,Inspiring prof. There needs to be more Professors like Herman.,04/05/2005,4.0,4.0,,5,It's my life,5.0,5.0,1,N/A,1112713161000,N/A,1484,N/A,,N/A,[],people,people
N/A,good,average,average,0,1182602,0,,good,5,PSYC,"If you listen carefully enough, you'll find that he actually has a wicked sense of humour! Plus, he knows what he's talking about. Now if he could only work on that personality of his...",10/10/2003,2.0,2.0,,2,N/A,3.5,3.5,1,N/A,1065820375000,N/A,1484,N/A,,N/A,[],people,people
N/A,good,average,good,0,1001769,0,,awesome,5,PSY309,Good sense of (dry) humour. Very cynical yet very warm and caring when it comes to his students.,06/05/2003,2.0,2.0,,5,N/A,5.0,5.0,1,N/A,1054849899000,N/A,1484,N/A,,N/A,[],people,people
N/A,good,average,good,0,110414,0,,awesome,5,PSY309,No Comments,02/12/2002,2.0,2.0,,5,N/A,5.0,5.0,1,N/A,1013491202000,N/A,1484,N/A,,N/A,[],people,people
