attendance,clarityColor,easyColor,helpColor,helpCount,id,notHelpCount,onlineClass,quality,rClarity,rClass,rComments,rDate,rEasy,rEasyString,rErrorMsg,rHelpful,rInterest,rOverall,rOverallString,rStatus,rTextBookUse,rTimestamp,rWouldTakeAgain,sId,takenForCredit,teacher,teacherGrade,teacherRatingTags,unUsefulGrouping,usefulGrouping
Not Mandatory,good,average,good,0,31290904,0,,awesome,5,ENV222H,He's nice,01/22/2019,3.0,3.0,,5,N/A,5.0,5.0,1,Yes,1548178562000,Yes,1484,Yes,,B,"['Gives good feedback', 'Inspirational', 'Respected']",people,people
N/A,good,average,good,4,28047849,2,,awesome,5,GGR341H,"He's a kind and caring prof. Very knowledgeable and makes an attempt to learn everyone's name (in a class of 50+, that's an impressive feat). The course was very interesting and I learned a lot about Latin America--course topics are also very diverse, which means a little bit for everyone. However, lectures can get a bit boring and monotone.",04/13/2017,3.0,3.0,,5,N/A,5.0,5.0,1,No,1492111852000,Yes,1484,N/A,,N/A,"['Accessible outside class', 'Lecture heavy']",people,people
N/A,average,average,good,0,22705766,0,,good,3,ENV223,"The lecture is quite dry and he does indeed use many examples from his own work to illustrate concepts. However, the group work is valuable and he is helpful during the process.",01/06/2014,2.0,2.0,,5,Sorta interested,4.0,4.0,1,No,1389024289000,N/A,1484,N/A,,N/A,[],people,people
Not Mandatory,average,average,poor,0,22433632,3,,poor,2,ENV223,"most useless course ever. prof is way over enthusiastic, the class is more like a verbal biography of his past jobs in  amazon and mexico that no one is interested in.",12/04/2013,3.0,3.0,,1,It's my life,1.5,1.5,1,No,1386172763000,N/A,1484,N/A,,N/A,[],people,people
N/A,good,average,average,0,20619928,0,,good,4,JGE321,"A nice man who is genuinely interested in other students' opinions. But, there's too much of an emphasis on readings and doesn't hand back assignments until end of term.",08/31/2012,3.0,3.0,,3,It's my life,3.5,3.5,1,Yes,1346407147000,N/A,1484,N/A,,N/A,[],people,people
N/A,average,average,average,0,19748930,0,,good,3,ENV222H,"This professor was awesome! He makes an extra effort to get to know his students, which I have never had before!  Attendance isn't mandatory, but if he knows you, and sees you in class, then your mark will most likely be MUCH higher than those that don't attend.  Just saying...",01/19/2012,2.0,2.0,,4,It's my life,3.5,3.5,1,No,1326991987000,N/A,1484,N/A,,N/A,[],people,people
N/A,good,poor,good,0,19506200,0,,awesome,5,ENV223,"Professor Abizaid was an awesome professor! He actually took the time to learn the names of everyone in our class, which I have never seen before. Very entertaining and passionate about his work, and very easy to talk to. Some of the projects can be a pain, but they are alot more unique and easy than anything from any other class. Highly recommend!",12/14/2011,1.0,1.0,,4,Low,4.5,4.5,1,No,1323874877000,N/A,1484,N/A,,N/A,[],people,people
