attendance,clarityColor,easyColor,helpColor,helpCount,id,notHelpCount,onlineClass,quality,rClarity,rClass,rComments,rDate,rEasy,rEasyString,rErrorMsg,rHelpful,rInterest,rOverall,rOverallString,rStatus,rTextBookUse,rTimestamp,rWouldTakeAgain,sId,takenForCredit,teacher,teacherGrade,teacherRatingTags,unUsefulGrouping,usefulGrouping
N/A,good,average,good,2,31194282,0,,awesome,5,VPHA46H3,"I actually find her quite easy but also very intellectually stimulating! For those who said her teaching was unclear, go ask her questions! Her study guide was very clear and arranged corresponding to the lecture slides! If you've been to classes you should've known the study guide quite well. Easiest final, only multiple choices, got full marks!",01/03/2019,2.0,2.0,,5,N/A,5.0,5.0,1,No,1546535296000,Yes,4919,Yes,,A+,"['Respected', 'Accessible outside class', 'Inspirational']",people,people
N/A,poor,good,poor,1,31051098,2,,awful,1,VPHA46,"Horrible teacher. I've been to every lecture and I've tried to write notes but couldn't because I literally don't know what is being taught. Lots of readings. Didn't post final study guide until a week after school ended, and didn't return marked essays on time. Half the material on the study guide I never even heard of. Just hoping to pass now.",12/16/2018,4.0,4.0,,1,N/A,1.0,1.0,1,No,1544948089000,No,4919,Yes,,N/A,['Get ready to read'],people,person
Mandatory,good,good,good,1,27733467,0,,good,4,VPHA46H3,"Professor Gu is a fair professor, you have to work hard to earn good grades. She is very approachable and helpful. She is caring and attending to students' needs. Her lecture is interesting and hilarious.",01/15/2017,4.0,4.0,,4,N/A,4.0,4.0,1,No,1484484140000,Yes,4919,Yes,,B,"[""Skip class? You won't pass."", 'Tough grader', 'Get ready to read']",people,person
Mandatory,poor,average,poor,2,27255099,0,,awful,1,VPHA46,"She's terrible at giving you instructions, her lectures are always all over the place such as jumping to topic to topic and she gives out too much readings each week.",11/26/2016,3.0,3.0,,1,N/A,1.0,1.0,1,No,1480125899000,No,4919,Yes,,F,"[""Skip class? You won't pass."", 'Tough grader', 'Get ready to read']",people,people
Mandatory,good,good,good,0,27182604,1,,good,4,VPHA46H3,Great choice for an elective,11/14/2016,4.0,4.0,,4,N/A,4.0,4.0,1,Yes,1479138220000,Yes,4919,Yes,,Not sure yet,"['Beware of pop quizzes', 'Tough grader', 'Get ready to read']",person,people
