attendance,clarityColor,easyColor,helpColor,helpCount,id,notHelpCount,onlineClass,quality,rClarity,rClass,rComments,rDate,rEasy,rEasyString,rErrorMsg,rHelpful,rInterest,rOverall,rOverallString,rStatus,rTextBookUse,rTimestamp,rWouldTakeAgain,sId,takenForCredit,teacher,teacherGrade,teacherRatingTags,unUsefulGrouping,usefulGrouping
Mandatory,good,good,good,0,30301378,0,,awesome,5,HLTB16H3F,"Dr. Brown is an excellent professor. She knows EXACTLY what she is talking about and expects a lot from her students. You HAVE to memorize everything to do well in her courses. The assignments are extremely easy IF you follow the rubric she gives. Testing is tough if you don't memorize details. However, it is possible to do well - WORK ETHIC.",06/27/2018,4.0,4.0,,5,N/A,5.0,5.0,1,No,1530107979000,Yes,4919,Yes,,A+,"['Lecture heavy', 'Clear grading criteria', 'Gives good feedback']",people,people
Mandatory,average,good,average,0,29144610,0,,poor,2,HLTB16,Detailed questions in exam!,12/12/2017,4.0,4.0,,2,N/A,2.0,2.0,1,No,1513037935000,No,4919,N/A,,N/A,"[""Skip class? You won't pass."", 'Lecture heavy']",people,people
N/A,good,average,good,0,29017093,0,,awesome,5,HLTB16,"Amazing lectures, clear content and articulation of material. Would definitely take a class with this prof again! :)",12/01/2017,3.0,3.0,,5,N/A,5.0,5.0,1,Yes,1512170492000,Yes,4919,Yes,,B+,"['Amazing lectures', 'Caring', 'Clear grading criteria']",people,people
Mandatory,good,average,good,0,28157683,1,,awesome,5,HLTB16,"Had her for HLTB16 and ANTC67. Assignment instructions and rubrics are clear. She does leave some slides blank so you do need to attend lectures. Exams are pretty specific but most of the short answers are like definitions/models, etc. She isn't funny or anything but I really enjoyed her courses. Study hard? EASY A!! Study only a bit? EASY B!! :)",04/28/2017,3.0,3.0,,5,N/A,5.0,5.0,1,No,1493421278000,Yes,4919,Yes,,N/A,"['Clear grading criteria', ""Skip class? You won't pass."", 'Caring']",person,people
Mandatory,good,good,good,0,27988425,0,,good,4,HLTB16,Attend lectures and take notes and you can easily get good grades.  Good rubrics are provided for both assignments.,04/03/2017,4.0,4.0,,4,N/A,4.0,4.0,1,No,1491252016000,Yes,4919,Yes,,N/A,"['Amazing lectures', 'Clear grading criteria', ""Skip class? You won't pass.""]",people,people
Mandatory,good,average,good,1,27916866,0,,awesome,5,HLTB16,Best prof I've ever had,03/17/2017,3.0,3.0,,5,N/A,5.0,5.0,1,No,1489760563000,Yes,4919,Yes,,N/A,"['Clear grading criteria', 'Amazing lectures', 'Accessible outside class']",people,person
Mandatory,good,average,good,0,27913274,0,,awesome,5,HLTB16,"She is very explicit in describing what she wants for assignments, the rubric tells you exactly how to do well. There is a decent amount of content but if you study there is no way you can fail her exams. She uses multiple types of questions so everyone has an opportunity to do well, m/c, short answer, long answer. She is tough but very fair.",03/16/2017,3.0,3.0,,5,N/A,5.0,5.0,1,No,1489669019000,Yes,4919,Yes,,A,"['Accessible outside class', 'Caring', 'Clear grading criteria']",people,people
Mandatory,poor,good,poor,2,27285164,1,,awful,1,ANTC67,"You have two major assignments.  You must attend class because she leaves some of the slides blank.  The midterm was tricky, her questions are very specific and details matter.   Midterm includes: Multiple choice, true false, short answer, AND equations.",11/30/2016,4.0,4.0,,1,N/A,1.0,1.0,1,Yes,1480509214000,No,4919,Yes,,Not sure yet,"['Tough grader', 'Lots of homework', 'Get ready to read']",person,people
Mandatory,poor,average,poor,1,27018098,2,,awful,1,ANTC67,Monotonous. Dull lectures.,10/06/2016,3.0,3.0,,1,N/A,1.0,1.0,1,Yes,1475764267000,No,4919,N/A,,Not sure yet,"[""Skip class? You won't pass."", 'Get ready to read']",people,person
