attendance,clarityColor,easyColor,helpColor,helpCount,id,notHelpCount,onlineClass,quality,rClarity,rClass,rComments,rDate,rEasy,rEasyString,rErrorMsg,rHelpful,rInterest,rOverall,rOverallString,rStatus,rTextBookUse,rTimestamp,rWouldTakeAgain,sId,takenForCredit,teacher,teacherGrade,teacherRatingTags,unUsefulGrouping,usefulGrouping
N/A,good,average,good,0,19059978,0,,awesome,4,LINC01,"Incredible teacher. I took phonetics around 5 times downtown but I didn't get it. It was 5 different profs teaching it and they all sucked. I got it the first time with her and because of her, I was able to finish my program with the other two courses required! I rank her as the FIRST prof I actually like and go back to.",10/11/2011,3.0,3.0,,5,Really into it,4.5,4.5,1,Yes,1318298974000,N/A,4919,N/A,,N/A,[],people,people
N/A,good,poor,good,0,18306616,0,,awesome,4,LINB09,"The material is straightforward. The assignments are based straight from lecture notes which is posted in advance to the class. As long as you can do her practise midterms and finals which she provides, the exam will be a breeze.",03/24/2011,1.0,1.0,,5,Really into it,4.5,4.5,1,No,1300933664000,N/A,4919,N/A,,N/A,[],people,people
N/A,good,good,good,0,17893807,0,,awesome,4,LINC,"No doubt the course material is tough, but this is a C level course afterall. I like how she is very organized and prepared for class. A great professor, and she replies to emails and answers your questions when you need her. GREAT PROF!!!",12/09/2010,4.0,4.0,,5,Really into it,4.5,4.5,1,No,1291866507000,N/A,4919,N/A,,N/A,[],people,people
N/A,average,average,average,1,14585217,0,,average,3,LINA01,The book was kind of dry..I found it very difficult to stay awake during her lectures. She had a difficult time controlling the class and would have to stop every two mintues to make everyone shut up. At time we didnt get breaks which made the class even more difficult to sit through. Barely took any notes in the class.,06/15/2008,3.0,3.0,,3,Low,3.0,3.0,1,Yes,1213537013000,N/A,4919,N/A,,N/A,[],people,person
N/A,poor,good,poor,1,13596853,1,,poor,1,LINA01,No Comments,11/04/2007,4.0,4.0,,2,Meh,1.5,1.5,1,Yes,1194216550000,N/A,4919,N/A,,N/A,[],person,person
N/A,average,average,good,0,12615344,0,,good,3,LINB04,"The only prof I've ever come across with INCREDIBLY detailed class notes. I never took notes, only wrote down a couple of examples on the notes she posted. The class itself is a bore, but she's really helpful if you need it.",12/15/2006,2.0,2.0,,5,Really into it,4.0,4.0,1,No,1166192701000,N/A,4919,N/A,,N/A,[],people,people
