attendance,clarityColor,easyColor,helpColor,helpCount,id,notHelpCount,onlineClass,quality,rClarity,rClass,rComments,rDate,rEasy,rEasyString,rErrorMsg,rHelpful,rInterest,rOverall,rOverallString,rStatus,rTextBookUse,rTimestamp,rWouldTakeAgain,sId,takenForCredit,teacher,teacherGrade,teacherRatingTags,unUsefulGrouping,usefulGrouping
N/A,average,average,average,8,28900932,2,,poor,2,BIOC32,"Easy course material but very poor lecturer. The midterm was easy, just poorly organized (which made it harder for students to understand). If you ignored everything she said in lecture, you would do well (she contradicts herself A LOT).",11/15/2017,3.0,3.0,,2,N/A,2.0,2.0,1,No,1510707601000,No,4919,Yes,,N/A,['Get ready to read'],people,people
Mandatory,poor,average,poor,22,28816178,2,,awful,1,BIOC32,She's just high 95% of the time . she tests on stuff she says she wouldn't test on.,11/01/2017,3.0,3.0,,1,N/A,1.0,1.0,1,No,1509554824000,No,4919,Yes,,N/A,"[""Skip class? You won't pass.""]",people,people
Mandatory,poor,good,poor,9,28778275,3,,awful,1,BIOD65,"worst professor, extremely rude and condescending. At all costs please avoid her class, whatever you do, do not under any circumstance take her class",10/24/2017,5.0,5.0,,1,N/A,1.0,1.0,1,No,1508860367000,No,4919,N/A,,N/A,"['Participation matters', 'Tough grader', ""Skip class? You won't pass.""]",people,people
Mandatory,poor,good,poor,8,28748357,2,,awful,1,BIOC32,She did not stay after class to help me with my assignment. I did not feel that she looked out for the students' concerns.,10/16/2017,5.0,5.0,,1,N/A,1.0,1.0,1,Yes,1508175878000,No,4919,Yes,,N/A,"['Tough grader', 'So many papers', 'Test heavy']",people,people
Not Mandatory,poor,good,poor,9,28748087,2,,awful,1,BIOC32,"Awful! She has no respect for students. If you take her class, beware of her attitude while approaching her. She also has no care for putting effort into what she teaches.",10/16/2017,5.0,5.0,,1,N/A,1.0,1.0,1,Yes,1508171950000,No,4919,Yes,,N/A,"['Test heavy', 'Tough grader', 'Get ready to read']",people,people
Mandatory,average,average,average,4,28665947,5,,average,3,BIOC32,She is monotone but the course information is easy to understand and learn. Putting in the work of studying her lectures thoroughly will get you a 4.0.,09/08/2017,3.0,3.0,,3,N/A,3.0,3.0,1,No,1504910382000,Yes,4919,Yes,,A-,['Lecture heavy'],people,people
