attendance,clarityColor,easyColor,helpColor,helpCount,id,notHelpCount,onlineClass,quality,rClarity,rClass,rComments,rDate,rEasy,rEasyString,rErrorMsg,rHelpful,rInterest,rOverall,rOverallString,rStatus,rTextBookUse,rTimestamp,rWouldTakeAgain,sId,takenForCredit,teacher,teacherGrade,teacherRatingTags,unUsefulGrouping,usefulGrouping
Not Mandatory,poor,good,poor,0,23630523,2,,awful,1,MGED02,"You can say he is passionate and funny, he is not like those boring old-style professors. But the most important thing is not being funny for an instructor,  he really need to make his lecture more clear and organized instead of telling jokes",10/05/2014,5.0,5.0,,1,Meh,1.0,1.0,1,No,1412515053000,N/A,4919,Yes,,N/A,['Tough grader'],people,people
Not Mandatory,good,poor,good,0,23011823,0,,good,4,MGEC02,"He is very enthusiastic. Though the material is a bit dull, his teaching is never boring.",04/09/2014,1.0,1.0,,4,Really into it,4.0,4.0,1,No,1397045713000,N/A,4919,N/A,,N/A,[],people,people
Mandatory,good,average,good,0,22487056,0,,awesome,4,MGEC02,"Campbell is an AMAZING professor. He's young, passionate and knows what he's talking about. Problem sets are a must. Not a very math heavy course, more conceptual. The midterm was pretty hard but the final exam was really easy (probably because of the low class avg). Great guy. I would take this course again. Highly recommended!",12/10/2013,2.0,2.0,,5,Sorta interested,4.5,4.5,1,No,1386639366000,N/A,4919,N/A,,A+,[],people,people
N/A,good,poor,good,0,21989078,0,,awesome,5,ECMC02,"If not the best, one of the best profs I've ever had. Very intellectually stimulating. All his exams are based on problems sets. You just need to divide each weeks problems sets into pieces. Textbook not required. Highly recommended.",07/23/2013,1.0,1.0,,5,It's my life,5.0,5.0,1,No,1374538223000,N/A,4919,N/A,,N/A,[],people,people
N/A,good,poor,good,0,21877535,0,,awesome,5,ECMC02,"Clearly one of the best professors at UTSC. His exams were very fair (I don't know what these guys below were talking about), lectures extremely interesting and intellectually stimulating. Easily one of the most fun Econ class I've taken at this school.",06/09/2013,1.0,1.0,,5,It's my life,5.0,5.0,1,No,1370805250000,N/A,4919,N/A,,N/A,[],people,people
N/A,good,average,good,0,21761418,0,,awesome,5,ECMC02,"Prof.Campbell is one of the best economics professors at UTSC. The problem sets he posted were very helpful and the exams were tricky, but not killers. I would say if you studied the lecture notes and did all the problem sets, it's very easy to get a B+ or above in his class. At least he doesn't surprise you like most of the other profs at UTSC.",05/14/2013,3.0,3.0,,4,Really into it,4.5,4.5,1,No,1368571792000,N/A,4919,N/A,,N/A,[],people,people
N/A,poor,good,poor,0,21621231,0,,awful,1,ECMC02,His English accent is so confusing and I did not like his teaching style at all. He explained the concept poorly and his office hours are useless.He did not give things on the past exam that is why I only got 60 in the midterm. I am so scared of finals.,04/28/2013,5.0,5.0,,1,Really into it,1.0,1.0,1,No,1367151152000,N/A,4919,N/A,,N/A,[],people,people
N/A,average,good,average,0,21614884,0,,average,2,ECMC02,"He's a nice prof but his problem sets are too long and there is little to no idea what he's going to put on the exam. He posts past exams but this term his midterm was nothing like the past exams, the course material is easy if the person teaching could teach better",04/26/2013,4.0,4.0,,3,Low,2.5,2.5,1,No,1367004179000,N/A,4919,N/A,,N/A,[],people,people
