attendance,clarityColor,easyColor,helpColor,helpCount,id,notHelpCount,onlineClass,quality,rClarity,rClass,rComments,rDate,rEasy,rEasyString,rErrorMsg,rHelpful,rInterest,rOverall,rOverallString,rStatus,rTextBookUse,rTimestamp,rWouldTakeAgain,sId,takenForCredit,teacher,teacherGrade,teacherRatingTags,unUsefulGrouping,usefulGrouping
N/A,good,average,good,0,20438948,0,,awesome,5,PSYC08,One of the best TAs I have ever had. I had her for both PSYB07 and PSYC08. Gelareh is very nice and approachable and always takes the time to help the students. She is very good at explaining difficult stats concepts and I found her marking to be easy and very fair. I switched from another tutorial to be in her section.,06/24/2012,2.0,2.0,,5,Sorta interested,5.0,5.0,1,Yes,1340542188000,N/A,4919,N/A,,N/A,[],people,people
N/A,good,good,good,0,20416005,0,,good,4,PSYC08,"Had Gelareh as a TA for PSYC08, she's easy on the eyes but a HARD MARKER!",06/15/2012,5.0,5.0,,4,Really into it,4.0,4.0,1,Yes,1339791691000,N/A,4919,N/A,,N/A,[],people,people
N/A,good,average,good,0,18934402,0,,awesome,5,PSYD50,This class unexpectedly turned out one of the best for me! I really like how she incorporated the lifespan approach to this course; this class was the first one that got me genuinly interested in journal articles and cognitive psychology; I really like her approach and her personality. Highly recommend!,08/19/2011,3.0,3.0,,5,Low,5.0,5.0,1,Yes,1313776243000,N/A,4919,N/A,,N/A,[],people,people
N/A,good,average,good,0,18934401,0,,awesome,5,PSYD50,This class unexpectedly turned out one of the best for me! I really like how she incorporated the lifespan approach to this course; this class was the first one that got me genuinly interested in journal articles and cognitive psychology; I really like her approach and her personality. Highly recommend!,08/19/2011,3.0,3.0,,5,Low,5.0,5.0,1,Yes,1313776243000,N/A,4919,N/A,,N/A,[],people,people
N/A,good,average,good,0,18891141,0,,awesome,5,PSYC50D,"Prof Gelios J.owskar is very kind, caring toward the students.. easy marker and very helpful.. love her classess.. Hot appearance and highly recommend taking her classess.",08/07/2011,2.0,2.0,,5,It's my life,5.0,5.0,1,Yes,1312715598000,N/A,4919,N/A,,N/A,[],people,people
N/A,good,average,good,0,18850449,0,,awesome,5,PSYD50,"Prof.Jowkar-Baniani is always helpful and considerate. She explains complicated concepts clearly and effectively. Her enthusiasm makes the learning experience very meaningful. Although she's not a easy marker, she is clear on how you can improve your work. One of the most caring professors in UTSC.",07/25/2011,3.0,3.0,,5,Really into it,5.0,5.0,1,Yes,1311637187000,N/A,4919,N/A,,N/A,[],people,people
