attendance,clarityColor,easyColor,helpColor,helpCount,id,notHelpCount,onlineClass,quality,rClarity,rClass,rComments,rDate,rEasy,rEasyString,rErrorMsg,rHelpful,rInterest,rOverall,rOverallString,rStatus,rTextBookUse,rTimestamp,rWouldTakeAgain,sId,takenForCredit,teacher,teacherGrade,teacherRatingTags,unUsefulGrouping,usefulGrouping
N/A,good,average,good,0,17558466,0,,awesome,5,BIOB32,"She is one of the BEST, BEST, BEST professors at UTSC! Too bad she can't teach more courses! We want her here, not at another school! If you want a helpful, smart and a compassionate prof, than take courses she teaches. She is fair and class averages are good! LOVE HER!!!! Take her classes you won't be disappointed!",08/29/2010,2.0,2.0,,5,It's my life,5.0,5.0,1,Yes,1283089565000,N/A,4919,N/A,,N/A,[],people,people
N/A,good,average,good,0,17280657,0,,awesome,5,BIOB32,Very passionate and enthusiastic about teaching subject matter at hand. Explains concepts and ideas very clearly. She goes out of her way to make sure the students know what is expectd of them. She develops the critical thinking skills patiently that students need in University and also teaches how best to articulate answers to test questions,05/28/2010,3.0,3.0,,5,Really into it,5.0,5.0,1,Yes,1275062822000,N/A,4919,N/A,,N/A,[],people,people
N/A,good,average,good,0,15095510,0,,awesome,5,BGYB30,"THE MOST AMAZING FROM THAT I&quot;VE EVER HAD IN UTSC!!! She's AWESOME!!! She cares about her students. A very good prof. I would take every course she teaches, even if I didn't have to.",12/03/2008,2.0,2.0,,5,It's my life,5.0,5.0,1,Yes,1228319148000,N/A,4919,N/A,,N/A,[],people,people
N/A,average,good,average,0,14478041,0,,average,2,BGYB32,"Very enthusiastic and passionate. I smiled and laughed a lot in class, but I didn't actually learn much concrete information. Very inconsistent and cryptic test questions; everyone does &quot;OK,&quot; but it's hard to get a really good mark.",05/15/2008,4.0,4.0,,3,It's my life,2.5,2.5,1,Yes,1210885448000,N/A,4919,N/A,,N/A,[],people,people
N/A,good,average,good,0,14282519,0,,awesome,5,BGYB30,"Awesome prof! Really cares about her students. Goes to show how important teaching is to her. Uses videos, hands-on tools and anecdotes to make topics clearer. She should teach more upper-year Neuro classes in the future. :D",04/12/2008,2.0,2.0,,5,Really into it,5.0,5.0,1,Yes,1208031515000,N/A,4919,N/A,,N/A,[],people,people
N/A,good,good,good,0,13401035,0,,awesome,4,BGYB30,No Comments,08/12/2007,4.0,4.0,,5,Sorta interested,4.5,4.5,1,Yes,1186961608000,N/A,4919,N/A,,N/A,[],people,people
