attendance,clarityColor,easyColor,helpColor,helpCount,id,notHelpCount,onlineClass,quality,rClarity,rClass,rComments,rDate,rEasy,rEasyString,rErrorMsg,rHelpful,rInterest,rOverall,rOverallString,rStatus,rTextBookUse,rTimestamp,rWouldTakeAgain,sId,takenForCredit,teacher,teacherGrade,teacherRatingTags,unUsefulGrouping,usefulGrouping
Not Mandatory,good,average,good,0,30359017,0,,good,4,CSCB09,"Bianca is a solid teacher who is very friendly and caring. We had inverted class where you do worksheets and can ask her questions in real time. Her assignments were cut up in phases such that by the end you would have a cool C application you can use. She made PCRS worth 10% for us!!! Her midterm was bit tough, but final was easy with cheat-sheet.",07/19/2018,3.0,3.0,,4,N/A,4.0,4.0,1,No,1532043246000,Yes,4919,Yes,,A+,"['Caring', 'EXTRA CREDIT', 'Gives good feedback']",people,people
N/A,good,average,good,1,28019681,1,,awesome,5,CSCB09,GAVE ME A 90 ON A2,04/09/2017,3.0,3.0,,5,N/A,5.0,5.0,1,No,1491753796000,Yes,4919,Yes,,N/A,['Caring'],person,person
Not Mandatory,good,average,good,0,28017518,0,,awesome,5,CSCB09,"Nicest prof I've ever had so far. To do well in this course going to class will help, but doing, and understanding the weekly PCRS/Labs perfectly is where the majority of your marks will come from. All the marks you will earn from assignments and exams will be directly correlated to the PCRS.",04/08/2017,3.0,3.0,,5,N/A,5.0,5.0,1,No,1491675262000,Yes,4919,Yes,,N/A,"['Lots of homework', 'Gives good feedback', 'Caring']",people,people
Not Mandatory,good,average,good,0,28016853,0,,awesome,5,CSCB09,"She's a very nice comp sci prof, and gives very fair exams.",04/08/2017,3.0,3.0,,5,N/A,5.0,5.0,1,No,1491661962000,Yes,4919,Yes,,N/A,"['Gives good feedback', 'Respected', 'Caring']",people,people
Mandatory,good,good,good,1,27897852,0,,awesome,5,CSCB09,Very good in explaining concepts but gives assignments that are a bit tricky.,03/10/2017,4.0,4.0,,5,N/A,5.0,5.0,1,No,1489176618000,Yes,4919,Yes,,N/A,"['Accessible outside class', ""Skip class? You won't pass."", 'Tough grader']",people,person
