attendance,clarityColor,easyColor,helpColor,helpCount,id,notHelpCount,onlineClass,quality,rClarity,rClass,rComments,rDate,rEasy,rEasyString,rErrorMsg,rHelpful,rInterest,rOverall,rOverallString,rStatus,rTextBookUse,rTimestamp,rWouldTakeAgain,sId,takenForCredit,teacher,teacherGrade,teacherRatingTags,unUsefulGrouping,usefulGrouping
Mandatory,poor,good,poor,0,26252566,0,,awful,1,BIOB32,"Very unorganized labs, unclear grading meaning they want things done in a certain way no part marks, explanations are very unclear.",04/07/2016,5.0,5.0,,1,N/A,1.0,1.0,1,No,1460055254000,N/A,4919,Yes,,N/A,"['Participation matters', 'Tough grader']",people,people
Mandatory,poor,good,poor,1,26162151,0,online,awful,1,BIOB32,"Does not explain anything clearly, and labs were very messy, everyone didn't know what to do, TAs don't explain anything, you show up for your lab and you just start.",03/20/2016,5.0,5.0,,1,Meh,1.0,1.0,1,Yes,1458488167000,N/A,4919,Yes,,N/A,[],people,person
Mandatory,good,good,good,0,26136248,1,,good,4,BIOB32,This teacher inspired me to become the best I could. I changed my major so I could take another course from this professor. I got an A- but I still recommend the course.,03/11/2016,4.0,4.0,,4,Sorta interested,4.0,4.0,1,Yes,1457730548000,N/A,4919,Yes,,A-,"['Tough grader', 'So many papers', 'Gives good feedback']",person,people
Mandatory,average,good,average,5,25319475,1,,good,2,BIOB32BIOD43,"Record lectures, talks really fast. Over-complicates concepts. MC/SA on exam are weirdly-worded as well. Best advice is to grab a study partner to talk about the different concepts so you can apply them to the exam (75% application). Material VERY interesting. No textbook, all on slides, and what he says describes the diagrams on the slides.",11/01/2015,4.0,4.0,,5,It's my life,3.5,3.5,1,No,1446380344000,N/A,4919,Yes,,A+,"[""Skip class? You won't pass."", 'Lecture heavy', 'Tough grader']",person,people
Mandatory,poor,good,average,2,25086128,1,,average,1,BIOD43,"He's a nice guy but he makes things more complicated then it really is. RECORD lectures, he talks way too fast and half the time you probably don't understand what's going on. AssignmentsQuizzes are easy A's, but the midtermfinal are tough. He cares about the students and makes adjustments to grades if everyone did bad.",08/02/2015,4.0,4.0,,4,It's my life,2.5,2.5,1,No,1438537492000,N/A,4919,Yes,,A+,"['Lecture heavy', 'Tough grader', ""Skip class? You won't pass.""]",person,people
N/A,average,good,poor,2,21417787,1,,poor,2,BIOB32,Very unclear and unapproachable. He doesn't make it possible for students to achieve high marks in his class. The labs are unprganized and difficult to follow making it hard to complete the lab assignment.,03/17/2013,5.0,5.0,,1,Low,1.5,1.5,1,No,1363487097000,N/A,4919,N/A,,N/A,[],person,people
N/A,average,good,average,0,20206038,0,,poor,2,B1,Had more slides than per minute available in a lecture. Classes always felt rushed. Doesn't engage the students into the lecture. Nice professor but seriously needs to somehow get the class time increased to at least 2hrs a week so information is manageable.,05/05/2012,4.0,4.0,,2,Low,2.0,2.0,1,No,1336251111000,N/A,4919,N/A,,N/A,[],people,people
N/A,average,good,average,1,20106026,1,,average,2,BIOD43,"Prof. Welch is a very nice guy, but just isn't very good at making complex concepts accessible to students. He makes things hard to understand and is unclear about concepts. However, he is approachable and definitely has students' best interests in mind.",04/24/2012,4.0,4.0,,3,Really into it,2.5,2.5,1,No,1335225627000,N/A,4919,N/A,,N/A,[],person,person
N/A,good,average,average,0,18361401,1,,good,4,BIOB32,"very approachable and friendly, and is a great teacher. Huge improvement from previous profs who have taught this course",04/05/2011,3.0,3.0,,3,Sorta interested,3.5,3.5,1,Yes,1302033460000,N/A,4919,N/A,,N/A,[],person,people
