attendance,clarityColor,easyColor,helpColor,helpCount,id,notHelpCount,onlineClass,quality,rClarity,rClass,rComments,rDate,rEasy,rEasyString,rErrorMsg,rHelpful,rInterest,rOverall,rOverallString,rStatus,rTextBookUse,rTimestamp,rWouldTakeAgain,sId,takenForCredit,teacher,teacherGrade,teacherRatingTags,unUsefulGrouping,usefulGrouping
N/A,good,poor,good,0,19305232,0,,awesome,5,CHMB1,Great teacher! Very helpful. Made orgo worth taking!,11/23/2011,1.0,1.0,,5,It's my life,5.0,5.0,1,Yes,1322063308000,N/A,4919,N/A,,N/A,[],people,people
N/A,good,average,good,0,13071571,0,,awesome,5,CHMB41,Prof potter is one of the best teachers I encountered for chemistry.her lectures are important and the textbook was extremely useful.She really proved organic chemistry is not hard,04/27/2007,3.0,3.0,,4,It's my life,4.5,4.5,1,Yes,1177650626000,N/A,4919,N/A,,N/A,[],people,people
N/A,good,good,good,0,12715913,0,,awesome,5,CHMB41,"Potter is a very accessable professor, the final is improved in Fall 2006, previouse final was given and it is very helpful indeed. The textbook is well-written, easy to read.",01/03/2007,4.0,4.0,,5,Really into it,5.0,5.0,1,Yes,1167840247000,N/A,4919,N/A,,N/A,[],people,people
N/A,good,good,good,0,12042666,0,,awesome,4,CHMB41H3,I took in the winter. She is very clear. Nice lady. Helpful. Midterm was very easy and final... was difficult. Id say because of the type of questions (short ans. mainly).,06/29/2006,4.0,4.0,,5,Sorta interested,4.5,4.5,1,N/A,1151548119000,N/A,4919,N/A,,N/A,[],people,people
N/A,good,average,good,0,11482487,0,,awesome,5,CHMB41,great professor. can teach and genuinely engaged in subject.,02/14/2006,3.0,3.0,,5,It's my life,5.0,5.0,1,N/A,1139884596000,N/A,4919,N/A,,N/A,[],people,people
N/A,average,good,average,0,3987672,0,,average,3,CHMB41,"Given the fact that organic is such a hard subject, she did a really good job.  At times, lectures went a bit fast to rush through the volume of material, but overall - seh was organized.  Very easy to talk to and approach",06/11/2005,4.0,4.0,,3,Low,3.0,3.0,1,N/A,1118509868000,N/A,4919,N/A,,N/A,[],people,people
N/A,poor,good,poor,0,3265543,0,,awful,1,CHMB41,"Yeah, she is really nice, but she can really be mean if she wants to....:(:(..her midterm was ok, but her final was insane...",01/23/2005,5.0,5.0,,1,Really into it,1.0,1.0,1,N/A,1106490274000,N/A,4919,N/A,,N/A,[],people,people
