attendance,clarityColor,easyColor,helpColor,helpCount,id,notHelpCount,onlineClass,quality,rClarity,rClass,rComments,rDate,rEasy,rEasyString,rErrorMsg,rHelpful,rInterest,rOverall,rOverallString,rStatus,rTextBookUse,rTimestamp,rWouldTakeAgain,sId,takenForCredit,teacher,teacherGrade,teacherRatingTags,unUsefulGrouping,usefulGrouping
Not Mandatory,poor,good,poor,5,26173733,1,online,awful,1,SCS0975,"Just an awful prof. Tax is a course which needs some guidance and filtering of materials because there is so much nuanced information, and is absolutely no help in doing that. His lectures are useless he just reads off the textbooks lecture notes in barely undersrandable tone.",03/23/2016,5.0,5.0,,1,Sorta interested,1.0,1.0,1,Yes,1458700338000,N/A,4928,Yes,,N/A,['Get ready to read'],person,people
N/A,good,average,good,0,24092723,0,,good,4,975,"Thank you , easy grader.",12/15/2014,2.0,2.0,,4,Really into it,4.0,4.0,1,Yes,1418678312000,Yes,4928,Yes,,N/A,['Caring'],people,people
Not Mandatory,average,good,average,0,23432786,0,online,poor,2,SCS0975,"I’m taking online course with him now and its the most stupid thing I ever made in my school life. Tests are impossible, final will be harder, no time to complete long questions. This guy assigns 60% to the final, but someone told me the other pro assigns 50% to the final. Same school, different pro, different marking system, go figure…",07/09/2014,5.0,5.0,,2,Meh,2.0,2.0,1,Yes,1404877289000,N/A,4928,Yes,,N/A,[],people,people
Mandatory,poor,good,poor,0,23156139,0,,awful,1,SCS0975,"He spoke English but it sounded like he spoke in another language. I could hardly understand the words came out of his mouth. Powerpoint notes are long with a lot of pointless notes. If you can’t teach yourself, you’re screwed.",05/03/2014,4.0,4.0,,1,Low,1.0,1.0,1,Yes,1399134246000,N/A,4928,N/A,,N/A,[],people,people
Mandatory,poor,average,poor,0,23113366,0,,poor,1,0975,"The worst pro ever in my school life. I heard bad reviews about him, but I gave him the benefit of the doubt, and I made a biggest mistake. If you find an alternative, take it.",04/28/2014,3.0,3.0,,2,Sorta interested,1.5,1.5,1,Yes,1398688088000,N/A,4928,N/A,,N/A,[],people,people
Not Mandatory,good,poor,good,3,22917178,0,,awesome,4,TAXATION,James is a good instructor. He is very helpful. Like all course you will have to study on your own as well. Not everything can be covered in a 3 hour class. He is an easy marker.,03/17/2014,1.0,1.0,,5,Really into it,4.5,4.5,1,Yes,1395056105000,N/A,4928,N/A,,A,[],people,people
Not Mandatory,poor,average,poor,0,22632447,1,,awful,1,SCS0975,"Personally I don't like the way he teaches and don't find it helpful at all. He is not clear with his lectures, confuses himself and in turn, students suffer. AVOID HIM AT ALL COSTS!",12/21/2013,3.0,3.0,,1,Low,1.0,1.0,1,Yes,1387589783000,N/A,4928,N/A,,N/A,[],person,people
Not Mandatory,poor,average,poor,0,22117105,0,,awful,1,SCS0975,I dropped the course. I couldn't stand the way he was mumbling with the words. He shown no interest with the topic. Very boring man.,09/11/2013,3.0,3.0,,1,Meh,1.0,1.0,1,Yes,1378926128000,N/A,4928,N/A,,N/A,[],people,people
