attendance,clarityColor,easyColor,helpColor,helpCount,id,notHelpCount,onlineClass,quality,rClarity,rClass,rComments,rDate,rEasy,rEasyString,rErrorMsg,rHelpful,rInterest,rOverall,rOverallString,rStatus,rTextBookUse,rTimestamp,rWouldTakeAgain,sId,takenForCredit,teacher,teacherGrade,teacherRatingTags,unUsefulGrouping,usefulGrouping
Mandatory,good,average,good,0,32045266,0,,awesome,5,POL200,"Best professor every, if you have the time go and have a conversation about anything she is a well rounded amazing professor. Professor Nacol is very understanding and gives amazing advice whether it is course-based or general university information. She is always more than willing to help.",06/20/2019,3.0,3.0,,5,N/A,5.0,5.0,1,Yes,1561060555000,Yes,4928,Yes,,N/A,"['Inspirational', 'Accessible outside class', 'Amazing lectures']",people,people
Mandatory,average,good,average,2,31606213,2,,average,3,POL200,"Although the prof was amazing as a person, the overall course had an insane amount of workload. Her and her TA's were never on the same page and the final exam is ridiculously hard. The readings are so lengthy and my advice is to avoid this class as much as possible",04/16/2019,4.0,4.0,,3,N/A,3.0,3.0,1,Yes,1555444251000,No,4928,Yes,,N/A,"['Get ready to read', 'Lecture heavy', 'So many papers']",people,people
Mandatory,good,average,good,1,30654387,0,,awesome,5,POL200,"Nacol is the best professor you'll ever have if you're lucky to ever have her. Her lectures are disciplined and structured perfectly, extremely substantive, and crystal clear. There is no better professor for political theory you'll ever get.",11/04/2018,3.0,3.0,,5,N/A,5.0,5.0,1,Yes,1541293889000,Yes,4928,Yes,,A,"['Lecture heavy', 'Inspirational', 'Respected']",people,person
Mandatory,good,average,good,1,30179749,0,,good,4,POL200,"Shes really sweet and caring about her students. She makes sure to thoroughly cover all materials, which makes it so much easier to understand the most important points. Overall great prof.",05/23/2018,3.0,3.0,,4,N/A,4.0,4.0,1,Yes,1527109608000,Yes,4928,Yes,,B+,"[""Skip class? You won't pass."", 'Caring', 'Get ready to read']",people,person
Not Mandatory,average,average,average,2,29791606,1,,average,3,POL200,"Nacols pretty cool, in 200 she focused on ancient theorists which I hate so there's my bias, however, she explained the readings in lecture so well I didn't even have to read, I recommend readings but her lectures are very informative. She had a good dose of theorists ex, Locke Machiavelli, Hobbes, Aquinas, Plato, Aristotle, Cicero and others.",04/12/2018,3.0,3.0,,3,N/A,3.0,3.0,1,Yes,1523536168000,Yes,4928,Yes,,N/A,"['Lecture heavy', 'Amazing lectures', 'Get ready to read']",person,people
