attendance,clarityColor,easyColor,helpColor,helpCount,id,notHelpCount,onlineClass,quality,rClarity,rClass,rComments,rDate,rEasy,rEasyString,rErrorMsg,rHelpful,rInterest,rOverall,rOverallString,rStatus,rTextBookUse,rTimestamp,rWouldTakeAgain,sId,takenForCredit,teacher,teacherGrade,teacherRatingTags,unUsefulGrouping,usefulGrouping
Mandatory,poor,average,poor,0,31728421,0,,awful,1,HIS282,She is very repetitive and jumps from point to point and not very clear.,05/01/2019,3.0,3.0,,1,N/A,1.0,1.0,1,No,1556684328000,No,4928,Yes,,A-,[],people,people
Mandatory,average,average,average,3,29079168,0,,average,3,HIS282,"Often would go over 2 hour time limit by 5-10 minutes, also can be tough to follow as she sometimes likes not always make a point or is not clear what she is trying to say, an interesting course and learned quite a bit about South Asian history",12/07/2017,2.0,2.0,,3,N/A,3.0,3.0,1,No,1512647268000,Yes,4928,Yes,,N/A,"['Lecture heavy', 'Get ready to read']",people,people
N/A,good,average,good,0,13568714,0,,awesome,5,HIS282,I acutally like the way she teaches. She's really really enthusiastic. If you pay attention in class you'll really get alot outta the course. I usually attend the lecture then do the reading.. that way the readings make more sense.,10/28/2007,3.0,3.0,,5,Really into it,5.0,5.0,1,Yes,1193587803000,N/A,4928,N/A,,N/A,[],people,people
N/A,poor,good,average,1,11197005,0,,poor,1,HIS282,"i took this class in my first year and it was a poor experience. i ended up with decent marks but i had to work really hard. the prof is erratic and can be all over the place, it can be difficult to take notes. Also she almost always went over the designated 2hour time allotment by 5-10 minutes, which can be annoying!",12/17/2005,4.0,4.0,,3,It's my life,2.0,2.0,1,N/A,1134827146000,N/A,4928,N/A,,N/A,[],people,person
N/A,poor,good,average,0,11022142,1,,poor,1,INDIA,"Her style is horrible, made me drop the class. Every lecture left me more and more confused. Hair moves when she talks, that was the only funny part.",12/01/2005,4.0,4.0,,3,It's my life,2.0,2.0,1,N/A,1133403498000,N/A,4928,N/A,,N/A,[],person,people
N/A,good,average,good,0,10414083,0,,awesome,5,HST282,She's an amazing teacher and really knows her what she;'s talking about. If you are interested enough she can really provide the broad picture and I really love that she takes political stands and does not sit on the fence! I'm taking more courses with her. I really got something from being in her class.,09/14/2005,3.0,3.0,,5,It's my life,5.0,5.0,1,N/A,1126711106000,N/A,4928,N/A,,N/A,[],people,people
N/A,good,good,good,0,10028261,0,,awesome,5,HIS282,She is a great professor.  She is difficult but I found her very helpful.  I thoroughly enjoyed the course and thought she was a great professor.,07/14/2005,4.0,4.0,,5,It's my life,5.0,5.0,1,N/A,1121381952000,N/A,4928,N/A,,N/A,[],people,people
N/A,average,good,average,0,3889653,0,,average,3,HIS282,"VERY POOR! Didnt like her at all! keep in mind, her grading is hard too! Grrr!",05/19/2005,4.0,4.0,,2,Really into it,2.5,2.5,1,N/A,1116501840000,N/A,4928,N/A,,N/A,[],people,people
N/A,average,good,average,0,3644662,0,,average,3,HISINDIA,"Did not enjoy this at all. Find her style annoying, she can be rude and unhelpful, her instructions are either too vague or too specific, and she is overly political. Just not a good learning experience, and she is a hard marker.",04/17/2005,4.0,4.0,,3,Low,3.0,3.0,1,N/A,1113743361000,N/A,4928,N/A,,N/A,[],people,people
