attendance,clarityColor,easyColor,helpColor,helpCount,id,notHelpCount,onlineClass,quality,rClarity,rClass,rComments,rDate,rEasy,rEasyString,rErrorMsg,rHelpful,rInterest,rOverall,rOverallString,rStatus,rTextBookUse,rTimestamp,rWouldTakeAgain,sId,takenForCredit,teacher,teacherGrade,teacherRatingTags,unUsefulGrouping,usefulGrouping
N/A,good,average,good,0,17418724,0,,awesome,5,ENG304,Tough material hear and there yet he is very helpful insightful and approachable. Well organized lectures and preparation . Participate and enjoy.,07/14/2010,2.0,2.0,,5,Sorta interested,5.0,5.0,1,Yes,1279115861000,N/A,4928,N/A,,N/A,[],people,people
N/A,good,average,good,0,17418675,0,,awesome,5,ENG331,"Very interesting topic divisions and themes. Well versed and extremely organized. Give very good  clues for testing, won't steer you wrong.",07/14/2010,3.0,3.0,,5,Low,5.0,5.0,1,Yes,1279115243000,N/A,4928,N/A,,N/A,[],people,people
N/A,good,average,good,0,16408696,0,,awesome,5,ENG323,Fantastic professor.,11/20/2009,3.0,3.0,,5,Meh,5.0,5.0,1,Yes,1258761119000,N/A,4928,N/A,,N/A,[],people,people
N/A,good,average,good,0,15999882,0,,awesome,5,ENG331,"I was far from interested in Renaissance Drama. Now, it's my favorite genre of literature. Matusiak is the BEST professor I have had in my four years. He teaches with such enthusiasm and his material is so interesting you never want to skip a class. He's is approachable, more than ready to help, and grades very fairly. Matusiak is truly amazing!",06/28/2009,3.0,3.0,,5,Sorta interested,5.0,5.0,1,Yes,1246222271000,N/A,4928,N/A,,N/A,[],people,people
N/A,good,average,good,0,15708393,0,,awesome,5,ENG304,best professor of my university degree. I wasn't looking forward to learning 17th century lit but he made me love it. do what you can to take his courses.,04/25/2009,3.0,3.0,,5,Low,5.0,5.0,1,Yes,1240687674000,N/A,4928,N/A,,N/A,[],people,people
N/A,good,average,good,0,15543212,0,,awesome,5,ENG306,"Without a doubt, the best professor I had in four years of university.",03/18/2009,3.0,3.0,,5,It's my life,5.0,5.0,1,Yes,1237388679000,N/A,4928,N/A,,N/A,[],people,people
N/A,good,good,good,1,14564061,0,,awesome,5,ENG304,"great proffessor, if u attend the classes thats all u need to do well. teaches with a lot of passion and intensity, and is dedicated to his students. a very enjoyable class because you can learn a lot while not feeling as if ur being preached at at all.",06/07/2008,4.0,4.0,,5,Sorta interested,5.0,5.0,1,Yes,1212848720000,N/A,4928,N/A,,N/A,[],people,person
