attendance,clarityColor,easyColor,helpColor,helpCount,id,notHelpCount,onlineClass,quality,rClarity,rClass,rComments,rDate,rEasy,rEasyString,rErrorMsg,rHelpful,rInterest,rOverall,rOverallString,rStatus,rTextBookUse,rTimestamp,rWouldTakeAgain,sId,takenForCredit,teacher,teacherGrade,teacherRatingTags,unUsefulGrouping,usefulGrouping
Mandatory,good,good,good,0,29279021,0,,awesome,5,GGR349,"Very nice and respected prof. Tries his best not to talk too much during class he knows he always talks for too long since he loves what he's doing, which is so interesting to see. Tons of material to cover this class, need to understand lots about eco. crisis, gentrification, and bunch of history related stuff since cities are built in the past.",12/19/2017,4.0,4.0,,5,N/A,5.0,5.0,1,Yes,1513702326000,Yes,4928,Yes,,B+,"['Inspirational', 'Respected', 'Get ready to read']",people,people
N/A,good,good,good,0,23614090,0,,awesome,5,GGR207,"As a science and humanities student taking this class to fulfill my social science credit, I highly enjoyed this course. It was very interesting and Dr Walks was a fantastic professor and helped me understand the material from a background very different from my own. Also very handsome!",09/26/2014,4.0,4.0,,4,Really into it,4.5,4.5,1,Yes,1411701607000,N/A,4928,Yes,,N/A,"['So many papers', 'Hilarious', ""Skip class? You won't pass.""]",people,people
N/A,good,average,good,2,22656602,0,,good,4,GGR361,"He's a great prof., passion in what he teaches, sense of humour, very friendly and easy to talk to, term tests and exams were basically comprised of mainly lecture material (short answer and essay questions) and the past exam was very helpful. Loved this class.",12/26/2013,2.0,2.0,,4,Really into it,4.0,4.0,1,Yes,1388023245000,N/A,4928,N/A,,N/A,[],people,people
Mandatory,good,poor,good,0,22332086,0,,awesome,5,GGR207,"Really Nice, very clear and organized, definitely recommend.",11/17/2013,1.0,1.0,,5,It's my life,5.0,5.0,1,Yes,1384699703000,N/A,4928,N/A,,A+,[],people,people
N/A,average,good,average,0,13322478,1,,good,3,GGR207,bad lecturing style of endless overheads & talking while you're trying to copy. however exams use very little textbook material (primarily lecture material),07/10/2007,4.0,4.0,,4,It's my life,3.5,3.5,1,No,1184094443000,N/A,4928,N/A,,N/A,[],person,people
N/A,poor,average,poor,0,12864431,6,,poor,1,GGR207,"I find him quite unhelpful whenever I ask a question, and he even gets a little rude somtimes.  I don't get anything out of the lecture because he is talking while putting pages and pages of long paragraphs to copy down.  I can't listen to him or read what I am writing. I won't take a class with him again.",02/14/2007,3.0,3.0,,2,It's my life,1.5,1.5,1,No,1171477553000,N/A,4928,N/A,,N/A,[],people,people
N/A,good,average,good,1,12562053,0,,awesome,5,GGR207,Class was interesting. WAY too many detailed overheads to write down so bring a laptop if you own one! Textbook was good. Attend class. You should be capable of receiving a great mark in this course.,12/10/2006,2.0,2.0,,4,Really into it,4.5,4.5,1,Yes,1165749088000,N/A,4928,N/A,,N/A,[],people,person
N/A,good,average,good,0,11397234,0,,awesome,5,GGR207GGR361,Amazing Prof and his classes are amazinf too!,01/20/2006,3.0,3.0,,5,It's my life,5.0,5.0,1,N/A,1137787304000,N/A,4928,N/A,,N/A,[],people,people
N/A,good,average,good,0,3644613,0,,awesome,4,GGR208,"A good, up-and-coming instructor, great demeanor and delivery, enthusiastic, still learning. Enjoyable classes.",04/17/2005,3.0,3.0,,5,Really into it,4.5,4.5,1,N/A,1113742729000,N/A,4928,N/A,,N/A,[],people,people
