attendance,clarityColor,easyColor,helpColor,helpCount,id,notHelpCount,onlineClass,quality,rClarity,rClass,rComments,rDate,rEasy,rEasyString,rErrorMsg,rHelpful,rInterest,rOverall,rOverallString,rStatus,rTextBookUse,rTimestamp,rWouldTakeAgain,sId,takenForCredit,teacher,teacherGrade,teacherRatingTags,unUsefulGrouping,usefulGrouping
N/A,good,poor,good,0,19640626,0,,awesome,5,MGT353,"awesome prof! yes, it is hard to impress him but if you're consistent and professional, then you shouldn't have any problem. he likes creativity and genuine insight so you need to pay attention in class discussions and participate as much as you can with 'out of the box' ideas. overall, I'd give him 5/5",12/29/2011,1.0,1.0,,5,Meh,5.0,5.0,3,No,1325198713000,N/A,4928,N/A,,N/A,[],people,people
N/A,average,good,average,0,18484793,0,,average,3,MGT353,"he favors students and bases his participation marks whether he likes the student or not. if you are a student that attends and participates every class, you may receive a lower participation mark compared to peers that do not participate as much.",04/28/2011,4.0,4.0,,2,Sorta interested,2.5,2.5,1,No,1303992047000,N/A,4928,N/A,,N/A,[],people,people
N/A,good,poor,good,0,16294824,0,,awesome,5,MGT455,Great prof,10/31/2009,1.0,1.0,,5,Sorta interested,5.0,5.0,1,Yes,1256990421000,N/A,4928,N/A,,N/A,[],people,people
N/A,average,average,poor,0,12715229,0,,poor,2,MGM252,"SUCH A BAD PROF. First he's all nice and easy going and makes jokes, and then screws you over with your grades. The textbook is the worst EVER...60 billion pages of bla bla and then one important point. This prof has turned a lot of people off marketing in my class.",01/03/2007,2.0,2.0,,1,Really into it,1.5,1.5,1,Yes,1167834797000,N/A,4928,N/A,,N/A,[],people,people
N/A,poor,good,poor,0,12695500,0,,awful,1,MGT252,"It's difficult to understand what he tries to say. Because he teaches most of marketing courses, I have to change my concentration.",12/29/2006,4.0,4.0,,1,It's my life,1.0,1.0,1,Yes,1167358088000,N/A,4928,N/A,,N/A,[],people,people
N/A,poor,good,poor,0,12654433,0,,awful,1,MGM252,WORST PROF EVER...TOO BAD B/C MARKETING IS INTERESTING BUT NOT WITH THIS GUY,12/20/2006,4.0,4.0,,1,Really into it,1.0,1.0,1,Yes,1166622267000,N/A,4928,N/A,,N/A,[],people,people
N/A,poor,good,poor,0,11742196,0,,awful,1,MGT252H5,"VERY BAD!!!Avoid at all cost! If you're in it, i recommand you drop it asap. Don't waste your petition at the end!",04/21/2006,5.0,5.0,,1,Meh,1.0,1.0,1,N/A,1145623118000,N/A,4928,N/A,,N/A,[],people,people
N/A,poor,good,poor,0,11742181,0,,awful,1,MGT252,No Comments,04/21/2006,5.0,5.0,,1,Meh,1.0,1.0,1,N/A,1145623012000,N/A,4928,N/A,,N/A,[],people,people
