attendance,clarityColor,easyColor,helpColor,helpCount,id,notHelpCount,onlineClass,quality,rClarity,rClass,rComments,rDate,rEasy,rEasyString,rErrorMsg,rHelpful,rInterest,rOverall,rOverallString,rStatus,rTextBookUse,rTimestamp,rWouldTakeAgain,sId,takenForCredit,teacher,teacherGrade,teacherRatingTags,unUsefulGrouping,usefulGrouping
Mandatory,good,good,good,0,22866182,1,,awesome,4,LIN241,"His enthusiasm makes what could easily be an awful class really interesting and fun.  The class is hard and you really can't miss a lecture, but he's happy to answer questions and great at clarifying when necessary.",02/25/2014,4.0,4.0,,5,Sorta interested,4.5,4.5,1,Yes,1393339509000,N/A,4928,N/A,,N/A,[],person,people
N/A,good,good,good,0,20850165,1,,good,4,LIN247,"Obviously cares about making it good. Can be a little tough to understand his explanations, but just ask to clarify.",11/16/2012,4.0,4.0,,4,Sorta interested,4.0,4.0,1,No,1353068941000,N/A,4928,N/A,,N/A,[],person,people
N/A,average,average,average,0,19675455,2,,average,3,LIN241,I love you so much &lt;3 &lt;3 &lt;3,01/05/2012,3.0,3.0,,3,Sorta interested,3.0,3.0,1,Yes,1325781917000,N/A,4928,N/A,,N/A,[],people,people
N/A,good,average,good,0,19407654,0,,awesome,5,LIN247,"HARD course, so work hard in return.  As for Youri, he is genuine and passionate about Semantics.  He is extremely helpful, goes his way to offer aid to his students, and does all he can to make sure you get the material.  Fair + understanding.  Funny + interesting.  Good guy all around.  I'm not intimidated to go to his office hours at all.",12/07/2011,3.0,3.0,,5,Sorta interested,5.0,5.0,1,Yes,1323251827000,N/A,4928,N/A,,N/A,[],people,people
N/A,average,good,average,1,19047035,0,,poor,2,LIN247,"Unless you're an A student, stay away!",10/05/2011,5.0,5.0,,2,Sorta interested,2.0,2.0,1,No,1317843703000,N/A,4928,N/A,,N/A,[],people,person
