attendance,clarityColor,easyColor,helpColor,helpCount,id,notHelpCount,onlineClass,quality,rClarity,rClass,rComments,rDate,rEasy,rEasyString,rErrorMsg,rHelpful,rInterest,rOverall,rOverallString,rStatus,rTextBookUse,rTimestamp,rWouldTakeAgain,sId,takenForCredit,teacher,teacherGrade,teacherRatingTags,unUsefulGrouping,usefulGrouping
N/A,good,average,good,0,1985240,0,,awesome,5,PSY230327,"Good prof, difficult to get higher than an A- in his courses due to the multiple choice exams...the essay and weekly assignments are easy tho.",04/19/2004,3.0,3.0,,5,N/A,5.0,5.0,1,N/A,1082340521000,N/A,4928,N/A,,N/A,[],people,people
N/A,average,average,average,0,1984360,0,,average,3,PSY320,The professor's tests are all Multiple choice (which makes it difficult to do well in the course)...He likes to give you weekly assignments (where you have to summarize a journal article (generally the journal articles are 20+ pages = hard to understand).,04/18/2004,3.0,3.0,,2,N/A,2.5,2.5,1,N/A,1082328215000,N/A,4928,N/A,,N/A,[],people,people
N/A,average,average,average,0,1975770,0,,good,3,PSY320,"Decent Prof.One of the best at UTM. Pretty fair when it comes to assignments.But tests are ALL multiple choice, making it difficult for people that excel in short answers and essays, and suck at multiple choice.",04/16/2004,2.0,2.0,,4,N/A,3.5,3.5,1,N/A,1082136194000,N/A,4928,N/A,,N/A,[],people,people
N/A,good,poor,good,0,1390344,0,,awesome,5,PSY230,Very laid-back professor. Always all smiles and ready to throw down a hilarious comment (had candy for people who participate in class!). Easy tests: study list shows you what will be on them. He's very dedicated: writes 9 page notes for each lecture!,11/24/2003,1.0,1.0,,5,N/A,5.0,5.0,1,N/A,1069706259000,N/A,4928,N/A,,N/A,[],people,people
N/A,good,average,good,0,1312948,0,,awesome,4,PSY230,great professor!!! One of the most relaxed classes i've taken. Tests aren't too hard. still have to study though. assignments are easy. no final exam!!! only thing that was hard was the essay but even that was done in one weekend.,11/12/2003,2.0,2.0,,5,N/A,4.5,4.5,1,N/A,1068671070000,N/A,4928,N/A,,N/A,[],people,people
N/A,good,average,good,0,1265142,0,,awesome,5,PSY230,Great guy - very nice and funny though a little disorganized!!! In what other class would you watch Seinfeld episodes!!!,11/05/2003,3.0,3.0,,5,N/A,5.0,5.0,1,N/A,1068025029000,N/A,4928,N/A,,N/A,[],people,people
N/A,good,average,good,0,1183249,0,,awesome,5,PSY320,"Very cool and down-to-earth prof with a wicked sense of humour! Papers were straight-forward, however, multiple choice tests were deceptively difficult! Pay attention, have fun, and it will be a good experience :).",10/11/2003,3.0,3.0,,5,N/A,5.0,5.0,1,N/A,1065871885000,N/A,4928,N/A,,N/A,[],people,people
N/A,good,average,good,0,1043199,0,,awesome,5,PSY230327,"The best of the BEST!! PSY230 was wonderful, as was PSY327 and I expect the same with PSY320--Attitudes. Holla!",07/09/2003,3.0,3.0,,5,N/A,5.0,5.0,1,N/A,1057772673000,N/A,4928,N/A,,N/A,[],people,people
N/A,good,poor,good,0,990926,0,,awesome,4,PSY230,"Wonderful prof. A genuine person, not one of those stuck up, dry aliens one usually encounters as professors. Approachable, kind and funny!",05/29/2003,1.0,1.0,,5,N/A,4.5,4.5,1,N/A,1054249808000,N/A,4928,N/A,,N/A,[],people,people
N/A,good,poor,good,0,947969,0,,awesome,5,PSY230327,No Comments,05/10/2003,1.0,1.0,,5,N/A,5.0,5.0,1,N/A,1052589676000,N/A,4928,N/A,,N/A,[],people,people
N/A,good,average,good,0,795228,0,,good,4,PSY230,possibly the best psych course i've ever taken...awesome prof...lectures are fun and he cares about the students.,04/06/2003,2.0,2.0,,4,N/A,4.0,4.0,1,N/A,1049654835000,N/A,4928,N/A,,N/A,[],people,people
N/A,good,average,good,0,554311,0,,awesome,5,PSY100,HILARIOUS! Lectures are interesting. He even got an applause after a lecture.,02/10/2003,2.0,2.0,,5,N/A,5.0,5.0,1,N/A,1044897472000,N/A,4928,N/A,,N/A,[],people,people
N/A,good,average,good,0,301100,0,,awesome,5,PSY230,"Best prof I've had.  His lectures are interesting, and he actually gives a crap.",10/23/2002,2.0,2.0,,4,N/A,4.5,4.5,1,N/A,1035341304000,N/A,4928,N/A,,N/A,[],people,people
N/A,good,average,good,0,268114,0,,awesome,4,PSY230,No Comments,09/22/2002,2.0,2.0,,5,N/A,4.5,4.5,1,N/A,1032704712000,N/A,4928,N/A,,N/A,[],people,people
