attendance,clarityColor,easyColor,helpColor,helpCount,id,notHelpCount,onlineClass,quality,rClarity,rClass,rComments,rDate,rEasy,rEasyString,rErrorMsg,rHelpful,rInterest,rOverall,rOverallString,rStatus,rTextBookUse,rTimestamp,rWouldTakeAgain,sId,takenForCredit,teacher,teacherGrade,teacherRatingTags,unUsefulGrouping,usefulGrouping
Mandatory,average,average,average,0,32832062,0,,poor,2,PSY230,"So disorganized. His class made me NOT want to pursue personality psychology. Concepts were often unrelated. Made contradictory statements and could not clarify them. Had whole unit on sex and masturbation unrelated to personality. Textbook is his own, a wall of text and gibberish. Content is too messy to study properly. Don't ask me how I got an A",01/14/2020,2.0,2.0,,2,N/A,2.0,2.0,1,Yes,1578965481000,No,4928,Yes,,A+,[],people,people
Not Mandatory,good,average,good,0,31225455,1,,good,4,PSY230,"Lectures are extremely boring and aren't needed as long as you read the textbook and follow his study lists. If you get above 80% on the first term test then you receive 100% for participation. Textbook is free, informative, and easy to read. Really nice guy.",01/08/2019,2.0,2.0,,4,N/A,4.0,4.0,1,Yes,1546983183000,Yes,4928,Yes,,A,[],person,people
Mandatory,poor,good,poor,3,30161541,1,,awful,1,PSY324,An extremely boring professor! His lecture slides are so confusing and full of charts and graphs that have no explanation. When he goes over these he talks as if we all know moderate to advanced level statistics when we clearly don't! All his lectures are just random studies that contradict each other.,05/21/2018,4.0,4.0,,1,N/A,1.0,1.0,1,Yes,1526912262000,No,4928,No,,N/A,"['Tough grader', ""Skip class? You won't pass.""]",person,people
Mandatory,poor,average,poor,4,27795733,4,,awful,1,PSY230,Really bad prof. It was a course on personality but he only talked about correlations and statistics which has nothing to do with personality. His exam was 30 multiple choice. No one learned anything - he would put up Iclicker questions and everyone would get it wrong. The textbook is written by him so it isn't any help.,02/01/2017,3.0,3.0,,1,N/A,1.0,1.0,1,Yes,1485957216000,No,4928,Yes,,N/A,"['Participation matters', 'Test heavy', ""Skip class? You won't pass.""]",people,people
N/A,good,average,good,0,27707279,1,,good,4,PSY230,"The most straightforward class I've ever taken. Since he wrote his (free) textbook, it's the same as his lectures. Although tests are essentially 1 MC question  1%, they are straight from lecture notes and are  non-cumulative. Very approachable and caring. Though material can be a bit dry, I still enjoyed it and found it to be a helpful course",01/10/2017,2.0,2.0,,4,N/A,4.0,4.0,1,Yes,1484051029000,Yes,4928,Yes,,A+,['Caring'],person,people
Not Mandatory,good,average,good,0,27686587,1,,good,4,PSY230,"Great professor. Lectures can be a little dry but there's still a lot you can learn from him. He writes the textbook himself so lecture notes and textbook notes are very similar, making it much easier to follow along! He's a very fair grader.",01/06/2017,2.0,2.0,,4,N/A,4.0,4.0,1,Yes,1483731126000,Yes,4928,Yes,,A,"['Respected', 'Caring', 'Inspirational']",person,people
Mandatory,good,poor,good,1,26779372,0,,awesome,5,PSY230,"Lectures very dry is the only con.  Very heavy on participation and so never ever skip class. There are in class iclickers quizzes usually about 5 question based on previous lecture, very easy and basically discuss with ppl around you. First test is make you or break you worth 40%. No final exam. Two term tests and participation is breakdown.",07/04/2016,1.0,1.0,,5,N/A,5.0,5.0,1,No,1467647784000,Yes,4928,Yes,,A+,"[""Skip class? You won't pass."", 'Beware of pop quizzes', 'Lecture heavy']",people,person
N/A,poor,average,poor,0,25881750,0,,awful,1,PSY230,He's alright. The course itself is pretty good and can be a GPA booster. He's not the best professor but you can still do very well in this course. Just need to attend all lectures and do the readings. Some questions on the midterms were quite vague and unclear. Still a pretty decent course to take.,01/05/2016,3.0,3.0,,1,Low,1.0,1.0,1,No,1452015765000,N/A,4928,Yes,,N/A,"['Participation matters', 'Get ready to read', 'Lecture heavy']",people,people
N/A,poor,poor,poor,5,24384224,7,,awful,1,PSY230,One of my worst profs in 4 years. He is not in the least bit helpful and is actually rude when you try to approach him. Fortunately the class is a joke and you are bound to do well. Bottom line: bird course but expect to hate the class,02/13/2015,1.0,1.0,,1,It's my life,1.0,1.0,1,Yes,1423869288000,N/A,4928,Yes,,N/A,[],people,people
Mandatory,average,average,average,3,24016732,3,,good,3,PSY230,Excellent prof. Attend lectures and study for the STUDY LIST you will be fine.,12/10/2014,2.0,2.0,,4,Sorta interested,3.5,3.5,1,Yes,1418216832000,N/A,4928,Yes,,A-,[],people,people
N/A,poor,poor,poor,4,23591063,1,,awful,1,PSY324,In person he is a very rude professor who takes his subject way too seriously. He is very bad at explaining anything that is related to the subject but not in his lecture notes. He tries to take a scientific approach on a clearly philosophical subject. Don't expect to learn anything practical. At least the class was an easy!,09/12/2014,1.0,1.0,,1,Meh,1.0,1.0,1,No,1410547746000,N/A,4928,N/A,,N/A,[],person,people
N/A,good,average,good,3,22899582,1,,awesome,4,PSY324,"Prof. Schimmack was an excellent professor. He was enthusiastic and very helpful. He also related material from the class to his personal life, which I really liked because it made the material far more interesting. I thoroughly enjoyed his lecture and class. You should definitely attend lectures as there is a participation component. Amazing prof!",03/10/2014,2.0,2.0,,5,Really into it,4.5,4.5,1,Yes,1394468473000,N/A,4928,N/A,,N/A,[],person,people
N/A,good,average,good,3,22797182,3,,awesome,5,PSY324,"Prof. Schimmack was one of the best professors I have had at UTM. Although his lectures and the readings were not always posted on time, he was VERY VERY helpful when I went to his office hours. There was no textbook or extra readings which was a complete bonus for a 3rd year course!!",01/27/2014,2.0,2.0,,5,It's my life,5.0,5.0,1,No,1390839724000,N/A,4928,N/A,,N/A,[],people,people
N/A,average,average,average,0,22764583,1,,good,3,PSY230,"No essay for my year, wasn't much to the class material so lectures were boring - but he used some iClicker questions in the tests! Sweet professor and the readings were pretty helpful.",01/17/2014,2.0,2.0,,4,Sorta interested,3.5,3.5,1,Yes,1389920608000,N/A,4928,N/A,,N/A,[],person,people
N/A,average,good,average,0,22740924,1,,poor,2,PSY230,no essay this year so really high average. really arbitrary m.c final had a HUGE bellcurve. dont need to go to class. easy 100 on iclicker to boost your mark but tests bring it down.,01/12/2014,4.0,4.0,,2,Low,2.0,2.0,1,No,1389564833000,N/A,4928,N/A,,N/A,[],person,people
N/A,poor,good,poor,3,22526318,1,,awful,1,PSY230,"NOT HELPFUL, VERY RUDE. CLASS IS EASY BUT NOT WORTH THE STRESS AND ANNOYING PAIN IN THE BUM.   He is very disorganized. :( I had more faith in him...but it's gone, gone with the wind.",12/12/2013,5.0,5.0,,1,Meh,1.0,1.0,1,Yes,1386861031000,N/A,4928,N/A,,N/A,[],person,people
N/A,good,poor,good,2,22422412,0,,good,4,PSY324,"The course is okay. Some people thought it was super boring, I found it to be pretty cool (good to know what makes you happy). Schimmack is disorganized (never post slides on time, never posts notes...). But he's a fair guy. Easy course if you read the notes and go to class. Cool course, cool prof",12/03/2013,1.0,1.0,,4,It's my life,4.0,4.0,1,Yes,1386084629000,N/A,4928,N/A,,N/A,[],people,people
N/A,good,poor,good,1,22422382,0,,awesome,5,PSY230,"Schimmack is a good professor. Yes, the course is somewhat boring but he does his best to make it as interesting (iclicker, lame jokes...). The course is really easy if you go to class and read his lecture notes, and has many opportunities to boost your mark.",12/03/2013,1.0,1.0,,4,Really into it,4.5,4.5,1,Yes,1386084458000,N/A,4928,N/A,,N/A,[],people,person
N/A,poor,average,average,1,22334525,0,,average,1,PSY230,"30% In class assessment and 10% i clicker, since we have minimal amount of classes, a little incorrect answer could destroy your mark! I THINK THIS IS UNFAIR! Alot of the multiple choice is misguiding, I think he needs to become more organized and spread out the marking scheme! Not solely depend on 30% to be a press of a button for 8 questions!",11/17/2013,3.0,3.0,,5,Sorta interested,3.0,3.0,1,Yes,1384730803000,N/A,4928,N/A,,N/A,[],people,person
N/A,poor,average,poor,1,22083136,0,,awful,1,PSY309LAB,"worst professor ever, disorganized , not fair all over the place, I would never recommend this prof",08/25/2013,3.0,3.0,,1,Meh,1.0,1.0,1,No,1377463168000,N/A,4928,N/A,,N/A,[],people,person
N/A,poor,good,poor,2,22022277,0,,awful,1,PSY230H5,"I don't understand how people are rating him as good quality.  The content of his course is mostly research (I.e. correlational research) which is extremely boring and useless knowledge to have.  Could not pay attention in his class.  Lecture were disorganized, and TA's were equally as useless.  No clue how I ended up with a B-, I winged all tests.",08/03/2013,4.0,4.0,,1,Really into it,1.0,1.0,1,No,1375538117000,N/A,4928,N/A,,N/A,[],people,people
N/A,good,average,good,0,21433090,0,,good,4,PSY230,"I'm glad that i took his class.Many opportunities to bring up your mark, and there is no final exam.8% is participation with icklickers,and he gives an extra 1% to your final if you attend his last class. All his tests are m/c and they're fair if you read the textbook. Assignments are easy. it is true that he is late with handing things back though",03/21/2013,2.0,2.0,,4,Sorta interested,4.0,4.0,1,Yes,1363868059000,N/A,4928,N/A,,N/A,[],people,people
N/A,average,average,average,0,21367069,0,,poor,2,PSY324,He is extremely unorganized and barely ever posted the notes for class on time. It took forever to get grades from tests and assignments. He lectures very slowly and lectures barely ever finished on time.,02/26/2013,3.0,3.0,,2,Really into it,2.0,2.0,1,No,1361881007000,N/A,4928,N/A,,N/A,[],people,people
N/A,poor,good,poor,1,21232132,0,,awful,1,PSY230,"So the first week of the 2nd sem. is half done and I have yet to receive the mark for my paper. I initially loved the class because of the prof's excitement, but then I realized it was a facade. He is a research prof. His main focus was collecting info from us. I learned absolutely NOTHING new, and my TA was horribly rude!",01/08/2013,5.0,5.0,,1,It's my life,1.0,1.0,1,Yes,1357680316000,N/A,4928,N/A,,N/A,[],people,person
N/A,poor,good,poor,1,21175214,0,,awful,1,PSY324,"Still waiting on the essay grade, the second midterm grade, the clicker participation grade, etc... come on. It's been over a month. There is no excuse for this man's laziness.",12/27/2012,5.0,5.0,,1,Meh,1.0,1.0,1,No,1356625021000,N/A,4928,N/A,,N/A,[],people,person
N/A,average,poor,average,1,20996774,0,,good,3,PSY230,"This class was boring as all hell, but Schimmack is a good professor, and tries to make the incredibly dry material interesting.  The MC tests can be tricky and ambiguous but if you read his lecture notes you should be fine.  This course was an easy A; there's even 8% given for using the iClicker.",12/09/2012,1.0,1.0,,4,Low,3.5,3.5,1,Yes,1355057379000,N/A,4928,N/A,,N/A,[],people,person
N/A,good,good,good,0,20879324,0,,awesome,5,PSY230,"The problem with Schimmack is not the lack of organization, it's his brutal MC tests. As for the idea that he does not care about the course, c'mon! The dude has tenure and still makes a concerted effort to engage the class through the use of an iClicker. He even asks for feedback after tests on ways to improve the course. He's a great guy.",11/24/2012,5.0,5.0,,5,Sorta interested,5.0,5.0,1,Yes,1353720827000,N/A,4928,N/A,,N/A,[],people,people
N/A,poor,good,poor,1,20857993,0,,awful,1,PSY324,"Simply put: he doesn't give a darn about the course, the students, anything. He never posts lecture notes on time, he never finishes lectures, he isn't strict with the TAs so they don't get anything done, he never posted instructions on how to do the essay, and he is extremely disorganized. This class is simply a nightmare. I regret taking it.",11/18/2012,5.0,5.0,,1,Sorta interested,1.0,1.0,1,No,1353254542000,N/A,4928,N/A,,N/A,[],people,person
N/A,good,average,good,0,19712826,0,,good,4,PSY230,"Pretty boring, but clicker participation was a pretty good chunk of the grading anyways. All his tests are MC which he doesn't give back! A little tricky, but nothing too hard with going over both his slides and book. Ended up with a horrible TA, but it was an easy class regardless :)",01/11/2012,2.0,2.0,,4,Sorta interested,4.0,4.0,1,Yes,1326308039000,N/A,4928,N/A,,N/A,[],people,people
N/A,good,average,good,0,19415251,0,,awesome,4,PSY230,"He's a really great prof overall. Extremely nice and helpful. The material is a bit boring since there's a lot of stats, but not his fault. Assignments are easy. Tests are hard and tricky due to the material. i-Clicker participation is easy marks. He's spontaneous at times and very funny. I recommend his class.",12/07/2011,3.0,3.0,,5,Sorta interested,4.5,4.5,1,Yes,1323284887000,N/A,4928,N/A,,N/A,[],people,people
N/A,good,average,good,0,19342095,0,,awesome,4,PSY324,"Tests are tricky but also very fair. He shows an EXTREME amount of enthusiasm in the field of well-being psych, which is a great characteristic in a prof. Unlike some profs, really wants his students to do well. Weekly assignments can be tedious but are helpful for studying for the test. Overall a wonderful prof.",11/30/2011,2.0,2.0,,5,It's my life,4.5,4.5,1,Yes,1322669471000,N/A,4928,N/A,,N/A,[],people,people
N/A,good,average,good,0,19340990,0,,awesome,5,PSY230,"Great prof, and explains everything well!",11/30/2011,2.0,2.0,,5,Sorta interested,5.0,5.0,1,Yes,1322664018000,N/A,4928,N/A,,N/A,[],people,people
N/A,average,good,average,0,19264751,0,,poor,2,PSY230,"Incredibly boring class. I NEVER fall asleep in class, but in his I probably could have. Don't take this class if you can't study boring material. He could have presented it in such a stimulating way, and related it to our lives as students.",11/17/2011,4.0,4.0,,2,Low,2.0,2.0,1,No,1321532823000,N/A,4928,N/A,,N/A,[],people,people
N/A,good,average,good,0,18963886,0,,good,4,PSY230,He's pretty good. Class isn't too bad. Never liked his assignments but his tests were easy.,08/30/2011,2.0,2.0,,4,Really into it,4.0,4.0,1,No,1314662608000,N/A,4928,N/A,,N/A,[],people,people
N/A,good,good,good,0,17823364,0,,awesome,5,PSY230,He's pretty cool. But the tests are a bit hard. But overall it's an okay course..no exams :),11/27/2010,4.0,4.0,,5,It's my life,5.0,5.0,1,Yes,1290887197000,N/A,4928,N/A,,N/A,[],people,people
N/A,good,average,good,0,17816787,0,,good,4,PSY230,"Overall, he's a great teacher. He's easy to work with, he finds ways to make the class fun, and he uses iClickers (trust me, it's more fun than it sounds ;P) Best advice I can give is to READ THE LECTURE NOTES. They will save your life when the tests come along!",11/24/2010,2.0,2.0,,4,Really into it,4.0,4.0,1,Yes,1290628960000,N/A,4928,N/A,,N/A,[],people,people
N/A,good,average,good,0,17634059,0,,awesome,4,PSY230,He's a great prof! Easy to understand and very approachable. Not to mention he's eyecandy! I look forward in participating in his class. Keep up the great work!,10/05/2010,2.0,2.0,,5,Really into it,4.5,4.5,1,Yes,1286315651000,N/A,4928,N/A,,N/A,[],people,people
N/A,good,good,good,0,16774029,0,,good,4,PSY324,"he's nince, and seems like a very approachable guy..but damnit lectures are soo boring to me &gt;o&lt;..can't seem to stay awake in that class - course load= it's more than the usual psy courese, but farily easy and helps to raise your will-be low mark on the MC midterms. BEST thing of all is that there is no EXAM!! HI5",02/01/2010,4.0,4.0,,4,Sorta interested,4.0,4.0,1,No,1264982634000,N/A,4928,N/A,,N/A,[],people,people
N/A,good,average,good,0,16714199,0,,good,4,PSY230,"A really good professor. Clearly wants his students to do well. The tests are a little hard but if u do the work, its possible to do really well on them. The material is a bit tough but he clearly tries to make it very interesting!",01/12/2010,2.0,2.0,,4,Really into it,4.0,4.0,1,Yes,1263287924000,N/A,4928,N/A,,N/A,[],people,people
N/A,good,poor,good,0,16482923,0,,awesome,5,PSY230,"One of the easiest classes I have ever taken in University. Going to class isn't even mandatory, as everything he talks about is summarized in his lecture notes. The only reason to go to class is for the participation (8% of your mark). Definitely an interesting course.",12/07/2009,1.0,1.0,,5,Really into it,5.0,5.0,1,No,1260144747000,N/A,4928,N/A,,N/A,[],people,people
N/A,good,average,good,0,16280574,0,,awesome,4,PSY324,"I love this Prof! He's so nice and sweet! He is always helpful and he's so cute. I love his accent. It's a very small German accent, but it's there and it makes him sound so hot. He loves his wife so much... that lucky woman. Why only one son, make more babies! You're hot and smart... pass those genes on!",10/27/2009,2.0,2.0,,5,Really into it,4.5,4.5,1,Yes,1256685491000,N/A,4928,N/A,,N/A,[],people,people
N/A,good,average,good,0,16214984,0,,awesome,4,PSY230,"I am taking his course right now... he is wearing a red sweater and has that stupid smug on his face all the time.  God it really pisses me off.  However he is a great professor, the course seems like its going to be a GPA raiser and he is extremely helpful and wants everyone to do good in his course and enjoy it overall.  Great prof so far!",10/01/2009,2.0,2.0,,5,Really into it,4.5,4.5,1,Yes,1254401203000,N/A,4928,N/A,,N/A,[],people,people
N/A,good,poor,average,0,16182604,0,,average,4,PSY230,"He seems nice up front but in person, he's not as pleasant as I expected. He could've been more helpful. The course content itself is fairly straightforward though.",09/10/2009,1.0,1.0,,2,Really into it,3.0,3.0,1,Yes,1252612227000,N/A,4928,N/A,,N/A,[],people,people
N/A,good,average,good,0,16120410,0,,good,4,PSY230,"you can tell that he wants to help everyone learn. His accent makes it better/ when he sees the class is getting bored he doesnt just keep talking, he'll liven you up with a joke or two.",08/14/2009,2.0,2.0,,4,Sorta interested,4.0,4.0,1,No,1250249721000,N/A,4928,N/A,,N/A,[],people,people
N/A,good,average,good,0,15189336,0,,good,4,PSY230,very good class...the iclicker stuff keeps the class interesting...thankgod he isnt monotone otherwise the lectrues would be VERY boring...the textbook is easy to follow..tests all multiple choice...plus he givves 3 freebies!..which is always good...just make sure you know the lecture slides and his own notes PERFECTLY!! the asgns were very easy!!,12/14/2008,3.0,3.0,,4,Sorta interested,4.0,4.0,1,No,1229260987000,N/A,4928,N/A,,N/A,[],people,people
N/A,average,average,good,0,13893555,0,,good,3,PSY230,Great prof - is very concerned with how his teaching abilities may affect students' interest to study the course material. He tries to accommodate for students to the best of his ability. Grading is more than fair. Some students may be less motivated to study if they are not interested in the personality stream of psychology.,12/21/2007,2.0,2.0,,5,Sorta interested,4.0,4.0,1,No,1198264316000,N/A,4928,N/A,,N/A,[],people,people
N/A,good,average,good,0,13592376,0,,awesome,4,PSY230,"He is a understanding, wonderful prof. He isn't arrogant, and talks to students like they're important. He is also attractive and loves his son and wife. He's a family guy and a wonderful Prof. He's great at what he does. But focus on lectures and you'll do great",11/03/2007,3.0,3.0,,5,Sorta interested,4.5,4.5,1,Yes,1194066006000,N/A,4928,N/A,,N/A,[],people,people
N/A,good,poor,good,0,12827245,0,,awesome,5,PSYCHOLOG,"This teacher is very hot. His classes are very good as well. Easy to talk to, and very understanding.",01/29/2007,1.0,1.0,,5,It's my life,5.0,5.0,1,Yes,1170074255000,N/A,4928,N/A,,N/A,[],people,people
N/A,average,good,good,0,12783545,0,,good,3,PSY230,"This is a great course. The multiple choice questions are not that bad if you study his lectures very well. He gives three free multiple choice questions. And he's really understanding... he talks to the students and tries to help the best he can. His accent is sooo hot... it's german... so sexy! I agree, his wife is LUCKY!!",01/16/2007,4.0,4.0,,5,Really into it,4.0,4.0,1,No,1168991056000,N/A,4928,N/A,,N/A,[],people,people
N/A,good,average,good,0,12712567,0,,good,4,PSY230,"Great Prof, makes class fun to attend to hear his corny jokes. Provides good instruction for the term paper - hard MC questions thou!",01/03/2007,3.0,3.0,,4,Really into it,4.0,4.0,1,Yes,1167783526000,N/A,4928,N/A,,N/A,[],people,people
N/A,good,good,average,0,12538433,0,,good,4,PSY230,He's great cause he posts his full lecture notes.  only problem is that his tests are brutal!,12/06/2006,4.0,4.0,,3,Really into it,3.5,3.5,1,Yes,1165448531000,N/A,4928,N/A,,N/A,[],people,people
N/A,good,poor,good,0,11194432,0,,awesome,5,PSY230,"AMAZING prof. Hes really cute and makes silly jokes... they may  be bad, but theyre so bad that they're funny and at least you don't fall asleep in your chair. He makes the lectures interesting.",12/17/2005,1.0,1.0,,5,It's my life,5.0,5.0,1,N/A,1134785420000,N/A,4928,N/A,,N/A,[],people,people
N/A,average,poor,good,0,11102291,0,,good,3,PSY230,"He is hot, I have to say. Even hotter than professor Monks.",12/09/2005,1.0,1.0,,5,It's my life,4.0,4.0,1,N/A,1134135247000,N/A,4928,N/A,,N/A,[],people,people
N/A,good,average,good,0,11097573,0,,awesome,5,PSY230,"Prof. Schimmack is THE prime example of what it means to be an OUTSTANDING professor. Besides clearly being a nice, genuine, funny person, he knows exactly what to do to get students involved, is always more than willing to help, goes OUT OF HIS WAY to make the class fun, and puts HIS STUDENTS FIRST. His wife is a veryyyy LUCKY WOMAN. Great job!",12/08/2005,3.0,3.0,,5,It's my life,5.0,5.0,1,N/A,1134084448000,N/A,4928,N/A,,N/A,[],people,people
N/A,good,average,good,0,11056609,0,,awesome,5,PSY230,"His MCQ questions are quite hard. However, he is EXTREMELY HELPFUL compared to other psych profs(he told us exactly what he wanted in the term paper). The workload for this class is below average, the material isn't hard at all, and there is NO FINAL! He is quite funny and he does speak English very well. I love his colourful sweaters.",12/05/2005,2.0,2.0,,5,Low,5.0,5.0,1,N/A,1133803028000,N/A,4928,N/A,,N/A,[],people,people
N/A,average,good,average,0,11042715,0,,good,3,PSY230,"Prof Schimmack is kind of like a double edged sword. On one hand his tests are very difficult and ambiguous (not really due to his english skills) but more so because of the material. On the other hand, he is a really nice and understanding guy who gets what students go through. Work hard and you'll get a decent grade.",12/03/2005,4.0,4.0,,4,Meh,3.5,3.5,1,N/A,1133613276000,N/A,4928,N/A,,N/A,[],people,people
Mandatory,good,average,good,0,11021090,0,,good,4,PSY230,very nice prof...makes the class fun by making funny jokes...although sometimes the material itself can be boring...speaks english well!!..except tests are difficult..and there is A LOT OF WORK AND MATERIAL...it would be difficult to get a B...need to worker harder than most classes,11/30/2005,3.0,3.0,,4,Sorta interested,4.0,4.0,1,N/A,1133395065000,N/A,4928,N/A,,N/A,[],people,people
N/A,poor,average,average,0,10951810,0,,poor,1,PSY230,"Material is pointless, simply lectures that everything is partly due to genetics/environment (which is common sense).  However, his poor English makes tests a pain in the ass, though his assignments help inflate marks from the low class average of a C-.  If you study, you should be able to get at least a B",11/19/2005,3.0,3.0,,3,Really into it,2.0,2.0,1,N/A,1132362295000,N/A,4928,N/A,,N/A,[],people,people
N/A,good,average,good,0,3803942,0,,awesome,5,PSY230,best prof I ever had.,05/06/2005,3.0,3.0,,5,Sorta interested,5.0,5.0,3,N/A,1115400658000,N/A,4928,N/A,,N/A,[],people,people
N/A,good,poor,good,0,3775570,0,,awesome,5,PSY230,best prof I've ever had,05/03/2005,1.0,1.0,,5,Sorta interested,5.0,5.0,1,N/A,1115150475000,N/A,4928,N/A,,N/A,[],people,people
N/A,good,poor,good,0,3566179,0,,awesome,5,PSY327,"He's funny, approachable, and I consider him a top expert in his field. First few weeks are boring (half the class left the course). But the material DOES get very interesting later. Workload is ENORMOUS but easy! Tests are pure MC and easy. He's also willing to modify course for student's benefit.",04/05/2005,1.0,1.0,,5,It's my life,5.0,5.0,1,N/A,1112744395000,N/A,4928,N/A,,N/A,[],people,people
N/A,poor,good,poor,0,3506132,0,,awful,1,PSY327,awful awful class. i havent learned anything,03/26/2005,5.0,5.0,,1,It's my life,1.0,1.0,1,N/A,1111841407000,N/A,4928,N/A,,N/A,[],people,people
N/A,good,average,good,0,2929408,0,,awesome,5,PSY230327,"Very interesting professor..so cool, hip and enthusiastic. He's also young and cute too...and he's smart! *wink*",12/07/2004,2.0,2.0,,5,It's my life,5.0,5.0,1,N/A,1102382305000,N/A,4928,N/A,,N/A,[],people,people
N/A,good,good,good,0,2361414,0,,awesome,5,PSY327,Pretty good prof,08/02/2004,4.0,4.0,,5,N/A,5.0,5.0,1,N/A,1091482689000,N/A,4928,N/A,,N/A,[],people,people
N/A,good,average,good,0,2217068,0,,good,4,PSY327,"Hated the multiple choice, dragged my mark down greatly.  The essay was marked very hard.  I did much better in PSY230 than this class.",06/03/2004,3.0,3.0,,4,N/A,4.0,4.0,1,N/A,1086286086000,N/A,4928,N/A,,N/A,[],people,people
