attendance,clarityColor,easyColor,helpColor,helpCount,id,notHelpCount,onlineClass,quality,rClarity,rClass,rComments,rDate,rEasy,rEasyString,rErrorMsg,rHelpful,rInterest,rOverall,rOverallString,rStatus,rTextBookUse,rTimestamp,rWouldTakeAgain,sId,takenForCredit,teacher,teacherGrade,teacherRatingTags,unUsefulGrouping,usefulGrouping
Mandatory,good,good,good,0,32739041,0,,good,4,CCT210,Been my main man ever since CCT109 and as my TA for CCT110. I will admit he's become a far harder marker this year compared to last although I figure he may have just had a bad semester. Looking forward to having him again sometime,12/21/2019,4.0,4.0,,4,N/A,4.0,4.0,1,No,1576956663000,Yes,4928,Yes,,A-,"['Tough grader', 'Test heavy', 'Hilarious']",people,people
Mandatory,good,poor,good,0,32612257,0,,good,4,CCT210,"funny guy, makes course concepts easy to learn, approachable as well, clear grading, although he takes a while to answer emails, recommend just asking him after class!",12/11/2019,1.0,1.0,,4,N/A,4.0,4.0,1,No,1576090619000,Yes,4928,Yes,,N/A,"['Hilarious', 'Gives good feedback', 'Clear grading criteria']",people,people
Not Mandatory,good,poor,good,0,30296034,3,,awesome,5,CCT109,"Guys, I sincerely do not understand how you could not like Ryan. He's one of the chillest profs I've had! Amazing person, explains well, humorous,non-toxic, great lectures, posts slides, quick markings and soft on marking the exam. Just finished CCT109 with him - AMAZING bird course.",06/25/2018,1.0,1.0,,5,N/A,5.0,5.0,1,No,1529962880000,Yes,4928,Yes,,A-,"['Get ready to read', 'Gives good feedback', 'Hilarious']",people,people
Mandatory,poor,average,poor,2,29931702,0,,awful,1,VCC01,Regret taking his tutorial.,04/30/2018,3.0,3.0,,1,N/A,1.0,1.0,1,No,1525083518000,No,4928,Yes,,N/A,[],people,people
Mandatory,average,average,average,1,29614155,1,,poor,2,CCT210,"Not the worst, but certainly not the best. Doesn't seem to care about engaging or helping students.",03/02/2018,3.0,3.0,,2,N/A,2.0,2.0,1,No,1519995265000,No,4928,Yes,,A-,"[""Skip class? You won't pass."", 'Participation matters']",person,person
Mandatory,poor,average,poor,1,29607031,0,,awful,1,CCT109,"Marking takes forever to be returned, always a week or 2 after other TAs. Does not really connect with students. Marking is a bit tough. The worst thing is that he does not really seem to care for the student or try to help. Answers to questions are very condescending. Overall, regret taking his class., and will definitely avoid taking his classes.",02/28/2018,3.0,3.0,,1,N/A,1.0,1.0,1,No,1519838720000,No,4928,No,,B+,"[""Skip class? You won't pass."", 'Participation matters']",people,person
Mandatory,poor,good,poor,7,29389377,1,,awful,1,CCT210,"Ryan demonstrates that he decently understands course content. However, his marking, tutorial participation and instructions/directions can be very painful to deal with. The negative reputation comments that were mentioned by previous students of his tutorials was evident throughout the semester. Very tough marker and sometimes very ignorant.",01/04/2018,4.0,4.0,,1,N/A,1.0,1.0,1,No,1515085974000,No,4928,Yes,,N/A,"[""Skip class? You won't pass."", 'Tough grader']",person,people
