attendance,clarityColor,easyColor,helpColor,helpCount,id,notHelpCount,onlineClass,quality,rClarity,rClass,rComments,rDate,rEasy,rEasyString,rErrorMsg,rHelpful,rInterest,rOverall,rOverallString,rStatus,rTextBookUse,rTimestamp,rWouldTakeAgain,sId,takenForCredit,teacher,teacherGrade,teacherRatingTags,unUsefulGrouping,usefulGrouping
Mandatory,good,average,good,0,32036674,0,,good,4,FSL305,"Dr. Phillips is very encouraging; however, her lectures can get a bit dull. The class relies heavily on the textbook, and she assigns homework for every class. There are a lot of evaluations too. My issues are mostly with the course structure and not with Dr. Phillips.",06/18/2019,3.0,3.0,,4,N/A,4.0,4.0,1,Yes,1560860355000,Yes,4928,Yes,,A,"['Lots of homework', 'Participation matters', 'Test heavy']",people,people
Mandatory,good,average,good,0,29052544,0,,good,4,FSL305,"She's super nice, and if you're having a problem she would be more than happy to help you out. There is homework though, and it counts towards your mark.",12/05/2017,3.0,3.0,,4,N/A,4.0,4.0,1,Yes,1512498503000,Yes,4928,Yes,,N/A,"['Group projects', 'Accessible outside class', 'Gives good feedback']",people,people
Mandatory,poor,average,poor,0,27251201,0,online,awful,1,FSL205,Terrible,11/24/2016,3.0,3.0,,1,N/A,1.0,1.0,1,Yes,1479992667000,No,4928,Yes,,N/A,[],people,people
Mandatory,good,average,good,0,25485330,0,,awesome,5,FSL305,"I am currently taking FSL305 and I hear she teaches FSL205 as well and I think she is a REALLY AMAZING French professor. I hear about the others, and in comparison, she is really good. Really easy to talk to, very passionate about French culture and the language She got emotional some times :'( . If you have her, DO NOT SWITCH OUT!",11/24/2015,3.0,3.0,,5,It's my life,5.0,5.0,1,Yes,1448396697000,N/A,4928,Yes,,INC,"[""Skip class? You won't pass."", 'Participation matters', 'Gives good feedback']",people,people
Not Mandatory,good,average,good,1,25001121,0,,awesome,5,FRE181,"She is so nice! Had her for both FRE180 and FRE181, she's always there to help and she is good at explaining topics. Her tests are straightforward and help with showing you exactly where you need to improve.",06/27/2015,3.0,3.0,,5,It's my life,5.0,5.0,1,Yes,1435447844000,Yes,4928,Yes,,B+,"['Participation matters', 'Caring']",people,person
N/A,good,average,good,1,24587728,0,,awesome,5,FRE180,"Catherine Phillips is a down-to-earth great prof, her french is very clear -perfect for newbies to the language. She gives explanations for the TLF (Textes Littéraires Français) and genuinely cares about students' learning. She gets class participation where we get a chance to practice the language and participation marks. Would for sure recommend!",04/13/2015,3.0,3.0,,5,It's my life,5.0,5.0,1,Yes,1428947948000,N/A,4928,Yes,,N/A,[],people,person
