attendance,clarityColor,easyColor,helpColor,helpCount,id,notHelpCount,onlineClass,quality,rClarity,rClass,rComments,rDate,rEasy,rEasyString,rErrorMsg,rHelpful,rInterest,rOverall,rOverallString,rStatus,rTextBookUse,rTimestamp,rWouldTakeAgain,sId,takenForCredit,teacher,teacherGrade,teacherRatingTags,unUsefulGrouping,usefulGrouping
N/A,good,poor,good,0,22955351,0,,awesome,5,HIS326,"Wow, where to begin with Prof. Noel... Started the class with no interest in history, but she changed my mind! She has interesting handpicked articles for tutorials and 2 hour lectures with easy and interesting concepts. I have an 88 in this class right now... so if you're getting below that there's something wrong! Fair marker, great lessons!",03/27/2014,1.0,1.0,,5,Low,5.0,5.0,1,Yes,1395923460000,N/A,4928,N/A,,N/A,[],people,people
N/A,good,average,good,0,15509748,1,,awesome,5,HISHIS,best prof everrrr,03/05/2009,2.0,2.0,,5,It's my life,5.0,5.0,1,Yes,1236276282000,N/A,4928,N/A,,N/A,[],person,people
N/A,good,average,good,0,13779020,0,,good,4,HIS461,"awesome prof, very helpful and really knows what shes talking about!",12/08/2007,2.0,2.0,,4,Sorta interested,4.0,4.0,1,No,1197151775000,N/A,4928,N/A,,N/A,[],people,people
N/A,good,average,good,0,13337188,0,,awesome,4,HIS326,she is good! makes life easy when you hand in late essays! only 1% a day and is not inclusive of weekends!. Tests are ok but make sure you know your material but she tells you what to study and there is a choice. Please attend the tutorial and read before you go! they can help you when you are too lazy to study for the course when exam comes.,07/17/2007,2.0,2.0,,5,Low,4.5,4.5,1,Yes,1184708282000,N/A,4928,N/A,,N/A,[],people,people
N/A,good,poor,good,0,11301490,0,,awesome,5,CANADIANHISTOR,Very Easy.,01/04/2006,1.0,1.0,,5,It's my life,5.0,5.0,1,N/A,1136387173000,N/A,4928,N/A,,N/A,[],people,people
N/A,good,good,average,0,3644623,0,,good,4,HIS262,"Know her stuff and is expecting you to know it too. Leans a little too much toward the gender studies side of things, but nonetheless a good and enjoyable instructor.",04/17/2005,4.0,4.0,,3,Really into it,3.5,3.5,1,N/A,1113742840000,N/A,4928,N/A,,N/A,[],people,people
