attendance,clarityColor,easyColor,helpColor,helpCount,id,notHelpCount,onlineClass,quality,rClarity,rClass,rComments,rDate,rEasy,rEasyString,rErrorMsg,rHelpful,rInterest,rOverall,rOverallString,rStatus,rTextBookUse,rTimestamp,rWouldTakeAgain,sId,takenForCredit,teacher,teacherGrade,teacherRatingTags,unUsefulGrouping,usefulGrouping
Mandatory,good,average,good,0,29079236,0,,good,4,HIS339,"Knows the topic of Post-war Germany very well, a very note intensive course as she doesn't post lecture slides just outlines, wants her class to do well and gives information on what to know",12/07/2017,3.0,3.0,,4,N/A,4.0,4.0,1,Yes,1512647483000,Yes,4928,Yes,,N/A,"['Amazing lectures', 'Get ready to read']",people,people
Not Mandatory,good,average,good,0,24696480,0,,awesome,5,HIS339,"Good Professor to teach a Holocaust class. She really knows her stuff, and actually looks like she loves to teach and help her students understand. She will help you if you ask her for help, go to her office hours rather than email. She does have a funny side which rarely comes out. Grades fair, and over all very nice.",04/29/2015,2.0,2.0,,4,It's my life,4.5,4.5,1,Yes,1430315774000,Yes,4928,Yes,,N/A,"['Clear grading criteria', 'So many papers']",people,people
N/A,good,good,good,0,22493860,0,,awesome,5,HIS338,"Probably one of the best profs at UTM. She makes lectures engaging by noting out the opposing points of view for every topic. You will definitely leave every lecture with an opinion on the topic. She expects a lot from essays, but if you were as interested in the course as I was, then you will have no problem putting enough work into your paper.",12/10/2013,4.0,4.0,,5,It's my life,5.0,5.0,1,Yes,1386692288000,N/A,4928,N/A,,N/A,[],people,people
N/A,good,average,good,0,19658518,0,,awesome,5,HIS338,"good lectures, very interesting. she makes the class more interesting because of her passion for the subjects",01/03/2012,3.0,3.0,,4,Really into it,4.5,4.5,1,Yes,1325594168000,N/A,4928,N/A,,N/A,[],people,people
N/A,good,good,good,0,19374649,0,,awesome,5,HIS338,"her lectures are SO interesting. she's apparently one of the worlds top experts on WW2. very insightful, though her tests are sometimes hard. tutorial gives you an easy 20%",12/04/2011,4.0,4.0,,4,Really into it,4.5,4.5,1,Yes,1322997228000,N/A,4928,N/A,,N/A,[],people,people
N/A,good,average,good,0,18981543,0,,awesome,5,HIS339,Fairly good prof who teaches an interesting course. Clear lecturer. Tests or assignments aren't hard but don't expect an A unless you're a good writer. Decent amount of reading but not above avg for a history course.,09/06/2011,3.0,3.0,,4,Really into it,4.5,4.5,1,Yes,1315327475000,N/A,4928,N/A,,N/A,[],people,people
N/A,average,good,average,0,17877019,0,,average,3,HIS338,"Teaches a course on the Holocaust during WWII, and consistently proves that she knows the topic very well.I was extremely grateful for the lack of pictures used during the course, because the topic is gruesome enough. Professor Wittmann is exceptionally unhelpful when if comes to student questions about the course. Poor TA choice as well.",12/07/2010,4.0,4.0,,2,Sorta interested,2.5,2.5,1,No,1291729445000,N/A,4928,N/A,,N/A,[],people,people
